标题,标题链接,查看数,参与数,需求价格,状态,需求方,需求文本,发布时间,完成时间,任务编号,交易价格,工作周期,设计师地点,设计师,字段1_link,详情标题,字段1,字段1_link1,设计师类型,设计师等级,设计师信用,交易总次数,交易总金额,详情标题1,字段2,服务1,价格1,服务2,价格2,服务3,价格3,服务4,价格4,服务5,价格5,服务6,价格6,服务7,价格7,服务8,价格8,服务9,价格9,能力标签
【项目策划】街道改造招商计划书撰写,https://task.epwk.com/448368/,2742人,10人,1000元以内,圆满完成,青锋幻灵,公司有一段街道准备做招商计划书，大概的框架已经出来了，就是要加上文字润色，不需要太复杂！有了设计图可以看，记得兄弟们，这个是给投资者看的。 有一定实力，有做过类似的，泉州、厦门地区的服务商优先。,2016-09-27,2016.11.21,任务编号：448368,700.0,"3天,7天,7天,3天,3天,2天,10天,5天","广东省-深圳市-罗湖区,北京市-北京市-丰台区,山东省-济宁市-任城区,山西省-运城市-永济市,福建省-厦门市-思明区,河北省-唐山市-路北区,山西省-晋城市-高平市,辽宁省-沈阳市-市辖区",蓝凤凰品牌策划,https://shop.epwk.com/m7d7wgr4k5q8/,,,,,,,,,,,,,,,,,,,,,,,,,,,,,项目策划
【宣传策划】撰写会员注册的活动文案,https://task.epwk.com/447882/,5394人,22人,1000元以内,圆满完成,mf130****8936,活动内容：针对目标行业的从业人员，希望其关注我公司公众号，并注册成为会员，马上得红包奖励，后期如有业务信息的合作，有长期收益，推荐他人当时有红包奖励，而且后期有关联受益。文案要求：用抢眼的标题、精炼的文字（限150-200字）描述清楚以上活动内容；站在目标行业从业人员的角度，要尽量体现其用户思维。,2016-09-25,2016.10.11,任务编号：447882,400.0,"2天,3天,3天,2天,2天,7天,3天,2天,7天,3天,3天,3天","澳门-澳门-澳门,湖北省-武汉市-武昌区,广东省-广州市-市辖区,黑龙江省-大庆市-让胡路区,山东省-青岛市-城阳区,上海市-市辖区-黄浦区,广东省-汕尾市-陆丰市,湖北省-武汉市-江岸区,山东省-济宁市-任城区,江苏省-南通市-海门市,湖南省-长沙市-岳麓区,上海市-市辖区-浦东新区",B&G knowledge.(比格知识工作室),https://shop.epwk.com/omdwkk9gmdrp/,,,,,,,,,,,,,,,,,,,,,,,,,,,,,宣传策划
【商业提案】app商业计划书撰写,https://task.epwk.com/446640/,1462人,1人,1000元以内,圆满完成,mf279****97,app商业计划书撰写，方便合伙人看和招商商家入驻可以使用的，具体的详谈！,2016-09-19,2016.10.10,任务编号：446640,500.0,3天,辽宁省-沈阳市-市辖区,紫彧营销咨询机构,https://shop.epwk.com/p05qjj3xydev/,,,,,,,,,,,,,,,,,,,,,,,,,,,,,商业提案
【宣传策划】宣传画册文案写作,https://task.epwk.com/445989/,4062人,13人,1000元以内,圆满完成,o57d7d335e4a9b,集团公司做宣传画册，需要有人帮我们写一下整个画册的文案。具体内容联系沟通,2016-09-13,2016.09.28,任务编号：445989,600.0,"5天,5天,7天,7天,7天,3天,5天,3天,3天,7天,5天","四川省-遂宁市-市辖区,山东省-青岛市-市北区,江苏省-苏州市-吴中区,上海市-市辖区-浦东新区,广东省-广州市-白云区,湖南省-长沙市-芙蓉区,辽宁省-本溪市-明山区,浙江省-温州市,山西省-晋中市-市辖区,河北省-唐山市-路北区,辽宁省-沈阳市-市辖区",咪兔文化工作室,https://shop.epwk.com/z2nkzzr8qnqy/,,,,,,,,,,,,,,,,,,,,,,,,,,,,,宣传策划
【宣传策划】微信推广软文撰写,https://task.epwk.com/444753/,2608人,12人,1000元以内,圆满完成,肥婆兰01,写篇微信推广软文，价格在150左右的，QQ联系,2016-09-07,2016.09.12,任务编号：444753,188.0,"3天,2天,2天,1天,3天,3天,3天,1天,1天,3天,3天","上海市-市辖区-浦东新区,山西省-晋中市-市辖区,广东省-深圳市-市辖区,山东省-临沂市-兰山区,江苏省-苏州市-吴中区,江苏省-苏州市-吴中区,山西省-运城市-永济市,湖南省-长沙市-天心区,重庆市-县-荣昌县,北京市-北京市-西城区,江西省-吉安市-青原区",半盏茶味工作室,https://shop.epwk.com/omdwkkvxwdrp/,,,,,,,,,,,,,,,,,,,,,,,,,,,,,宣传策划
【专业代笔】关于IT文章修改,https://task.epwk.com/443399/,4441人,27人,3000-5000元,圆满完成,mf180****9556,有一篇关于IT方便的文章需要找人修改，具体文章内容加Q或者加微信。如果有可以做的具体加Q或者电话详聊，本人定当酬谢，价格好商议，很急。,2016-08-31,2016.12.08,任务编号：443399,3000.0,"14天,1天,5天,1天,1天,2天,5天,7天,5天,5天,3天","湖南省-常德市,广东省-中山市-中山市,广东省-惠州市-惠阳区,宁夏-固原市-原州区,安徽省-阜阳市-颍州区,北京市-北京市-东城区,上海市-市辖区-浦东新区,北京市-北京市-西城区,山东省-青岛市-市北区,山西省-晋中市-市辖区,四川省-成都市-武侯区",云间月文化工作室,https://shop.epwk.com/7lngqq7j3dmr/,,,,,,,,,,,,,,,,,,,,,,,,,,,,,专业代笔
【品牌故事】个人自传撰写,https://task.epwk.com/443376/,3031人,14人,1000元以内,圆满完成,妮妮2014,要写一篇个人自传，字数在3-4页纸，共就是6-8版。具体详谈,2016-08-31,2016.09.06,任务编号：443376,200.0,"3天,8天,5天,10天,7天,3天,5天,10天,5天,5天,3天","山西省-晋城市-高平市,黑龙江-黑河市-北安市,北京市-北京市-东城区,江西省-九江市-浔阳区,安徽省-铜陵市-郊　区,浙江省-杭州市-西湖区,甘肃省-定西市-安定区,北京市-北京市-丰台区,广东省-珠海市-市辖区,山西省-运城市-永济市,湖南省-长沙市-芙蓉区",琪勉文案工作室,https://shop.epwk.com/0z5o4zvkonjq/,琪勉文案工作室,出售服务,https://shop.epwk.com/0z5o4zvkonjq/chushou/,工作室,七品,40分,,,琪勉文案工作室,,翻译,"￥500
            /件",LOGO制作,"￥500
            /件",取名起名,"￥500
            /件",毕业文章撰写,"￥999
            /件",品牌故事,"￥588
            /件",演讲稿,"￥300
            /件",公文写作,"￥300
            /件",企业文案,"￥300
            /件",文案策划,"￥999
            /件",品牌故事
【宣传策划】手机直播APP校园推广文案撰写,https://task.epwk.com/442699/,3905人,18人,1000元以内,圆满完成,黛影网红,根据公司的要求，整理出一份有条理 有吸引力的文案工期：3天内价格：再议具体投标联系,2016-08-28,2016.09.01,任务编号：442699,300.0,"2天,2天,2天,3天,3天,3天,3天,3天,2天,3天,1000天","上海市-市辖区-普陀区,河南省-周口市,天津市-市辖区,福建省-厦门市-湖里区,湖北省-荆州市-荆州区,江苏省-常州市-天宁区,湖南省-长沙市-芙蓉区,四川省-成都市-锦江区,河北省-唐山市-路北区,山西省-晋中市-榆次区,湖北省-恩施土家族苗族自治州-恩施市",茕海工作室,https://shop.epwk.com/2j5xooy1g5xm/,,,,,,,,,,,,,,,,,,,,,,,,,,,,,宣传策划
【专业代笔】10KV电力系统谐波污染文章修改,https://task.epwk.com/438718/,387人,11人,1000-3000元,圆满完成,xzx1015,10KV电力系统谐波污染问题研究论文已经写了，但是查重率太高，要求查重率不高于20%。,2016-08-07,2016.08.14,任务编号：438718,1000.0,"10天,30天,5天,3天,5天,3天,31天,3天,3天","四川省-阿坝藏族羌族自治州-若尔盖县,四川省-成都市-新都区,江西省-九江市-市辖区,山西省-晋城市-高平市,四川省-绵阳市-涪城区,浙江省-宁波市-北仑区,安徽省-合肥市-蜀山区,江苏省-常州市-天宁区,辽宁省-大连市-甘井子区",云间月文化工作室,https://shop.epwk.com/7lngqq7j3dmr/,,,,,,,,,,,,,,,,,,,,,,,,,,,,,专业代笔
【品牌故事】“蛙湘何”牛蛙火锅店小故事征集,https://task.epwk.com/437954/,2947人,4人,1000元以内,圆满完成,mf186****9333,我原本的招牌是叫何记香辣跳跳蛙何记香辣跳跳蛙在衡阳很出名的然后呢我想何记给我老公管，我想从新换这个蛙湘何来弄，就是要让别人知道这个蛙湘何跟何记香辣跳跳蛙是一个味道就像王老吉跟加多宝一样希望能针对“蛙湘何”这三个字写篇小故事,2016-08-03,2016.08.07,任务编号：437954,800.0,"5天,3天,3天","江苏省-苏州市-吴中区,福建省-福州市-连江县,北京市-北京市-丰台区",合赢堂工作室,https://shop.epwk.com/9w56eeryedv1/,,,,,,,,,,,,,,,,,,,,,,,,,,,,,品牌故事
【产品卖点】新品营销文案撰写,https://task.epwk.com/435178/,3297人,12人,1000元以内,圆满完成,alan2016,程视频直播平台，可应用于农业生产基地，养殖场，敬老院，教育机构，企业管理、展示型企业、连锁超市、幼儿园视频直播，连锁店远程可视化管理、农业可视化管理，教学视频直播，景点远程视频直播，微展销，微直播等等等多种行业。现全国各地招有实力的合作伙伴，合作伙伴可以使用定制定自己的品牌logo 。并且对所有用户提供7天免费试用30人同时在线微信视频直播。只需要有自己的公众帐号，就可以让用户关注公众帐号便可进行远程视频观看。,2016-07-20,2016.08.01,任务编号：435178,600.0,"5天,10天,10天,3天,7天,1天,3天,3天,3天,2天","甘肃省-兰州市-城关区,陕西省-西安市-雁塔区,浙江省-衢州市-龙游县,河北省-廊坊市-三河市,辽宁省-鞍山市-市辖区,河北省-石家庄市-新华区,北京市-北京市-东城区,湖南省-长沙市-芙蓉区,浙江省-杭州市-西湖区,北京市-北京市-丰台区",威客阿D-软文新闻稿文案设计品牌推广,https://shop.epwk.com/09drj70x153w/,,,,,,,,,,,,,,,,,,,,,,,,,,,,,产品卖点
【商业提案】编写互联网融资企划书,https://task.epwk.com/430536/,2251人,13人,3000-5000元,圆满完成,o573d9f9b8cb50,我们想做一个互联网平台，有了一些构思和想法，但是还需要专业人士提供专业的建议，最后以企划书的形式呈现。,2016-06-28,2016.12.09,任务编号：430536,3000.0,"7天,7天,10天,5天,10天,15天,15天,5天,2天,3天,7天,25天","安徽省-芜湖市-镜湖区,福建省-厦门市-同安区,河南省-新乡市-牧野区,福建省-厦门市-集美区,广东省-深圳市-罗湖区,北京市-北京市-朝阳区,广东省-深圳市-南山区,山东省-烟台市-莱山区,广东省-广州市-天河区,河北省-石家庄市-新华区,四川省-成都市-市辖区,广东省-江门市-蓬江区",思睿观通创融服务,https://shop.epwk.com/78n96oe98nkv/,,,,,,,,,,,,,,,,,,,,,,,,,,,,,商业提案
【商业提案】全自动灌装封口码垛生产线宣传软文撰写,https://task.epwk.com/429356/,2484人,13人,1000元以内,圆满完成,mf138****1978,"软文主要围绕“全自动”来写，要以设备主要功能：分桶、灌装、分盖上盖封口、贴标、码垛在为主，适用行业行业广泛，软文要求：1、用于产品画册宣传、3、要求原创(不能在网上搜了抄袭)，文笔或专业，或幽默，或结合时事，具备新闻性皆可。不要做的太像推广。4、附上创意说明。知识产权说明：1、所设计的作品为原创，为第一次发布，未侵犯他人的著作权，如有侵犯他人著作权，由设计者承担所有法律责任;2、中标的设计作品，我方支付设计制作费，即拥有该作品的知识产权，包括著作权,使用权和发布权等,有权对设计作品进行修改,组合和应用;设计者不得再向其他任何地方使用该设计作品;",2016-06-22,2016.07.13,任务编号：429356,500.0,"3天,8天,3天,2天,3天,1天,3天,8天,10天,1天,5天","辽宁省-沈阳市-和平区,甘肃省-定西市-市辖区,山西省-晋中市-市辖区,陕西省-西安市-未央区,山东省-潍坊市-寿光市,四川省-成都市-武侯区,湖南省-长沙市-芙蓉区,江苏省-南通市-海门市,北京市-北京市-丰台区,河北省-石家庄市-新华区,福建省-福州市-台江区",云笙文案,https://shop.epwk.com/v0n1xrkvx57y/,,,,,,,,,,,,,,,,,,,,,,,,,,,,,商业提案
【宣传策划】生物类文案撰写,https://task.epwk.com/429046/,3729人,11人,1000元以内,圆满完成,mf158****0486,工作内容：生物行业内相关文案具体细节待沟通。要求是分子生物学、医学、遗传学或者生物方面的服务商来承接。,2016-06-21,2016.08.12,任务编号：429046,300.0,"2天,3天,3天,10天,7天,2天,7天,2天,3天,1天,7天","四川省-成都市-市辖区,山东省-菏泽市-郓城县,安徽省-蚌埠市-蚌山区,江西省-赣州市-市辖区,河北省-张家口市-桥东区,河南省-河南省直辖县级行政单位-济源市,广东省-广州市-白云区,湖南省-怀化市-洪江市,湖南省-长沙市-芙蓉区,河北省-石家庄市-新华区,福建省-福州市-台江区",小白文字工作室,https://task.epwk.com/javascript:;,,,,,,,,,,,,,,,,,,,,,,,,,,,,,宣传策划
【产品卖点】入木三分的产品对比文案撰写,https://task.epwk.com/426834/,2702人,7人,1000元以内,圆满完成,zhiyuyg,文案思路：1.多角度阐释304食品级不锈钢与201工业不锈钢两种原材料做成无塔供水器（压力罐）的区别。2.文案内容通俗易懂，比喻恰当，能让非专业人士通过文案清晰的感受到两者的天壤之别。3.避免复制大量的专业性数据和生硬参数来对比。4.对比的内容不限，可以是人物，可以是事物（要求形象且精准）文案字数：1.控制在200-500字之间（越精短越好，用最少的字描述最详细的信息，传达最精准的信息）文案参考：1.基础数据：参照百度文库2.引用内容：参考阿里巴巴和淘宝商品（从材质到定价等等的区别）3.将上述内容转化为自己独特的解说方式，能让人很直观的了解区别所在。关于佣金：请根据文案需求和自身情况做出合理报价。,2016-06-11,2016.06.15,任务编号：426834,200.0,"3天,1天,2天,3天,3天,3天,5天","四川省-成都市,河北省-石家庄市-新华区,福建省-福州市-福清市,福建省-福州市-台江区,广东省-江门市,山东省-潍坊市-寿光市,湖北省-武汉市-武昌区",云间月文化工作室,https://shop.epwk.com/7lngqq7j3dmr/,,,,,,,,,,,,,,,,,,,,,,,,,,,,,产品卖点
【其他内容创作】婚礼策划,https://task.epwk.com/425230/,5382人,7人,1000元以内,圆满完成,mf177****0243,"要求：
1、形式以西式为主
2、在室内举行
3、婚礼预算5W左右",2016-06-02,2016.06.13,任务编号：425230,100.0,"2天,5天,5天,5天,3天,5天","上海市-市辖区-黄浦区,福建省-福州市-台江区,甘肃省-兰州市-城关区,四川省-眉山市-东坡区,福建省-宁德市-福安市,山东省-枣庄市-峄城区",niuge,https://task.epwk.com/javascript:;,,,,,,,,,,,,,,,,,,,,,,,,,,,,,其他内容创作
【专业代笔】毕业论文写作,https://task.epwk.com/425156/,2660人,2人,1000元以内,圆满完成,慢慢沉淀,毕业论文写作。具体加Q详谈。，,2016-06-01,2016.06.04,任务编号：425156,750.0,"2天,1天","云南省-昆明市-呈贡县,广东省-广州市-市辖区",三个人品牌策划机构,https://shop.epwk.com/9w56eem3wdv1/,,,,,,,,,,,,,,,,,,,,,,,,,,,,,专业代笔
【宣传策划】招生广告宣传策划,https://task.epwk.com/424626/,2991人,14人,1000元以内,圆满完成,o55a7****08600,书法培训招生广告文案。要求：1、要求了解家长的心理及正真的需求。 2、要有冲击力让家长看了正是他们所需要的。 3、充分表达我们的优势。 4、原创作品要有耳目一新的感觉。 5、忌无痛呻吟、千篇一律的作品。,2016-05-30,2016.06.06,任务编号：424626,260.0,"3天,3天,3天,1天,5天,5天,7天,3天,3天,2天,6天","福建省-福州市-台江区,北京市-北京市-大兴区,广东省-广州市-番禺区,广东省-汕尾市-陆丰市,北京市-北京市-丰台区,广东省-茂名市-茂南区,云南省-昆明市-五华区,山东省-潍坊市-寿光市,北京市-北京市-朝阳区,山东省-潍坊市-寿光市,河南省-濮阳市-濮阳县",小Q文案工作室,https://shop.epwk.com/09drjjo9l53w/,,,,,,,,,,,,,,,,,,,,,,,,,,,,,宣传策划
【商业提案】项目申报材料撰写,https://task.epwk.com/424334/,2511人,14人,1000元以内,圆满完成,sjyzd1996,项目申报材料撰写，具体预算和内容详谈,2016-05-28,2016.06.20,任务编号：424334,800.0,"7天,3天,5天,9天,3天,7天,6天,10天,7天,3天,2天","浙江省-杭州市-萧山区,吉林省-四平市-铁西区,广东省-江门市,广东省-韶关市-仁化县,湖南省-长沙市-芙蓉区,山东省-德州市-市辖区,河南省-濮阳市-濮阳县,吉林省-长春市-南关区,福建省-福州市-台江区,山东省-潍坊市-潍城区,上海市-市辖区-长宁区",威客阿D-软文新闻稿文案设计品牌推广,https://shop.epwk.com/09drj70x153w/,,,,,,,,,,,,,,,,,,,,,,,,,,,,,商业提案
【品牌故事】按照给出的标题和字词编写文章内容,https://task.epwk.com/423306/,3324人,30人,1000元以内,圆满完成,adeng88,伪原创，要求伪原创文章每星期不小于20编至25编之内，按我们给出的标题和字词，编写描术出我们要求的文章内容，我们站点www.jujaz.com注：要熟悉以上专业的团体或个人，价格自由成实报上，我们会择优选取，每一项都可以单独报名，以上是我们的网站和我们的联系qq人太多请上班时间电话联系祥谈。,2016-05-24,2016.06.07,任务编号：423306,130.0,"7天,2天,3天,5天,7天,10天,5天,7天,7天,1天,3天","浙江省-杭州市-萧山区,上海市-市辖区-黄浦区,山东省-聊城市-临清市,陕西省-西安市-未央区,河北省-邯郸市-峰峰矿区,甘肃省-酒泉市-肃州区,陕西省-西安市-新城区,黑龙江-哈尔滨市-香坊区,辽宁省-沈阳市-铁西区,广东省-惠州市-惠城区,江苏省-扬州市-广陵区",威客阿D-软文新闻稿文案设计品牌推广,https://shop.epwk.com/09drj70x153w/,,,,,,,,,,,,,,,,,,,,,,,,,,,,,品牌故事
【品牌故事】经济管理类写作,https://task.epwk.com/422726/,1538人,2人,1000元以内,圆满完成,o573e3155d1678,本科文章撰写，经济管理类，5000字。相似率小于30%,2016-05-20,2016.05.26,任务编号：422726,400.0,"5天,4天","山东省-济南市-市辖区,湖南省-怀化市-洪江市",苏子陌的威客小铺,https://shop.epwk.com/m7d7wmk9y5q8/,,,,,,,,,,,,,,,,,,,,,,,,,,,,,品牌故事
【品牌故事】连锁餐饮品牌推广文案撰写,https://task.epwk.com/421663/,1519人,2人,1000元以内,圆满完成,mf159****7275,本公司从事餐饮品牌连锁。目前大概需要十篇左右的网络媒体软文，和两个品牌故事，请大家踊跃参加，也可长期合作。,2016-05-15,2016.05.20,任务编号：421663,600.0,"4天,7天","广东省-汕尾市-陆丰市,福建省-福州市-台江区",高易策划,https://shop.epwk.com/zqdpl4gpkn1v/,高易策划,出售服务,https://shop.epwk.com/zqdpl4gpkn1v/chushou/,工作室,七品,40分,,,高易策划,,公司起名设计服务,价格面议,宝宝起名服务,价格面议,店铺命名服务,价格面议,品牌起名,价格面议,LOGO原创设计,价格面议,网店美化设计,"￥1
            /次",广告语创作,"￥1
            /次",软文写作,价格面议,,,品牌故事
【商业提案】化妆品品牌官方网站上文案内容编纂,https://task.epwk.com/420875/,1639人,1人,1000元以内,圆满完成,唯由她专业护肤,需要编纂公司简介，公司文化，品牌物语等其他，加沟通详谈,2016-05-11,2016.05.15,任务编号：420875,200.0,5天,北京市-北京市-朝阳区,执笔听风,https://task.epwk.com/javascript:;,,,,,,,,,,,,,,,,,,,,,,,,,,,,,商业提案
【项目策划】设计一份项目策划,https://task.epwk.com/420818/,3598人,8人,1000-3000元,圆满完成,电商平台,目前有一个电子商务网站的O2O提案。希望找人帮忙制作一份策划，提交投资人审核。不需要太繁琐。具体相关材料雇主提供。工期：2~3天价格：再议,2016-05-11,2016.05.19,任务编号：420818,1000.0,"7天,3天,3天,2天,7天,3天,7天","上海市-市辖区-闸北区,上海市-市辖区-黄浦区,贵州省-贵阳市-乌当区,福建省-厦门市-同安区,广东省-韶关市-仁化县,山东省-泰安市-泰山区,江苏省-苏州市-虎丘区",越陌网络,https://shop.epwk.com/4rn8q1q8gngm/,越陌网络,出售服务,https://shop.epwk.com/4rn8q1q8gngm/chushou/,企业,一品,40分,,,越陌网络,,网站建设/app订制/ico众筹区块链/P2P订制开发,"￥9800
            /起",直播室/美女直播/游戏直播/VR直播/金融直播系统,￥18000,云购夺宝网站系统定制开发,"￥18000
            /件",APP平台开发/金融APP/O2O平台客户端/APP开发定制,"￥28000
            /件",LOGO设计,"￥4800
            /次",金融网贷P2P整套/理财系统/互联网金融平台/p2c网站开发,68000,定制功能网站,20000,企业站综合性信息展示站,"￥3500
            /件",电子商务/商城网站私享定制/B2B2C商城建设,18000,项目策划
【商业提案】撰写一份工作流程,https://task.epwk.com/420253/,1892人,4人,1000元以内,圆满完成,星期天的小猫,汽车维修行业售后工作流程一份，要求部门衔接紧密，权责分明，赏罚分明。具体私下交流。,2016-05-08,2016.05.11,任务编号：420253,500.0,"2天,7天,5天,3天","山东省-济南市-市辖区,河南省-郑州市-金水区,四川省-南充市-高坪区,山东省-潍坊市-寿光市",苏子陌的威客小铺,https://shop.epwk.com/m7d7wmk9y5q8/,,,,,,,,,,,,,,,,,,,,,,,,,,,,,商业提案
【宣传策划】PPT设计和修改,https://task.epwk.com/418297/,1733人,2人,1000-3000元,圆满完成,叫我小王子,想给公司设计一款PPT，要求完全原创，不套用模板。有能力的请留言联系。,2016-04-27,2016.04.27,任务编号：418297,1000.0,1天,天津市-市辖区-和平区,厦门半蓝品牌设计 —— 洞见 · 智变,https://shop.epwk.com/7g5ykkqq9n0q/,厦门半蓝品牌设计 —— 洞见 · 智变,出售服务,https://shop.epwk.com/7g5ykkqq9n0q/chushou/,企业,四品,43分,,,厦门半蓝品牌设计 —— 洞见 · 智变,,LOGO/VIS设计,价格面议,广告画册设计,价格面议,创意海报设计,价格面议,产品包装设计,价格面议,,,,,,,,,,,宣传策划
【品牌故事】减肥美食类软文征稿,https://task.epwk.com/418105/,3603人,36人,1000元以内,圆满完成,csyd,软文主要围绕“减肥美食”来写，内容要有科普性质(可参考淘宝头条文章)，不能太过于做作.要有针对性。软文要求：1、文章内容以减肥美食等科普内容为主，要站着减肥人群的角度，视角要求独特；2、软文将用于发布在各种行业论坛及博客，标题党最佳，标题和内容绝对不能有广告味，要能引起点击和共鸣，能吸引网友参与讨论或点击浏览；3、文章要有吸引力，有趣味性， 要站在用户的角度来描写，帖子内容与标题给人感觉以个人感受、经验分享或消费经历为表现形式；4、要求原创(不能在网上搜了抄袭)，文笔或专业，或幽默，或结合时事，具备新闻性皆可。,2016-04-26,2016.05.22,任务编号：418105,100.0,"2天,5天,7天,7天,3天,10天,6天,3天,8天,6天,8天","广东省-广州市,云南省-大理白族自治州-大理市,上海市-市辖区-黄浦区,河南省-濮阳市-清丰县,吉林省-长春市-朝阳区,广东省-佛山市-禅城区,河南省-濮阳市-濮阳县,江苏省-扬州市-邗江区,湖南省-株洲市-天元区,河北省-邯郸市-武安市,广东省-深圳市-宝安区",戴小烦的字铺子,https://shop.epwk.com/09drjjpv153w/,戴小烦的字铺子,出售服务,https://shop.epwk.com/09drjjpv153w/chushou/,工作室,六品,36分,,,戴小烦的字铺子,,,,,,,,,,,,,,,,,,,,品牌故事
【产品卖点】产品文案编写,https://task.epwk.com/417649/,3191人,24人,1000元以内,圆满完成,Mr135****7332,用手机扫描设备铭牌上的纸箱上的二维码登陆网站，也可用一些小物件（如钥匙扣上印二维码）送给潜在的客户就能直接进入网站了。价格详谈,2016-04-24,2016.05.06,任务编号：417649,700.0,"3天,8天,3天,7天,2天,5天,7天,6天,3天,5天,2天,5天","山东省-泰安市,广东省-深圳市-宝安区,辽宁省-辽阳市-文圣区,浙江省-杭州市-富阳市,江西省-南昌市-青山湖区,北京市-北京市-东城区,江苏省-南京市-江宁区,安徽省-合肥市-蜀山区,江苏省-南京市-栖霞区,内蒙古-乌海市-海勃湾区,安徽省-宣城市-旌德县,河南省-濮阳市-濮阳县",泰安尚水文化传媒有限公司,https://shop.epwk.com/j7n3833e35e1/,泰安尚水文化传媒有限公司,出售服务,https://shop.epwk.com/j7n3833e35e1/chushou/,企业,四品,30分,,,泰安尚水文化传媒有限公司,,书籍著述,100,电子政务,180,网店策划,100,自媒体发布,"￥100
            /次",法律诉讼文书写作,1500,jpeg\png等格式转换为word,200,应用文案,100,工作陈述,150,文学作品创作,150,产品卖点
