标题,标题链接,查看数,参与数,需求价格,状态,需求方,需求文本,发布时间,完成时间,任务编号,交易价格,工作周期,设计师地点,设计师,字段1_link,详情标题,字段1,字段1_link1,设计师类型,设计师等级,设计师信用,交易总次数,交易总金额,详情标题1,字段2,服务1,价格1,服务2,价格2,服务3,价格3,服务4,价格4,服务5,价格5,服务6,价格6,服务7,价格7,服务8,价格8,服务9,价格9,能力标签
【营销推广软文】正能量视频需要找人帮忙写文案,https://task.epwk.com/1121726/,628人,1人,1000元以内,选标中,A任务编号：1121726,正能量视频需要找人帮忙写文案。长期合作，团队服务商，具体详谈,2025-05-09,,任务编号：1121726,800.0,7天,山东省-青岛市,B任务编号：1121726,,,,,,,,,,,,,,,,,,,,,,,,,,,,,,营销推广软文
【广告策划】新款服装拍摄模特,https://task.epwk.com/1119424/,229人,0人,1000元以内,投标中,A任务编号：1119424,寻   服装拍摄模特，限年轻女士，限厦门市，长相甜美。根据开发的新款服饰，配合拍摄款式照片及衣服卖点视频。,2025-04-18,,任务编号：1119424,1000.0,,,B任务编号：1119424,,,,,,,,,,,,,,,,,,,,,,,,,,,,,,广告策划
【宣传策划】家政平台宣传文案,https://task.epwk.com/1076350/,9604人,1人,1000-3000元,工作中,A任务编号：1076350,称呼:周先生地区:云南大理需求:家政服务平台，想从河南老家招20-50周岁的人员到大理做劳务输出，需要擅长文案的团队联系,2024-04-07,,任务编号：1076350,1000.0,9天,山东省-青岛市,B任务编号：1076350,,,,,,,,,,,,,,,,,,,,,,,,,,,,,,宣传策划
【品牌起名】教育学习机起名字,https://task.epwk.com/1039321/,9398人,1人,1000元以内,待验收,A任务编号：1039321,项目：教育学习机取名字称呼:夏先生先生地区:江西南昌  需求:给教育学习机起名字，不要用地方区域去起，容易让人记住预算：价格详聊备注：微信是手机号【推广员任务小李引进】,2023-05-05,,任务编号：1039321,200.0,2天,河北省-石家庄市,B任务编号：1039321,,,,,,,,,,,,,,,,,,,,,,,,,,,,,,品牌起名
【商业提案】风投商业计划书,https://task.epwk.com/974916/,0人,1人,3000-5000元,圆满完成,k7625****96,"项目:风投商业计划书称呼:Tina地区:湖北省,武汉市需求:风投商业计划书，项目基本确认人，只需要根据要求代写就行。比较着急联系报价报工期预算:联系报价",2021-12-16,2021.12.29,任务编号：974916,3500.0,10天,四川省-成都市,腾际品牌管理,https://shop.epwk.com/3gd2mor7gner/,腾际品牌管理,出售服务,https://shop.epwk.com/3gd2mor7gner/chushou/,企业,四品,54分,,,腾际品牌管理,,百度百科搜狗互动企业品牌人物APP词条创建编辑,"￥100
            /起",企业PPT设计公司简介项目汇报演示总结报告PPT策划,"￥100
            /起",商务商业计划书**策划书招商路演项目可行性研究报告**作,"￥100
            /起",招商策划商务合作拓展餐饮美容健身教育培训机构营销策略品牌,"￥100
            /起",代做可行性研究报告修改立项审批项目建议书资金申请可研报,"￥100
            /起",创业商业计划书**策划书招商项目路演可行性研究报告,"￥100
            /起",商业计划书招商计划书**路演创业可行性研究报告策划书,"￥100
            /起",企业画册logo标志设计产品册设计菜谱菜单广告封面画册设计,"￥100
            /起",PPT设计定制作演讲工作汇报路演招商课件企业介绍动态美,"￥100
            /起",商业提案
【产品卖点】少儿培训的商业计划书,https://task.epwk.com/974840/,0人,1人,1000元以内,圆满完成,k8820****58,"项目:少儿培训的商业计划书称呼:颜女士地区:广东省,惠州市需求:雇主有个新项目，就是要写分商业计划书。具体的需求电话联系，很急",2021-12-16,2022.01.06,任务编号：974840,2000.0,1天,福建省-龙岩市,品创科技（新媒体）官方旗舰店,https://shop.epwk.com/09drj17yl53w/,,,,,,,,,,,,,,,,,,,,,,,,,,,,,产品卖点
【产品卖点】文案写作,https://task.epwk.com/970412/,2人,1人,1000-3000元,圆满完成,k6180****03,"项目:文案写作称呼:林先生地区:江西省,赣州市需求:公众号有关5G网络产业的文案写作，具体的资料都有，比较着急三天就需要。具体详谈报价预算:联系报价",2021-11-19,2021.12.28,任务编号：970412,300.0,2天,四川省-成都市-市辖区,腾际品牌管理,https://shop.epwk.com/3gd2mor7gner/,腾际品牌管理,出售服务,https://shop.epwk.com/3gd2mor7gner/chushou/,企业,四品,54分,,,腾际品牌管理,,百度百科搜狗互动企业品牌人物APP词条创建编辑,"￥100
            /起",企业PPT设计公司简介项目汇报演示总结报告PPT策划,"￥100
            /起",商务商业计划书**策划书招商路演项目可行性研究报告**作,"￥100
            /起",招商策划商务合作拓展餐饮美容健身教育培训机构营销策略品牌,"￥100
            /起",代做可行性研究报告修改立项审批项目建议书资金申请可研报,"￥100
            /起",创业商业计划书**策划书招商项目路演可行性研究报告,"￥100
            /起",商业计划书招商计划书**路演创业可行性研究报告策划书,"￥100
            /起",企业画册logo标志设计产品册设计菜谱菜单广告封面画册设计,"￥100
            /起",PPT设计定制作演讲工作汇报路演招商课件企业介绍动态美,"￥100
            /起",产品卖点
【产品卖点】农业加工项目文案代写,https://task.epwk.com/968866/,2人,1人,1000元以内,圆满完成,k9368****70,"项目:农业加工项目文案代写称呼:曾先生地区:湖北省,黄冈市需求:农业加工项目文案代写，扩张工程所需，政府有政策，需要按照提纲要求写作，1.2天内完成，12日要上交预算:报价联系",2021-11-10,2021.11.23,任务编号：968866,1000.0,2天,山东省-青岛市,利宏营销策划,https://shop.epwk.com/81n41zq1enp6/,利宏营销策划,出售服务,https://shop.epwk.com/81n41zq1enp6/chushou/,企业,一品,178分,总 3493 次中标，交易总金额,￥1074.59万,利宏营销策划,,二维Flash飞碟说逐帧手绘AE企业产品宣传广告MG动画制作,"￥300
            /起",创业商业计划书融资策划书招商项目路演可行性研究报告代写作撰写,"￥2000
            /起",动态logo设计海报名片公司企业标志产品商标品牌VI诊断升级,"￥100
            /起",微信代运营公众号文案原创微信文章写作公众号代运营微博文案撰写,"￥1500
            /起",文案撰写微信爆款推文商业计划书路演PPT融资文案论坛文案微信文案微博文案宣传文案产品故事,"￥300
            /起",企业PPT设计公司简介项目汇报演示总结报告PPT策划招商课件,"￥50
            /起",公司起名取名企业产品网站店铺媒体组织品牌起名取名故事文案策划,"￥499
            /起",公司起名取名企业产品网站店铺媒体组织品牌起名取名故事文案策划,"￥499
            /起",品牌取名起名公司宝宝取名人物取名笔名花名小名产品企业品牌取名,"￥399
            /起",产品卖点
【营销推广软文】设计产品宣传资料和软文撰写,https://task.epwk.com/850064/,2716人,6人,1000元以内,待验收,A任务编号：850064,找人为我们设计产品宣传资料和软文撰写的人才。产品是保健食品。,2020-04-04,,任务编号：850064,800.0,"5天,3天,5天,5天","山东省-青岛市,上海市-市辖区-黄浦区,广东省-深圳市,山东省-青岛市",B任务编号：850064,,,,,,,,,,,,,,,,,,,,,,,,,,,,,,营销推广软文
【广告策划】拆迁小区的广告语,https://task.epwk.com/821032/,6992人,1人,1000元以内,待验收,A任务编号：821032,项目：文案姓名：陈先生地区：江苏需求：拆迁建了新小区的广告宣传语设计 2米4宽度 字数不限预算：详谈注意：已谈好合作  勿扰,2019-12-12,,任务编号：821032,1000.0,,,B任务编号：821032,,,,,,,,,,,,,,,,,,,,,,,,,,,,,,广告策划
【宣传策划】中医行业宣传文案,https://task.epwk.com/702071/,3799人,1人,1000元以内,待验收,A任务编号：702071,中医行业宣传文案，已谈好,2019-01-11,,任务编号：702071,200.0,5天,山东省-德州市-德城区,B任务编号：702071,,,,,,,,,,,,,,,,,,,,,,,,,,,,,,宣传策划
【产品卖点】线上课程的文案策划,https://task.epwk.com/599469/,4901人,1人,1000元以内,待验收,A任务编号：599469,线上课程的文案策划：主要是围绕这个链接http://mp.weixin.qq.com/s/FBs1F75uf0F0t34TIZvlEQ上的课程来策划，预算直接沟通报价联系，无地区要求,2018-04-07,,任务编号：599469,600.0,10天,四川省-成都市-武侯区,B任务编号：599469,,,,,,,,,,,,,,,,,,,,,,,,,,,,,,产品卖点
【宣传策划】农业科技公司营销策划及商铺装修,https://task.epwk.com/533197/,5178人,19人,1000-3000元,待验收,A任务编号：533197,农业科技公司网店设计装修                                                   经营介绍：农科公司销售特色大米、铁皮石斛                                    内容：网店规划建议、设计制作                                                   设计要求：                                                                            1、简洁、好用                                                               2、用户体验好                                                               3、要求有做过同类成功案例提供                                                                                       知识产权说明：                                                                            1、所用到设计内容，如有侵犯他人著作权，由设计者承担所有法律责任。          其他：最好是有营销策划网推经验的团队。,2017-09-08,,任务编号：533197,1000.0,"15天,1天,15天,3天,6天","北京市-北京市-丰台区,河北省-石家庄市-新华区,上海市-市辖区-黄浦区,广东省-佛山市-南海区,陕西省-西安市-雁塔区",B任务编号：533197,,,,,,,,,,,,,,,,,,,,,,,,,,,,,,宣传策划
【品牌故事】主题演讲稿征集,https://task.epwk.com/512942/,7977人,5人,1000元以内,待验收,A任务编号：512942,征集，骨科医生，党员，求写一篇关于“维护核心，见诸行动”为主题的演讲稿！！字数：1000字左右工期：越快越好价格：再议,2017-06-27,,任务编号：512942,260.0,"2天,3天,4天,2天,6天","陕西省-商洛市-商州区,上海市-市辖区-浦东新区,河南省-郑州市-金水区,广东省-广州市-海珠区,湖北省-武汉市-黄陂区",B任务编号：512942,,,,,,,,,,,,,,,,,,,,,,,,,,,,,,品牌故事
【产品卖点】五谷杂粮品牌故事及8款粥杂粮粥产品文案撰写,https://task.epwk.com/510360/,11654人,1人,1000元以内,待验收,A任务编号：510360,五谷杂粮品牌故事，8款粥杂粮粥产品文案，文字俏皮，有趣，以妈妈，的味道，妈妈，的爱为主题  或者其他主题也可以,2017-06-17,,任务编号：510360,900.0,3天,江苏省-南通市-崇川区,B任务编号：510360,,,,,,,,,,,,,,,,,,,,,,,,,,,,,,产品卖点
【宣传策划】产品宣传文案编写,https://task.epwk.com/407272/,4913人,17人,1000元以内,待验收,A任务编号：407272,主要是女性生产胎盘可以制作成工艺品，希望写一个故事，能让人感动，心动，继而有冲动和行动来做这个事情。能做的联系我，具体电话联系详谈,2016-03-02,,任务编号：407272,280.0,"3天,2天,2天,5天,2天,3天,1天,5天,1天","吉林省-白城市-洮北区,浙江省-温州市-龙湾区,北京市-北京市-丰台区,浙江省-台州市-椒江区,福建省-龙岩市-新罗区,北京市-北京市-海淀区,北京市-北京市-朝阳区,云南省-昭通市-镇雄县,河北省-石家庄市-新华区",B任务编号：407272,,,,,,,,,,,,,,,,,,,,,,,,,,,,,,宣传策划
【百科/问答撰写】帮助写一个百度百科词条,https://task.epwk.com/317821/,12558人,20人,1000元以内,待验收,A任务编号：317821,词条名称：长沙家教新天地要求：1.提交生成此词条2.如果要加网址参考资料等广告效应，费用可以商量3.具体参考资料见下方http://www.csjjxtd.com/News/CopyRight/AboutUs.html需要提供什么资料，请与我联系！,2014-11-21,,任务编号：317821,100.0,"7天,5天,3天,7天,7天,7天,15天,3天,1天,30天","广东省-深圳市-南山区,河北省邯郸市鸡泽县,北京市-北京市-海淀区,北京市-北京市-东城区,福建省福州市台江区,河南省-郑州市-金水区,北京市-北京市-东城区,南京,湖南省-长沙市-芙蓉区,浙江省-湖州市-长兴县",B任务编号：317821,,,,,,,,,,,,,,,,,,,,,,,,,,,,,,百科/问答撰写
【编辑校对】将以上汉字按最大单元拆分，以前面的数组为标准,https://task.epwk.com/1110514/,997人,1人,1000元以内,圆满完成,fleaphpnet,将以上汉字按最大单元拆分，以前面的数组为标准,2025-02-24,2025.03.11,任务编号：1110514,500.0,7天,河南省-郑州市,亿帆文创,https://shop.epwk.com/78dljrwl95lx/,亿帆文创,出售服务,https://shop.epwk.com/78dljrwl95lx/chushou/,企业,五品,55分,总 13 次中标，交易总金额,￥9601.00,亿帆文创,,商业宣传设计服务,"￥100
            /页",营销推广内容营销,"￥5
            /组",商业策划营销软文,"￥30
            /组",企业策划商业推广,"￥500
            /次",商业策划计划书,"￥1000
            /起",商业策划视频制作,"￥30
            /次",,,,,,,编辑校对
【项目策划】ppt方案编写,https://task.epwk.com/1105124/,92人,1人,1000元以内,圆满完成,友森联创,ppt20页左右  详细微信联系,2025-01-20,2025.01.21,任务编号：1105124,100.0,1天,河北省-保定市,千机阁软件开发,https://shop.epwk.com/2j5jjggq95pz/,千机阁软件开发,出售服务,https://shop.epwk.com/2j5jjggq95pz/chushou/,个人,四品,65分,总 4 次中标，交易总金额,￥4.02万,千机阁软件开发,,聊天app-安卓ios,"￥50000
            /套",公司人力成本和项目管理系统,"￥20000
            /套",java软件解决方案,"￥5000
            /次",java服务部署,"￥20000
            /次",java软件定制开发,"￥100000
            /款",微信小程序开发,"￥50000
            /款",,,,,,,项目策划
【专业代笔】人工识别图片文字，内容校对,https://task.epwk.com/1101557/,477人,2人,1000元以内,圆满完成,fleaphpnet,已经用百度Ai识别国了，人工识别图片文字，内容校对，断句，加入标点符号,2024-12-27,2025.01.11,任务编号：1101557,200.0,"3天,2天","河南省-郑州市-市辖区,河南省-郑州市",亿帆文创,https://shop.epwk.com/78dljrwl95lx/,亿帆文创,出售服务,https://shop.epwk.com/78dljrwl95lx/chushou/,企业,五品,55分,总 13 次中标，交易总金额,￥9601.00,亿帆文创,,商业宣传设计服务,"￥100
            /页",营销推广内容营销,"￥5
            /组",商业策划营销软文,"￥30
            /组",企业策划商业推广,"￥500
            /次",商业策划计划书,"￥1000
            /起",商业策划视频制作,"￥30
            /次",,,,,,,专业代笔
【产品卖点】研学旅游的PPT设计,https://task.epwk.com/1088110/,83人,2人,1000元以内,圆满完成,k2157****40,称呼:叶先生地区:北京市需求:研学旅游的PPT设计 文字可以提供，半天内就要，比较急  加微信沟通,2024-08-01,2024.08.02,任务编号：1088110,500.0,"1天,1天","广东省-深圳市,宁夏-吴忠市",本能咨询工作室,https://shop.epwk.com/09drj16zq53w/,本能咨询工作室,出售服务,https://shop.epwk.com/09drj16zq53w/chushou/,个人,六品,37分,,,本能咨询工作室,,,,,,,,,,,,,,,,,,,,产品卖点
【活动文案】东门批发市场新盘的宣传和活动策划文案,https://task.epwk.com/1116481/,17人,2人,1000元以内,圆满完成,k8782****1,需求：做过商场类或小区盘的宣传活动策划文案，要求做成策划案，样式为PPT、H5，拥有大型商业宣传活动的经验，有一定美工和文字功底以及较强的逻辑思维。我们有相关人员配合完成！,2024-06-06,2024.06.27,任务编号：1116481,500.0,"3天,5天","江苏-苏州市-市辖区,辽宁-大连市-市辖区",苏州熊猫创意科技有限公司,https://shop.epwk.com/78dlj08mp5lx/,,,,,,,,,,,,,,,,,,,,,,,,,,,,,活动文案
【广告口号】家政平台广告语,https://task.epwk.com/1115850/,83人,2人,1000元以内,圆满完成,k4863****9,"广告语征集，要擅长文案的团队联系，有丰富经验
具体要求
①点明核心优势：突出平台家政人员专业素养，展现服务靠谱度，给用户安心感
②强调便捷贴心：凸显使用便利性与个性化
③营造情感共鸣：唤起受众对舒适家居生活的向往，吸引选择",2024-05-24,2024.06.18,任务编号：1115850,300.0,"2天,2天","山东-济南市-市辖区,浙江-温州市-市辖区",威和pIRtt,https://task.epwk.com/javascript:;,,,,,,,,,,,,,,,,,,,,,,,,,,,,,广告口号
【活动文案】医生演讲活动策划文案,https://task.epwk.com/1115844/,17人,2人,1000元以内,圆满完成,k1361****1,"征集：关于“维护核心，见诸行动”为主题的活动策划文案
要求：
①突出主题：紧扣 “维护核心，见诸行动”，结合医生行业特色融入日常工作场景解读践行意义。
②流程规划：设开场点明主旨、主体多形式演讲（故事分享、感悟阐述）、结尾总结升华环节，把控时长节奏。
③氛围营造：选庄重场地，配契合音乐、背景板，邀多元身份选手，激发共鸣，增强活动感染力与实效性。",2024-05-13,2024.05.31,任务编号：1115844,500.0,"2天,2天","陕西-西安市-市辖区,云南-昆明市-市辖区",皓月烟云,https://task.epwk.com/javascript:;,,,,,,,,,,,,,,,,,,,,,,,,,,,,,活动文案
【客户案例】动态海报设计案例展示,https://task.epwk.com/1115839/,7人,2人,1000元以内,圆满完成,k1330****1,案例要突出本公司核心优势，案例结尾要有公司业务介绍（我们会提供），我们的理念是“讲好品牌故事，让设计叙说品牌”。通过案例展示，吸引更多客户,2024-05-05,2024.05.27,任务编号：1115839,800.0,"3天,2天","浙江-温州市-市辖区,福建-福州市-市辖区",一濒箫声,https://task.epwk.com/javascript:;,,,,,,,,,,,,,,,,,,,,,,,,,,,,,客户案例
【行业分析报告】房地产行业分析报告,https://task.epwk.com/1115841/,44人,2人,1000-3000元,圆满完成,k6988****3,"首先要关注房地产市场的最新动态和政策变化，及时更新报告内容，以反映当前市场的真实情况，为读者提供最新、最有价值的信息
报告具体要包括以下几方面：
内容要求：需要包括市场现状分析、政策措施分析、问题与原因分析、形势预测、政策建议与措施
格式要求：结构要清晰、逻辑连贯
数据要求：数据一定准确并且充分
语言要求：专业简洁、表述客观，保持客观中立的态度",2024-04-13,2024.04.30,任务编号：1115841,1500.0,"10天,8天","湖南-长沙市-市辖区,福建-福州市-市辖区",傲世有限公司,https://task.epwk.com/javascript:;,,,,,,,,,,,,,,,,,,,,,,,,,,,,,行业分析报告
【广告口号】太阳能追踪机械广告语,https://task.epwk.com/1115848/,29人,2人,1000元以内,圆满完成,k5799****1,征集：太阳能追踪器广告语，大家集思广益，一经采用就可以付款，具体可详谈,2024-04-05,2024.04.24,任务编号：1115848,300.0,"3天,4天","云南-昆明市-市辖区,青海-西宁市-市辖区",十分逆天,https://task.epwk.com/javascript:;,,,,,,,,,,,,,,,,,,,,,,,,,,,,,广告口号
【详情页文案】玫瑰菁华露详情页文案,https://task.epwk.com/1098944/,17人,2人,1000-3000元,圆满完成,k2215****6,要求对护肤养肤这方面有兴趣或者有一定的了解专研，清楚爱美人士、护肤需求者等受众及使用场景。介绍我们产品原料取自优质玫瑰、萃取工艺精、保湿美白等功效突出、质地清爽易吸收特点。搭配精美的产品图、产品包装礼盒、模特使用效果展示等图片，吸引用户购买,2024-03-22,2024.04.15,任务编号：1098944,1500.0,"5天,5天","辽宁-沈阳市-市辖区,浙江-温州市-市辖区",故事老酒,https://task.epwk.com/javascript:;,,,,,,,,,,,,,,,,,,,,,,,,,,,,,详情页文案
【行业分析报告】宠物行业分析报告,https://task.epwk.com/1098934/,31人,2人,1000元以内,圆满完成,k6093****1,要有扎实的调研功底和报告撰写实操，结合案例、数据，把复杂行业态势讲清楚，字数3千字左右,2024-03-17,2024.04.05,任务编号：1098934,1000.0,"8天,5天","浙江-温州市-市辖区,江苏-南京市-市辖区",一濒箫声,https://task.epwk.com/javascript:;,,,,,,,,,,,,,,,,,,,,,,,,,,,,,行业分析报告
【公众号文章】Happylemon快乐柠檬公众号文章撰写,https://task.epwk.com/1098931/,273人,2人,1000元以内,圆满完成,k4480****1,我们公司是一家发展迅速，形象鲜明的饮品零售品牌。现在夏季饮品Happy4Tea的新品准备上市，现需要围绕“Enjoy real freshtea”的推广大主题，写一篇文章在公众号上发表，已经有设计了店面海报、菜单、灯箱等在内的视觉海报，文章要结合这些图片做排版,2024-03-15,2024.04.05,任务编号：1098931,500.0,"4天,5天","河南-新乡市-市辖区,辽宁-大连市-市辖区",精品logo设计,https://shop.epwk.com/j7n38q3135e1/,,,,,,,,,,,,,,,,,,,,,,,,,,,,,公众号文章
【自媒体软文】月子中心宣传软文撰写,https://task.epwk.com/1098952/,163人,2人,1000元以内,圆满完成,k8566****1,"软文主要围绕“月子中心”来写，要以消费者(可以是一胎，二胎，上班族，富家子弟任意)需求来讲述通过住进我们月子中心收到的产后康复的效果，不能太过于做作，要有针对性。考虑到很多威客对我们公司不熟悉，详细了解大家可以和我直接联系

软文要求：

1、软文将用于发布在各种行业论坛及博客，标题和内容绝对不能有广告味，要能引起点击和共鸣，能吸引网友参与讨论或点击浏览
2、文章要有吸引力，有趣味性， 要站在用户的角度来描写，帖子内容与标题给人感觉以个人感受、经验分享或消费经历为表现形式,以宣传推广我司业务。
3、要求原创(不能在网上搜了抄袭)，文笔或专业，或幽默，或结合时事，具备新闻性皆可。不要做的太像推广。
4、附上创意说明。
知识产权说明：
1、所设计的作品为原创，为第一次发布，未侵犯他人的著作权，如有侵犯他人著作权，由设计者承担所有法律责任;
2、中标的设计作品，我方支付设计制作费，即拥有该作品的知识产权，包括著作权,使用权和发布权等,有权对设计作品进行修改,组合和应用;设计者不得再向其他任何地方使用该设计作品",2024-03-12,2024.03.31,任务编号：1098952,500.0,"3天,3天","辽宁-沈阳市-市辖区,江苏-苏州市-市辖区",故事老酒,https://task.epwk.com/javascript:;,,,,,,,,,,,,,,,,,,,,,,,,,,,,,自媒体软文
【种草文案】护肤素颜霜种草文案,https://task.epwk.com/1098940/,219人,2人,1000-3000元,圆满完成,k8323****2,宫芙护肤素颜霜文案征集，已有个人初想文案，但觉欠妥，特向广大网友征集文案，可付费，采纳文案后可送素颜霜,2024-03-04,2024.03.24,任务编号：1098940,1500.0,"5天,4天","江苏-苏州市-市辖区,云南-昆明市-市辖区",苏州熊猫创意科技有限公司,https://shop.epwk.com/78dlj08mp5lx/,,,,,,,,,,,,,,,,,,,,,,,,,,,,,种草文案
【公关稿】亿达普罗旺斯公关稿,https://task.epwk.com/1098946/,85人,2人,1000-3000元,圆满完成,k4142****5,要求：诉求鲜明、逻辑缜密、行文简练。,2024-02-23,2024.03.09,任务编号：1098946,1500.0,"8天,5天","陕西-西安市-市辖区,云南-昆明市-市辖区",皓月烟云,https://task.epwk.com/javascript:;,,,,,,,,,,,,,,,,,,,,,,,,,,,,,公关稿
【公众号文章】化妆品公众号文章征稿,https://task.epwk.com/1098930/,226人,2人,1000元以内,圆满完成,k7619****9,主要是一款酵素面膜的介绍，文章内容要包括：成分解析、功效介绍、适用肤质、产品优势对比、用户评价以及使用体验等，图片我们会提供，要做好排版,2024-02-16,2024.03.07,任务编号：1098930,800.0,"5天,3天","福建-福州市-市辖区,山东-济南市-市辖区",木雪涯设计工作室,https://task.epwk.com/javascript:;,,,,,,,,,,,,,,,,,,,,,,,,,,,,,公众号文章
【种草文案】韩式烤肉种草,https://task.epwk.com/1098939/,80人,2人,1000元以内,圆满完成,k8505****3,字数不一定多，得有思想共鸣、情怀触动、有文字画面感、情怀引入服务。用热情亲切口吻写文案，描述烤肉店环境、菜品与服务亮点，勾起食欲,2024-02-07,2024.02.26,任务编号：1098939,800.0,"2天,3天","陕西-西安市-市辖区,山东-济南市-市辖区",皓月烟云,https://task.epwk.com/javascript:;,,,,,,,,,,,,,,,,,,,,,,,,,,,,,种草文案
