标题,标题链接,查看数,参与数,需求价格,状态,任务类型,需求方,需求文本,发布时间,完成时间,任务编号,交易价格,工作周期,设计师地点,设计师,字段1_link
【效果图设计】温泉会所游泳池户外设计效果图,https://task.epwk.com/761584/,1903人,5人,¥200,圆满完成,雇佣,有家,实拍图为现场效果图，参考图作为设计与PS的套膜。本场地共3000平方米左右，现先放3张实拍图选取设计效果，如果PS或设计方案符合，我再放多张实拍图与建筑图。要求：把参考图的设计效果PS或套进实拍图当中，以白色调为主，遮阳伞、遮阳挡板、凳子、桌椅、那些以热带风茅草为主。（先要求把实拍图设计为效果图，一共修改4张图，实拍图上的黑色外墙是会所的外墙，亦属设计范围）参考图只是我公司喜欢的网红温泉会所类型，如有个人或公司有好的个人设计与方案，可直接合作。因上存图片数量、大小有限，几张参考图合成了一张，实拍图进行压缩过。如有需要详细的实拍图可联系我方获取。（参考图可以自行上网参考）,2019.06.19,2019.07.05,任务编号：761584,"￥200,￥200","7天,5天","广东省-广州市-海珠区,广西壮族自治区-贺州市-八步区",塬境设计,https://shop.epwk.com/81n41o1mlnp6/
【效果图设计】设计大楼外观,https://task.epwk.com/759985/,2247人,19人,¥800,圆满完成,雇佣,o5d044c76d2c4b,设计大楼外观，要求仿军队部队培训大楼,2019.06.15,2020.03.18,任务编号：759985,"￥800,￥800,￥800,￥800,￥800,￥800,￥800,￥800,￥800,￥800,￥800,￥800","3天,6天,7天,3天,5天,5天,3天,15天,3天,3天,6天,5天","湖南省-长沙市,湖南省-长沙市-岳麓区,辽宁省-沈阳市-东陵区,广东省-广州市-海珠区,湖南省-长沙市,湖北省-武汉市-汉阳区,广东省-广州市-海珠区,山东省-日照市-东港区,广西-桂林市,江苏省-淮安市-淮阴区,四川省-成都市,广东省-广州市-花都区",红石建筑设计工作室,https://shop.epwk.com/78n96ywkxnkv/
【效果图设计】70平方米时尚快餐店装修设计效果图,https://task.epwk.com/758519/,2239人,22人,¥500,圆满完成,雇佣,sunpc,位置在一小区临街商铺。门面6米宽，深11米，楼底高6米。主营：健康时尚快餐；新鲜食材，即点即蒸，以蒸为主要烹调方式。要求：简约时尚，有自己鲜明的特色风格。在最省装修成本的情况下突显自己的风格。店铺里面需要设计有卫生间，开放式厨房，厨房约占面积20个平方。微信联系，不方便电话,2019.06.11,2019.08.19,任务编号：758519,"￥500,￥500,￥500,￥500,￥500,￥500,￥500,￥500,￥500,￥500,￥500","5天,7天,7天,5天,7天,4天,1000天,3天,5天,5天,7天","福建省-厦门市-思明区,云南省-昆明市-西山区,重庆市-市辖区-万盛区,湖北省-武汉市-东西湖区,广东省-佛山市-南海区,湖北省-武汉市-洪山区,广东省-东莞市-东莞市,江西省-赣州市-章贡区,山东省-济南市-市辖区,上海市-市辖区-虹口区,甘肃省-兰州市-七里河区",米乐品牌设计,https://shop.epwk.com/78dljeype5lx/
【店铺厂房】义乌国际商贸城店面装修,https://task.epwk.com/756812/,2196人,7人,¥500,圆满完成,雇佣,howdyfire,"义乌国际商贸城2区店面。店面尺寸4.3米，深度3米，高度2.8米。公司名字江山市帝亿消防器材有限公司，英文JIANGSHAN DIYI FIRE EQUIPMENT CO.,LTD公司牌子HOWDY，。主营灭火器，所以进门右手边这面墙基本布局不变，还是灭火器这样子摆，主要是剩余左手边还有桌子的摆放需要设计。另外打印机和饮水机必须要有。原来的样子参考“义乌购”网站，手写输入13866即可。可360度查看原来装修，密码是080512.。中间的原来黑色那块板位置计划放一个电视播放宣传片。其他没特殊要求.",2019.06.06,2019.06.29,任务编号：756812,"￥500,￥500,￥500,￥500,￥500,￥500,￥500","7天,3天,2天,5天,3天,2天,3天","上海市-市辖区-杨浦区,湖北省-武汉市-洪山区,山东省-临沂市-罗庄区,广东省-清远市-清城区,广东省-深圳市-南山区,江苏省-无锡市-锡山区,广西壮族自治区-贺州市-八步区",上海暔尚广告设计公司,https://shop.epwk.com/z2nkzz1k4nqy/
【效果图设计】鸟瞰效果图设计,https://task.epwk.com/756795/,1619人,9人,¥300,圆满完成,雇佣,,,,,,,,,,
【效果图设计】厂房的3D效果图设计,https://task.epwk.com/756782/,1090人,1人,¥500,圆满完成,雇佣,o5cf477f39acf1,具体尺寸及参考类型的图片。 两个一样的厂房 一条9米的路 前面有个老楼房、通道从楼房中间出来 有个小办公楼 空地一块 老房子一处具体详谈,2019.06.06,2019.06.14,任务编号：756782,￥500,2天,安徽省-合肥市-瑶海区,爱岩文化传媒,https://shop.epwk.com/09drjv4e653w/
【效果图设计】建筑实训画图,https://task.epwk.com/755662/,1240人,2人,¥100,圆满完成,雇佣,风生水起发大财,建筑实训作业帮忙画图，四张图，要求十天之内画完。wx：，可联系详谈,2019.06.04,2019.06.05,任务编号：755662,￥100,2天,河北省-保定市-曲阳县,一人行工作室,https://shop.epwk.com/2j5xo83wx5xm/
【橱柜定制】新中式门型实物打样,https://task.epwk.com/753540/,1884人,1人,¥1160,圆满完成,雇佣,房通,根据我司提供的图片，进行新中式门型打样生产，需现场沟通，优先广州市白云区商家。,2019.05.29,2019.06.03,任务编号：753540,￥1160,5天,广东省-广州市,o5c9af08196d9c,https://task.epwk.com/javascript:;
【效果图设计】交通立交互通鸟瞰图一张,https://task.epwk.com/752751/,1015人,2人,¥600,圆满完成,雇佣,武汉尚艺映画,交通立交互通鸟瞰图，目前只是CAD图，需要做出三维交通立交互通鸟瞰图一张。工期2-3天完成。例图附上。具体详谈,2019.05.27,2019.06.23,任务编号：752751,"￥600,￥600","2天,3天","四川省-巴中市,广东省-深圳市",思阳品牌策划,https://shop.epwk.com/zqdpleewpn1v/
【效果图设计】老房改造效果图设计,https://task.epwk.com/752699/,1242人,22人,¥400,圆满完成,雇佣,理理发就是吴彦祖,老房改造，需要设计风格。现状如前面四图，只需要设计客厅。入户门对面窗户1.1米宽2米。喜欢的风格在图五。,2019.05.27,2019.06.01,任务编号：752699,"￥400,￥400,￥400,￥400,￥400,￥400,￥400,￥400,￥400,￥400","3天,3天,3天,3天,2天,2天,3天,3天,3天,2天","安徽省-合肥市-瑶海区,广东省-广州市,重庆市-重庆市-永川区,江苏省-苏州市-金阊区,四川省-成都市-市辖区,贵州省-贵阳市-云岩区,河南省-郑州市-管城回族区,吉林省-长春市-二道区,重庆市-重庆市-沙坪坝区,山东省-临沂市-罗庄区",爱岩文化传媒,https://shop.epwk.com/09drjv4e653w/
【效果图设计】8平米门店简单效果图制作,https://task.epwk.com/752297/,1738人,8人,¥200,圆满完成,雇佣,o5cb7f56204f9f,4米宽2米深迷你门店，根据提供的具体风格绘制效果图。尺寸及布置按照要求大致布置即可，无需精确。最终提供正面及侧面两张效果图。,2019.05.27,2019.06.03,任务编号：752297,"￥200,￥200,￥200,￥200,￥200,￥200,￥200","3天,7天,2天,3天,3天,3天,2天","安徽省-合肥市-瑶海区,上海市-市辖区-黄浦区,四川省-成都市,河南省-南阳市-镇平县,广东省-深圳市,广西壮族自治区-贺州市-八步区,湖北省-武汉市-洪山区",爱岩文化传媒,https://shop.epwk.com/09drjv4e653w/
【效果图设计】室内楼梯效果图制作,https://task.epwk.com/750551/,2446人,28人,¥500,圆满完成,雇佣,毅小七七,要给一个室内装修里已经设计好的楼梯，画效果图,2019.05.22,2019.05.28,任务编号：750551,"￥500,￥500,￥500,￥500,￥500,￥500,￥500,￥500,￥500,￥500,￥500,￥500","2天,2天,3天,2天,2天,1天,400天,7天,1天,3天,3天,2天","山东省-日照市,重庆市-重庆市-沙坪坝区,江苏省-常州市-武进区,山西省-临汾市-尧都区,河北省-保定市,湖北省-武汉市-青山区,福建省-福州市-福清市,江苏省-盐城市-射阳县,辽宁省-大连市-普兰店市,四川省-成都市,广东省-佛山市-禅城区,湖北省-武汉市",颐品建筑表现工作室,https://shop.epwk.com/0jnek3orrnv3/
【其他建筑设计】农村宅基地住宅设计,https://task.epwk.com/748530/,1784人,3人,¥300,圆满完成,雇佣,o5cdec2778ff2b,农村宅基地住宅设计，只需要平面布置图（一楼和二楼），平面尺寸如下。原则：房间尽量多一楼需要设置：客厅、厨房餐厅、房间、卫生间厨房和餐厅布置在右侧，厨房面积要大，需要布置土灶台二楼只要布置房间每层楼可以设置两个卫生间，其中一个在主卧,2019.05.18,2019.05.20,任务编号：748530,"￥300,￥300,￥300","1天,3天,2天","山东省-日照市-莒县,山东省-日照市-东港区,广东省-广州市-花都区",颐品建筑表现工作室,https://shop.epwk.com/0jnek3orrnv3/
【效果图设计】三张CAD图制作，要求不高,https://task.epwk.com/747035/,2217人,1人,¥200,圆满完成,雇佣,cjwdxxg,工艺流程图车间平面图全厂平面图具体详谈,2019.05.14,2019.05.15,任务编号：747035,￥150,3天,广西壮族自治区-贺州市-八步区,威创设计工作室,https://shop.epwk.com/7g5ykxvx2n0q/
【酒店宾馆】酒店门廊设计,https://task.epwk.com/746728/,2637人,6人,¥500,圆满完成,雇佣,佳食怿餐,自由设计，美观大方，，图片是现在的门廊图片。该酒店位于四川，双流国际机场附近，感谢，需要更多门廊数据的请微信联系我，谢谢酒店招牌不做变更。主要涉及门廊顶部效果及两端立面（地面及店招均不做更改）尺寸为 长14.5米  宽为 6米  高为0.5米,2019.05.14,2019.06.02,任务编号：746728,"￥500,￥500,￥500,￥500,￥500,￥500","4天,2天,10天,2天,4天,5天","重庆市-市辖区-万盛区,云南省-昆明市-西山区,广东省-广州市-荔湾区,云南省-昭通市-威信县,四川省-南充市-高坪区,广东省-广州市-市辖区",o5cdcc0750b1d5,https://task.epwk.com/javascript:;
【效果图设计】室内设计加施工图设计,https://task.epwk.com/744479/,2414人,41人,¥1000,圆满完成,雇佣,o5bf2abf1eef00,室内设计加施工图，已有确定风格,2019.05.08,2019.05.21,任务编号：744479,"￥1000,￥1000,￥1000,￥1000,￥1000,￥1000,￥1000,￥1000,￥1000,￥1000,￥1000","5天,3天,3天,5天,5天,5天,7天,7天,4天,7天,3天","重庆市-市辖区,云南省-昭通市-威信县,广东省-深圳市,上海市-上海市-闵行区,江西省-抚州市-崇仁县,江苏省-苏州市-吴中区,浙江省-金华市-磐安县,江苏省-盐城市-射阳县,广西壮族自治区-南宁市-西乡塘区,湖北省-武汉市-市辖区,江苏省-宿迁市",行知高端室内外装修设计工作室,https://shop.epwk.com/7g5yk1lozn0q/
【效果图设计】家装装修设计,https://task.epwk.com/742418/,2383人,42人,¥1000,圆满完成,雇佣,o5bf2abf1eef00,家装装修设计面积：130平左右工期：再议,2019.05.04,2019.05.12,任务编号：742418,"￥1000,￥1000,￥1000,￥1000,￥1000,￥1000,￥1000,￥1000,￥1000,￥1000,￥1000,￥1000","3天,5天,5天,4天,3天,5天,2天,7天,3天,4天,7天,5天","湖南省-长沙市-岳麓区,河南省-南阳市-镇平县,广东省-深圳市-宝安区,广东省-深圳市-龙岗区,江苏省-盐城市-东台市,广东省-广州市-番禺区,广东省-广州市,浙江省-金华市-磐安县,海南省-儋州市-儋州市,云南省-昆明市-官渡区,湖北省-武汉市-洪山区,浙江省-宁波市-海曙区",设计忠忠,https://task.epwk.com/javascript:;
【效果图设计】办公室平面布局设计,https://task.epwk.com/741646/,1453人,28人,¥500,圆满完成,雇佣,o5cc813fd590e7,办公室平面布局图设计公司为环保科技有限公司，主要做技术咨询服务，人员约20人，办公室建筑面积550平方米，可以预留一半作为其他用途。主要布置总经理室、财务室、部门主任室2间、洽谈室、资料室（也可以其它区域放置）、员工办公（10-16人）、茶水间提交作品时需把设计说明附上。图纸备注：本办公室在四楼，总高为5楼，基础图纸为上北下南，西南角为卫生间、东南角有飘窗要求提供效果图和开关插座布置图微信联系，不要电话,2019.04.30,2019.05.16,任务编号：741646,"￥500,￥500,￥500,￥500,￥500,￥500,￥500,￥500,￥500,￥500,￥500,￥500","3天,7天,5天,4天,2天,2天,2天,5天,2天,3天,2天,7天","湖南省-长沙市-岳麓区,浙江省-温州市-苍南县,湖北省-武汉市-新洲区,云南省-昆明市-官渡区,北京市-北京市-东城区,广东省-深圳市-龙岗区,广东省-深圳市,广东省-广州市,北京市-北京市-房山区,广东省-深圳市-市辖区,河北省-秦皇岛市-北戴河区,广东省-广州市-海珠区",设计忠忠,https://task.epwk.com/javascript:;
【效果图设计】手机连锁店装修效果图设计,https://task.epwk.com/741119/,2189人,26人,¥800,圆满完成,雇佣,Mr150****3443,手机连锁店装修效果图，面积在20-50平方，要求内部与外部的所有装修设计，3天左右,2019.04.29,2019.05.29,任务编号：741119,"￥500,￥500,￥500,￥500,￥500,￥500,￥500,￥500,￥500,￥500,￥500","5天,3天,3天,3天,3天,2天,7天,5天,2天,3天,500天","广西壮族自治区-贺州市-八步区,河北省-石家庄市-市辖区,北京市-北京市,广东省-深圳市,江苏省-淮安市-清浦区,山东省-临沂市-平邑县,广东省-广州市-海珠区,江苏省-盐城市-射阳县,黑龙江-哈尔滨市-市辖区,江西省-赣州市,湖北省-武汉市-洪山区",威创设计工作室,https://shop.epwk.com/7g5ykxvx2n0q/
【效果图设计】售楼处效果图施工图设计,https://task.epwk.com/738397/,1717人,18人,¥2000,圆满完成,雇佣,o5bcb1c90b05bc,一个两层楼的售楼处效果图施工图工期：尽快,2019.04.23,2019.05.14,任务编号：738397,"￥1000,￥1000,￥1000,￥1000,￥1000,￥1000,￥1000,￥1000,￥1000,￥1000,￥1000","5天,5天,7天,3天,5天,7天,5天,5天,7天,5天,7天","广西壮族自治区-贺州市-八步区,天津市-市辖区-和平区,天津市-市辖区-河西区,江苏省-南京市-市辖区,湖北省-宜昌市-西陵区,四川省-成都市,广东省-深圳市-龙岗区,江苏省-无锡市,江苏省-连云港市,上海市-市辖区-徐汇区,贵州省-贵阳市-乌当区",威创设计工作室,https://shop.epwk.com/7g5ykxvx2n0q/
【效果图设计】党史室效果图设计,https://task.epwk.com/737097/,2547人,20人,¥1700,圆满完成,雇佣,o5cb893f189405,三个6X3米+6X6米  要求立体感，有新意具体需求详谈,2019.04.19,2019.08.29,任务编号：737097,"￥1700,￥1700,￥1700,￥1700,￥1700,￥1700,￥1700,￥1700,￥1700,￥1700,￥1700","5天,3天,1000天,5天,3天,10天,3天,3天,3天,2天,5天","广西壮族自治区-贺州市-八步区,山东省-青岛市-市北区,浙江省-杭州市-江干区,河南省-商丘市-梁园区,湖南省-长沙市-岳麓区,四川省-自贡市-富顺县,江苏省-南京市-市辖区,四川省-绵阳市-游仙区,天津市-市辖区-河西区,江苏省-宿迁市,贵州省-贵阳市-云岩区",威创设计工作室,https://shop.epwk.com/7g5ykxvx2n0q/
【效果图设计】商城休息区效果图设计,https://task.epwk.com/733335/,465人,1人,¥100,圆满完成,雇佣,o5bf40095b2cf1,商场的拦河边上需要做一个休息区 ， 有照片可以PS上去，急急急急急明天就要。,2019.04.11,2019.04.11,任务编号：733335,￥100,2天,广西-南宁市,世羡工作室,https://shop.epwk.com/78dljep4p5lx/
【新房装修】卧室改装设计,https://task.epwk.com/728253/,4477人,13人,¥100,圆满完成,雇佣,o5c9dd3c82a357,出租房卧室改装风格：简约风  男士居住具体投标联系,2019.03.29,2019.04.02,任务编号：728253,"￥100,￥100,￥100,￥100,￥100,￥100,￥100,￥100,￥100,￥100,￥100,￥100","2天,3天,6天,2天,2天,2天,1天,300天,2天,1天,2天,2天","安徽省-淮南市,广东省-深圳市,天津市-市辖区-津南区,江苏省-连云港市,湖南省-长沙市-岳麓区,江苏省-宿迁市,广东省-惠州市-惠阳区,江西省-赣州市,江苏省-泰州市-海陵区,广东省-广州市-海珠区,陕西省-西安市-新城区,重庆市-重庆市-江北区",爱岩文化传媒,https://shop.epwk.com/09drjv4e653w/
,,,,,,,,,,,,,,,,
【施工图设计】根据平面图出施工图,https://task.epwk.com/727794/,2118人,7人,¥1000,圆满完成,雇佣,易品堂品牌设计,具体要求电话联系！！！,2019.03.28,2019.04.15,任务编号：727794,"￥1000,￥1000,￥1000,￥1000,￥1000,￥1000,￥1000","3天,7天,5天,10天,3天,7天,7天","上海市-市辖区,河南省-郑州市-市辖区,江苏省-连云港市,山东省-日照市-东港区,广东省-深圳市-南山区,江苏省-常州市-钟楼区,江苏省-盐城市-射阳县",上海暔尚广告设计公司,https://shop.epwk.com/z2nkzz1k4nqy/
【效果图设计】学校标准装修效果图设计,https://task.epwk.com/727027/,2155人,9人,¥2300,圆满完成,雇佣,o5bcc8e629b7ac,我们学校名字叫：山姆宝贝少儿英语。目标客户是3-12岁小朋友。现在征集学校标准装修效果图10张。分别是门头2张、前台及家长等候区域2张、洽谈室1张、饮水区1张、走廊1张、教室不同角度各1张、教师办公室1张。学校面积按照500平米预估。（每张效果图都需要附上附件中的logo）,2019.03.27,2019.05.26,任务编号：727027,"￥1000,￥1000,￥1000,￥1000,￥1000,￥1000,￥1000,￥1000,￥1000","5天,6天,10天,2天,14天,5天,10天,3天,4天","广西壮族自治区-贺州市-八步区,湖南省-长沙市-岳麓区,江苏省-盐城市-射阳县,上海市-市辖区,广东省-佛山市-禅城区,江苏省-宿迁市,广东省-深圳市-龙岗区,广东省-深圳市,上海市-上海市-松江区",威创设计工作室,https://shop.epwk.com/7g5ykxvx2n0q/
【效果图设计】出报建图和效果图设计,https://task.epwk.com/725847/,1903人,11人,¥3500,圆满完成,雇佣,leoleoliao,我有个商铺需要装修，需要出报建图和效果图，5天左右，已有平面图。,2019.03.24,2019.04.01,任务编号：725847,"￥3500,￥3500,￥3500,￥3500,￥3500,￥3500,￥3500,￥3500,￥3500,￥3500","5天,3天,1000天,5天,5天,6天,5天,5天,5天,5天","广西壮族自治区-贺州市-八步区,江西省-赣州市,四川省-巴中市-巴州区,浙江省-金华市-磐安县,广东省-广州市,广东省-深圳市-宝安区,广东省-广州市-市辖区,广东省-深圳市,上海市-市辖区-黄浦区,湖北省-武汉市-江岸区",威创设计工作室,https://shop.epwk.com/7g5ykxvx2n0q/
【店铺厂房】店面设计，一楼图书文具，二楼托管培训，约500平,https://task.epwk.com/715034/,2196人,12人,¥1500,圆满完成,雇佣,烟台朗奇文化,要求有相关设计经验,2019.02.27,2019.05.14,任务编号：715034,"￥1500,￥1500,￥1500,￥1500,￥1500,￥1500,￥1500,￥1500,￥1500,￥1500,￥1500,￥1500","12天,8天,4天,7天,5天,7天,4天,15天,5天,5天,7天,7天","浙江省-金华市-磐安县,广东省-深圳市-龙岗区,广东省-深圳市,河北省-石家庄市,贵州省-贵阳市-云岩区,江苏省-连云港市-新浦区,湖北省-武汉市-洪山区,河南省-郑州市-惠济区,湖北省-荆州市-松滋市,广东省-广州市-海珠区,广东省-广州市-海珠区,浙江省-湖州市-吴兴区",室外桃园创意空间,https://shop.epwk.com/zqdple3rgn1v/
【新房装修】36平米厅的家具摆放设计,https://task.epwk.com/714281/,4344人,17人,¥300,圆满完成,雇佣,o5c7394d05530c,36平米厅的家具摆放设计 工期：7天具体投标联系。电话不方便联系，微信沟通方便,2019.02.25,2019.03.26,任务编号：714281,"￥300,￥300,￥300,￥300,￥300,￥300,￥300,￥300,￥300,￥300,￥300","1天,2天,3天,2天,4天,2天,2天,5天,3天,3天,3天","重庆市-重庆市-沙坪坝区,河南省-郑州市-二七区,广东省-广州市-白云区,湖南省-长沙市-长沙县,浙江省-杭州市-滨江区,河北省-石家庄市-市辖区,广东省-肇庆市-四会市,浙江省-杭州市,河南省-许昌市-襄城县,浙江省-金华市-婺城区,河北省-张家口市",饭饭设计@_@,https://shop.epwk.com/78n96z1v2nkv/
【效果图设计】根据平面图和装修思路绘制效果图,https://task.epwk.com/712679/,1126人,3人,¥3000,圆满完成,雇佣,Mr130****1966,100多平的一个展厅的效果图 需要出5张效果图（不同角度的）周六上午需要看到小图方案，我们可以提供平面布置图，具体请加我QQ最好今晚联系。,2019.02.20,2019.05.23,任务编号：712679,￥3000,2天,广东省-深圳市-南山区,映善中国,https://shop.epwk.com/09drjep7153w/
【软装设计】名片、形象墙设计、门牌、公司简介设计,https://task.epwk.com/712127/,2010人,12人,¥300,圆满完成,雇佣,o5bf3c704edf7f,一、名片设计 名片正面1、公司名称：山东龙德路桥有限公司（简称：龙德路桥）2、另需要添加的公司名称：交通运输部科学研究院冬季交通安全研究院3、放置两个logo4、地址  第一个地址：北京市朝阳区惠新西街240号  第二个地址：山东省济南市市中区舜耕路28号舜耕山庄办公楼西1楼5、电话  0531-58****086、个人名字 于悦  总经理   高级工程师7、个人手机号8、二维码 名片背面要求如下：主营业务：凝冰预警与自动化喷洒系统      建筑材料、交安设施销售及路桥施工      道路智能养护工程综合承包及成果转化      再生养护一体化施工、设备改造与销售二、形象墙（尺寸：高2660mm /宽3600mm）  公司logo  名称：龙德路桥三、门牌1、科室名称：总经理（315）、财务部（311）、工程部（313）、会议室（316）2、门牌名称：龙德路桥3、龙德logo四、公司简介设计根据前面的作品，将文字发给威客，威客再设计。,2019.02.19,2019.03.04,任务编号：712127,"￥300,￥300,￥300,￥300,￥300,￥300,￥300,￥300","3天,5天,3天,1000天,3天,3天,3天,4天","山东省-济南市,内蒙古-呼和浩特市-赛罕区,北京市-北京市-东城区,山东省-青岛市,福建省-泉州市-丰泽区,北京市-北京市-海淀区,山西省-太原市,山东省-莱芜市",图度文化,https://shop.epwk.com/p05qj9mm3dev/
【别墅设计】四层自建房混合结构设计,https://task.epwk.com/708010/,2967人,9人,¥500,圆满完成,雇佣,自建房,自建房的宽度为11米，长度为10米，要将图中的长宽面积适当缩小。 图纸包裹全套的施工图，如建筑图、结构图、电路、给排水图等。,2019.01.29,2019.08.29,任务编号：708010,"￥500,￥500,￥500,￥500,￥500,￥500,￥500,￥500,￥500","15天,7天,6天,15天,15天,10天,15天,7天,2天","山东省-日照市-东港区,广东省-湛江市,广东省-深圳市,浙江省-杭州市-上城区,江苏省-盐城市-射阳县,广东省-广州市,上海市-市辖区-黄浦区,浙江省-丽水市,福建省-厦门市",创易建筑设计室,https://shop.epwk.com/0z5o44rx8njq/
【别墅设计】四层自建房混合结构设计,https://task.epwk.com/702807/,1620人,1人,¥500,圆满完成,雇佣,资深建筑设计师,四层自建房混合结构设计，图纸详附件,2019.01.14,2019.01.28,任务编号：702807,￥500,12天,浙江省-杭州市,筑利建筑结构设计工作室,https://shop.epwk.com/81n41oleonp6/
【效果图设计】奶茶店店铺装修设计,https://task.epwk.com/702746/,1211人,3人,¥500,圆满完成,雇佣,朗慕AND,我想设计一间奶茶店，27方左右，环境需要有网红风格，楼层高3米，等会上存的图，里面的玻璃柜和球球，还有文字英文还有图案都需要保留，水吧台设在靠窗那边，厨房和杂物间不用设计，其他都需要，请三天内出方案预算：500,2019.01.14,2019.04.01,任务编号：702746,"￥500,￥500","2天,5天","山东省-临沂市,江苏省-连云港市-新浦区",昆明众石嘉创文化传播,https://shop.epwk.com/09drjew7q53w/
【效果图设计】别墅的室外景观效果图制作,https://task.epwk.com/694803/,1593人,13人,¥100,圆满完成,雇佣,高承扬,草图大师画个别墅的室外景观效果图 已经画了框架 院子不大,2018.12.19,2018.12.24,任务编号：694803,"￥100,￥100,￥100,￥100,￥100,￥100,￥100,￥100,￥100,￥100","7天,5天,1天,3天,3天,2天,3天,2天,3天,2天","上海市-市辖区-黄浦区,贵州省-贵阳市-云岩区,广东省-深圳市-市辖区,广东省-汕尾市-城区,湖南省-长沙市,四川省-成都市-龙泉驿区,贵州省-贵阳市-乌当区,山东省-淄博市,北京市-北京市,湖北省-荆州市-松滋市",昆明众石嘉创文化传播,https://shop.epwk.com/09drjew7q53w/
