标题,标题链接,查看数,参与数,需求价格,状态,任务类型,需求方,需求文本,发布时间,完成时间,任务编号,交易价格,工作周期,设计师地点,设计师,字段1_link
【喷泉设计】鱼池喷泉设计,https://task.epwk.com/965892/,263人,1人,¥5000,圆满完成,雇佣,k7460****6,设计总长160米，宽60米，主喷喷高80米左右的喷泉,2021.10.04,2021.10.14,任务编号：965892,￥5000,3天,江苏省-镇江市-市辖区,亚蓝特设计,https://task.epwk.com/javascript:;
【样板间】住宅样板间设计,https://task.epwk.com/964123/,210人,1人,¥2000,圆满完成,雇佣,k9064****8,面积98平，三房两卫，风格精致温馨即可,2021.10.04,2021.10.13,任务编号：964123,￥2000,3天,上海市-上海市-市辖区,k865074339,https://task.epwk.com/javascript:;
【商业建筑】影视媒体园区设计,https://task.epwk.com/965240/,902人,1人,¥50000,圆满完成,雇佣,k8897****7,"占地面积：8,000㎡，以明亮的商业空间提供舒适的人行环境。",2021.10.03,2021.10.16,任务编号：965240,￥50000,6天,云南省-昆明市-市辖区,黎然设计工作室,https://task.epwk.com/javascript:;
【复式设计】半复式楼的装修设计,https://task.epwk.com/963937/,247人,1人,¥2000,圆满完成,雇佣,k4873****3,毛坯新房，是个半复式的空间，楼下是两房，复式夹层是一方，喜欢欧式装修,2021.10.03,2021.10.13,任务编号：963937,￥2000,3天,陕西省-西安市-市辖区,麦点品牌设计定制,https://task.epwk.com/javascript:;
【复式设计】想把单层改复式设计,https://task.epwk.com/963936/,169人,1人,¥1000,圆满完成,雇佣,k9972****2,单层面积53㎡的上下两层的复式，开间为4.2，进深为10，进门为卫生间,2021.10.03,2021.10.15,任务编号：963936,￥1000,6天,江西省-上尧市-市辖区,京羿视觉装饰设计,https://task.epwk.com/javascript:;
【商业建筑】体能培训乐园布局规划,https://task.epwk.com/965242/,260人,2人,¥2000,圆满完成,雇佣,k2797****1,层高5米，宽度24米，长70米，要求体育项目多样，合理利用空间，轮滑，击剑，体操多些要，划分好各个区域及所用材质，外围，平房一排，各种培训等及配套餐饮娱乐，旁边蹦床乐园,2021.10.03,2021.10.17,任务编号：965242,"￥2000,￥2000","5天,7天","浙江省-杭州市-市辖区,河北省-石家庄市-市辖区",k886170732,https://task.epwk.com/javascript:;
【商业建筑】小型工业区建筑外观形象设计,https://task.epwk.com/965241/,207人,1人,¥2000,圆满完成,雇佣,k7619****9,一个小型工业区，其中三个联栋厂房和一个办公研发楼，请设计这四个建筑的外观，三个厂房基本一致。要求风格现代、大气庄重、有些许独到的思路。,2021.10.03,2021.10.15,任务编号：965241,￥2000,5天,浙江省-杭州市-市辖区,逢辉设计顾问,https://task.epwk.com/javascript:;
【工程造价】办公楼建筑安装工程造价,https://task.epwk.com/964980/,610人,2人,¥5000,圆满完成,雇佣,k8953****7,一栋3层的办公楼建安工程，包括人工费、材料费、施工机具使用费、企业管理费、利润、规费和税金这些,2021.10.03,2021.10.15,任务编号：964980,"￥5000,￥5000","5天,6天","陕西省-西安市-市辖区,江西省-上尧市-市辖区",设计人花爷,https://task.epwk.com/javascript:;
【工程造价】土木工程造价,https://task.epwk.com/964979/,543人,1人,¥5000,圆满完成,雇佣,k4519****9,乡镇三级路其他路面分项工程,2021.10.03,2021.10.15,任务编号：964979,￥5000,5天,云南省-昆明市-市辖区,斑马设计工作室,https://task.epwk.com/javascript:;
,,,,,,,,,,,,,,,,
【喷泉设计】急需假山喷泉设计,https://task.epwk.com/961329/,538人,1人,¥40000,圆满完成,雇佣,k3356****6,做一个600平方的假山和喷泉，假山面积要50平方左右,2021.10.03,2021.10.15,任务编号：961329,￥40000,5天,河北省-保定市-市辖区,k755475967,https://task.epwk.com/javascript:;
【商业建筑】连锁酒店建筑外观设计,https://task.epwk.com/965243/,285人,2人,¥1000,圆满完成,雇佣,k6548****8,主要是雨棚部分的设计，以前是雨棚顶是玻璃，现在不用玻璃，顶部做防水，设计雨棚前檐口和底部，雨棚是弧形的。,2021.10.03,2021.10.12,任务编号：965243,"￥1000,￥1000","6天,6天","上海市-上海市-市辖区,山东省-青岛市-市辖区",唯東设计,https://task.epwk.com/javascript:;
【娱乐休闲】酒店式公寓客房装修设计,https://task.epwk.com/965557/,153人,1人,¥1500,圆满完成,雇佣,k4863****9,6米挑高，上下两层，一共70平，家居家电都齐全，风格简约干净为主,2021.10.03,2021.10.13,任务编号：965557,￥1500,3天,湖南省-长沙市-市辖区,银翼效果图设计表现,https://task.epwk.com/javascript:;
【样板间】小三房样板间设计,https://task.epwk.com/964122/,397人,2人,¥2000,圆满完成,雇佣,,,,,,,,,,
【自建房】自建房做民宿装修设计,https://task.epwk.com/963316/,196人,1人,¥3000,圆满完成,雇佣,k2938****5,一楼是前台接待和早餐区，二三四楼是客房，五楼有一半做独立套房，另一半及最高的半层做跃层，即两层一套，内部楼梯上下 。房子要设计合理，满足舒适性、功能性、合理性、私密性; 请设计师自行发挥,2021.10.03,2021.10.12,任务编号：963316,￥3000,3天,湖南省-常德市-市辖区,清晰空间设计,https://task.epwk.com/javascript:;
【医疗机构】减肥机构大厅设计,https://task.epwk.com/964142/,152人,1人,¥3000,圆满完成,雇佣,k2111****3,出了常规的前台和休息区外，要有一面形象墙，供摆放宣传照片用。风格简约明亮,2021.10.03,2021.10.13,任务编号：964142,￥3000,5天,贵州省-贵阳市-市辖区,七芒星装饰设计,https://task.epwk.com/javascript:;
【自建房】自建房屋顶天台设计,https://task.epwk.com/963315/,196人,1人,¥1000,圆满完成,雇佣,k5910****1,屋顶天台东西两侧为邻居，有墙（东和北两边为0.98米，南边0.3米（估计用玻璃栅栏），西边高2-1.75米，详见照片）。楼梯顶高3.4米左右，把房屋分割我南北两部分，东边有约1.35米通道。,2021.10.03,2021.10.15,任务编号：963315,￥1000,5天,上海市-上海市-市辖区,雅和空间设计,https://task.epwk.com/javascript:;
【商业建筑】双层钢构厂房需要结构设计,https://task.epwk.com/965238/,225人,1人,¥2000,圆满完成,雇佣,k7431****1,有一双层钢构厂房（建筑面积约2100平，内部局部有夹层，高约9.77米）需要结构设计,2021.10.02,2021.10.13,任务编号：965238,￥2000,7天,江苏省-镇江市-市辖区,筑8设计,https://task.epwk.com/javascript:;
【复式设计】小户型复式装修设计,https://task.epwk.com/963932/,195人,1人,¥1000,圆满完成,雇佣,k9978****2,设计风格：日式风，单层面积60平，楼上2个房间,2021.10.02,2021.10.12,任务编号：963932,￥1000,5天,湖北省-孝感市-市辖区,王本设计机构,https://task.epwk.com/javascript:;
【导视设计】生物制药厂导视设计,https://task.epwk.com/963909/,524人,1人,¥40000,圆满完成,雇佣,k7526****7,我需要整套的导视设计，工业厂房，有做过类似项目的优先。,2021.10.02,2021.10.11,任务编号：963909,￥40000,3天,江西省-上尧市-市辖区,天异视觉设计,https://task.epwk.com/javascript:;
【复式设计】复式办公室装修设计,https://task.epwk.com/963933/,273人,1人,¥3000,圆满完成,雇佣,k6198****9,办公室装修设计风格：现代，简约，时尚，大气。功能分区要明显，3个独立办公室，一楼做前台和茶水间,2021.10.02,2021.10.12,任务编号：963933,￥3000,3天,湖南省-常德市-市辖区,那作创意设计公司,https://task.epwk.com/javascript:;
【医疗机构】康复医院大厅装修设计,https://task.epwk.com/964141/,203人,1人,¥6000,圆满完成,雇佣,k7267****6,大厅要有三部分区域，收银区域，取药处和等候区，简约就好，不用太复杂,2021.10.02,2021.10.12,任务编号：964141,￥6000,3天,浙江省-温州市-市辖区,A+图纸深化设计,https://task.epwk.com/javascript:;
【样板间】2居简约样板间设计,https://task.epwk.com/964120/,456人,2人,¥1500,圆满完成,雇佣,k4128****6,是一套90平2居房，整体要布局合理，搭配时尚,2021.10.02,2021.10.16,任务编号：964120,"￥1500,￥1500","5天,5天","湖北省-孝感市-市辖区,陕西省-西安市-市辖区",大地空间概念设计,https://task.epwk.com/javascript:;
【工程造价】房屋建筑工程造价,https://task.epwk.com/964771/,472人,1人,¥4000,圆满完成,雇佣,k4664****6,6层以下居住房屋建筑，做一个整套的工程预算,2021.10.02,2021.10.12,任务编号：964771,￥4000,5天,山东省-潍坊市-市辖区,苏舒设计工作室,https://task.epwk.com/javascript:;
【医疗机构】儿童眼科医院设计,https://task.epwk.com/964140/,509人,2人,¥3000,圆满完成,雇佣,k6379****7,医院主营儿童近视、弱视矫正治疗。风格：可带有卡通元素，前台带有医院logo，有企业墙和党政宣传栏,2021.10.02,2021.10.12,任务编号：964140,"￥3000,￥3000","3天,5天","湖北省-襄阳市-市辖区,江西省-南昌市-市辖区",九毫米空间设计,https://task.epwk.com/javascript:;
【自建房】求自建房装修方案,https://task.epwk.com/963311/,193人,1人,¥1000,圆满完成,雇佣,k9095****8,面积：80平地基，三层框架结构。需求：1、内部布局可稍作调整，二楼需带阳台，主卧要求有洗手间。2、整体风格简洁、偏时尚，耐看，目前外墙个人倾向涂料。3、外观3D效果图和简单的施工方案说明；4、平面布置图、水电布置图、大厅、厨房和主要房间的效果图。,2021.10.02,2021.10.13,任务编号：963311,￥1000,6天,湖北省-孝感市-市辖区,k519318507,https://task.epwk.com/javascript:;
【娱乐休闲】酒店房间设计,https://task.epwk.com/962939/,227人,1人,¥2000,圆满完成,雇佣,k9508****4,设计要求：地面装修考虑地毯，卫生间与卧室隔墙采用玻璃隔断或实墙加玻璃窗隔断，或装修费用在5万左右。,2021.10.01,2021.10.13,任务编号：962939,￥2000,3天,江苏省-南京市-市辖区,方向店铺设计,https://task.epwk.com/javascript:;
【娱乐休闲】五星酒店江景房房间设计,https://task.epwk.com/962940/,170人,1人,¥2500,圆满完成,雇佣,k7614****5,套内面积67平方米，风格：简欧、低调奢华、温馨。本房间东面为江景。要求布局合理，功能实用，充分考虑入住客人的心理需求,2021.10.01,2021.10.15,任务编号：962940,￥2500,5天,江苏省-南京市-市辖区,九毫米空间设计,https://task.epwk.com/javascript:;
【医疗机构】男性专科医院装修设计,https://task.epwk.com/962702/,181人,1人,¥3000,圆满完成,雇佣,k8545****5,大厅涵盖前台、挂号、取药、收费区，每层都要有护士站，病房是2-3人间,2021.10.01,2021.10.12,任务编号：962702,￥3000,3天,贵州省-贵阳市-市辖区,静阁空间设计,https://task.epwk.com/javascript:;
【样板间】360度全景样板间设计,https://task.epwk.com/962696/,338人,1人,¥1500,圆满完成,雇佣,k3019****5,售楼处360度全景样板间，有立体感，布局合理,2021.10.01,2021.10.12,任务编号：962696,￥1500,5天,浙江省-杭州市-市辖区,格律设计,https://task.epwk.com/javascript:;
【工程造价】市政排水工程造价！急！！,https://task.epwk.com/961324/,524人,1人,¥5000,圆满完成,雇佣,k2005****1,1.人行道： 花岗岩12300平米，50*25*4CM、2.立缘石： 花岗岩2400米，90*12*35CM 3.卧石： 花岗岩2250米，45*30*9cm 4.平缘石： 花岗岩1798米，120*10*20 5.管道 (钢混II级承插） D300 135米 D500 220米 D600 949米 D800 860米 6.∮1250检查井27 个 .∮1000检查井36个。7.砖砌偏沟式雨水口 66个,2021.10.01,2021.10.14,任务编号：961324,￥5000,5天,浙江省-杭州市-市辖区,夏鼎设计,https://task.epwk.com/javascript:;
【娱乐休闲】酒店大堂水吧设计装修,https://task.epwk.com/962704/,218人,1人,¥1500,圆满完成,雇佣,k8545****5,在一个温泉酒店的中厅设计一个水吧。要求：西式酒吧风格的水吧，材质要求是玻璃透明的，要有一个可以展示红酒的展架。,2021.10.01,2021.10.15,任务编号：962704,￥1500,5天,河北省-石家庄市-市辖区,玖猫设计工作室,https://task.epwk.com/javascript:;
【样板间】vr样板间设计图,https://task.epwk.com/962697/,369人,1人,¥3000,圆满完成,雇佣,k4786****8,样板间需要VR图、分布效果图、施工图（简约时尚风格 黑白灰，主色：灰色）,2021.10.01,2021.10.10,任务编号：962697,￥3000,3天,湖北省-孝感市-市辖区,君道空间设计,https://task.epwk.com/javascript:;
【娱乐休闲】毛坯房-KTV设计,https://task.epwk.com/961322/,249人,3人,¥1200,圆满完成,雇佣,k9772****7,面积：250平，设计要求：每个房间不同风格，主题包厢。元素：个性、年轻、时尚,2021.10.01,2021.10.11,任务编号：961322,"￥1200,￥1200,￥1200","3天,5天,5天","陕西省-西安市-市辖区,新疆-乌鲁木齐市-市辖区,安徽省-芜湖市-市辖区",拍档设计,https://task.epwk.com/javascript:;
【医疗机构】社区门诊部,https://task.epwk.com/962700/,280人,1人,¥2000,圆满完成,雇佣,k3796****7,面积：600，一共需要7间诊室，一个注射大厅，风格白色为主,2021.10.01,2021.10.13,任务编号：962700,￥2000,6天,甘肃省-兰州市-市辖区,k531286305,https://task.epwk.com/javascript:;
【样板间】欧式样板间设计,https://task.epwk.com/961320/,364人,1人,¥1000,圆满完成,雇佣,k3011****5,装修风格：欧式现代/古典，厅室：2房1厅,2021.10.01,2021.10.14,任务编号：961320,￥1000,6天,浙江省-杭州市-市辖区,乔治室内设计,https://task.epwk.com/javascript:;
【医疗机构】宠物医院整体装修设计,https://task.epwk.com/962701/,429人,3人,¥2000,圆满完成,雇佣,k1355****2,风格：简约干净，靠墙一侧要工作人员办公区域，另一侧有货架摆放宠物用品，要有三处操作台供宠物洗澡美容,2021.10.01,2021.10.13,任务编号：962701,"￥2000,￥2000,￥2000","5天,5天,5天","吉林省-吉林市-市辖区,黑龙江省-哈尔滨市-市辖区,青海省-西宁市-市辖区",清晰空间设计,https://task.epwk.com/javascript:;
【复式设计】洋房复式装修设计,https://task.epwk.com/962467/,579人,1人,¥15000,圆满完成,雇佣,k6758****8,负一楼毛胚挑高5.1米做一个夹层（标准层高）下面一层矮一点，功能区格局有大概整理好了可看附件，前后两个花园简单设计一下主要是南面的。面积一楼产权102套内估计90多点，楼下是一楼的投影面积+3个车位的面积。,2021.10.01,2021.10.12,任务编号：962467,￥15000,5天,上海市-上海市-市辖区,鑫博新设计,https://task.epwk.com/javascript:;
【复式设计】复式书房设计,https://task.epwk.com/961319/,483人,2人,¥800,圆满完成,雇佣,k4915****6,想把楼上做成书房，屋顶是斜面，楼梯最好可以做成折梯,2021.10.01,2021.10.13,任务编号：961319,"￥800,￥800","3天,5天","上海市-上海市-市辖区,云南省-昆明市-市辖区",思间设计中心,https://task.epwk.com/javascript:;
【复式设计】一层半复式阁楼设计,https://task.epwk.com/962466/,318人,1人,¥4000,圆满完成,雇佣,k2938****5,阁楼最高部分为2.9M，阁楼全部为挑空，我会将挑空部分全部搭建楼板，厨房与客厅的强会部分拆除，增加房屋的透光,2021.10.01,2021.10.13,任务编号：962466,￥4000,6天,湖北省-孝感市-市辖区,品言设计空间,https://task.epwk.com/javascript:;
,,,,,,,,,,,,,,,,
【导视设计】需要设计地产标识导视系统,https://task.epwk.com/961318/,540人,2人,¥10000,圆满完成,雇佣,k8385****6,要有导视牌，指示牌，索引牌，小区标识牌，温馨提示牌，停车场牌，宣传栏等,2021.10.01,2021.10.14,任务编号：961318,"￥10000,￥10000","6天,6天","河南省-新乡市-市辖区,江西省-南昌市-市辖区",思间设计中心,https://task.epwk.com/javascript:;
【复式设计】复式第二层楼顶装修设计,https://task.epwk.com/962465/,227人,1人,¥1000,圆满完成,雇佣,k7431****1,复式第二层楼顶太低感觉很压抑，想把窗户扩大采光好一点，,2021.10.01,2021.10.12,任务编号：962465,￥1000,6天,安徽省-芜湖市-市辖区,k961182550,https://task.epwk.com/javascript:;
【医疗机构】美容医疗机构,https://task.epwk.com/961321/,154人,1人,¥1000,圆满完成,雇佣,k3272****4,面积：130平，层高4.5米，一楼，会客区，消毒间，员工休息间，卫生间，洗毛巾，配料间，前台,2021.10.01,2021.10.12,任务编号：961321,￥1000,6天,安徽省-合肥市-市辖区,俱东风文创设计,https://task.epwk.com/javascript:;
【医疗机构】中医诊所办公室装修设计,https://task.epwk.com/962703/,465人,2人,¥5000,圆满完成,雇佣,k1906****3,风格：简约大气，一楼接待大厅，二楼医生办公室3间，财务室1间，会议室1间。尽量节约，不要太复杂,2021.10.01,2021.10.12,任务编号：962703,"￥5000,￥5000","5天,5天","广东省-深圳市-市辖区,河南省-商丘市-市辖区",所见空间设计,https://task.epwk.com/javascript:;
【医疗机构】中医院整体装修设计,https://task.epwk.com/966863/,191人,1人,¥5000,圆满完成,雇佣,k9765****7,两层，风格：中式风格。要求：一楼导诊台、取药处、等候区。二楼五间医生诊室、等候区、财务室,2021.09.30,2021.10.12,任务编号：966863,￥5000,6天,上海市-上海市-市辖区,筑8设计,https://task.epwk.com/javascript:;
【娱乐休闲】很简单的酒店大厅设计,https://task.epwk.com/967736/,243人,1人,¥1000,圆满完成,雇佣,k5564****5,尺寸空间自己定，设计出来的效果图真实感要强，大厅前台的背景墙上需要logo,2021.09.30,2021.10.12,任务编号：967736,￥1000,3天,福建省-福州市-市辖区,k374008976,https://task.epwk.com/javascript:;
【娱乐休闲】宾馆客房设计,https://task.epwk.com/967737/,226人,1人,¥2000,圆满完成,雇佣,k2327****8,洗手间标高2.55  客房标高2.75。期待设计出风格时尚 精致 有特色的原创作品,2021.09.30,2021.10.10,任务编号：967737,￥2000,5天,辽宁省-葫芦岛市-市辖区,尚淼设计,https://task.epwk.com/javascript:;
【自建房】老家自建房两层,https://task.epwk.com/966573/,157人,1人,¥1000,圆满完成,雇佣,k6178****6,房屋坐北朝南，一楼占地开间7.5米～进深10米。东南西面可开窗，房子后面不能开窗，二楼前面飘1.5米,2021.09.30,2021.10.11,任务编号：966573,￥1000,3天,上海市-上海市-市辖区,银翼效果图设计表现,https://task.epwk.com/javascript:;
【样板间】售楼部样板间设计,https://task.epwk.com/971304/,197人,1人,¥3000,圆满完成,雇佣,k4406****7,户型为两房一厅一卫和三方两厅一卫，要宽敞明亮，风格要简约,2021.09.30,2021.10.12,任务编号：971304,￥3000,3天,四川省-成都市-市辖区,名视设计,https://task.epwk.com/javascript:;
【复式设计】复式洋房庭院设计,https://task.epwk.com/971329/,145人,1人,¥1000,圆满完成,雇佣,k4790****7,装修风格：田园风格，面积：50平米，总面积约为7*7的正方形，出门正对靠山的斜坡。两侧一面是高墙，一面是铁栅栏,2021.09.30,2021.10.11,任务编号：971329,￥1000,3天,江苏省-南京市-市辖区,婴知道设计,https://task.epwk.com/javascript:;
【娱乐休闲】图书馆休闲区设计布置,https://task.epwk.com/967738/,184人,1人,¥2000,圆满完成,雇佣,k5799****1,进门口为服务区，设计服务台。空间分为图书区（书架），阅览区（桌椅），休闲区（休闲桌椅或沙发等），空间搭配合理，产品设计美观。,2021.09.30,2021.10.11,任务编号：967738,￥2000,5天,河南省-商丘市-市辖区,梵不高设计,https://task.epwk.com/javascript:;
【医疗机构】女性专科医院装修设计,https://task.epwk.com/966862/,250人,2人,¥10000,圆满完成,雇佣,k4880****1,面积：2508.37，共5层，一楼是接待区，二楼是诊室，三楼是手术区，四楼五楼是病房。风格是粉色的暖色调为主,2021.09.29,2021.10.15,任务编号：966862,"￥10000,￥10000","6天,7天","内蒙古-赤峰市-市辖区,山东省-潍坊市-市辖区",拓昇装饰设计工程,https://task.epwk.com/javascript:;
【娱乐休闲】360平米养生会所整体装修设计,https://task.epwk.com/967734/,182人,1人,¥1500,圆满完成,雇佣,k9340****0,面积：360平米，风格与养生主题相关即可，看起来要舒适典雅,2021.09.29,2021.10.11,任务编号：967734,￥1500,5天,福建省-福州市-市辖区,千唐装饰设计,https://task.epwk.com/javascript:;
【医疗机构】社区医院装修设计,https://task.epwk.com/966861/,86人,1人,¥1000,圆满完成,雇佣,k1880****2,主要有内科、呼吸科、小儿科。共两层，一楼是导诊台和药房，二楼是诊室。风格要简约,2021.09.29,2021.10.14,任务编号：966861,￥1000,5天,天津市-天津市-市辖区,骏邦设计,https://task.epwk.com/javascript:;
【复式设计】复式别墅设计,https://task.epwk.com/971327/,308人,1人,¥10000,圆满完成,雇佣,k9732****0,面积：247，整体风格：徽派现代 ，简约不简单，有足够的创意设计 。能给人足够的惊喜，不需要太多的奢华元素，但要实用、温馨，有休闲、休憩空间 。,2021.09.29,2021.10.12,任务编号：971327,￥10000,5天,湖南省-常德市-市辖区,永空间设计,https://task.epwk.com/javascript:;
【娱乐休闲】私房菜店面设计,https://task.epwk.com/967733/,387人,1人,¥1200,圆满完成,雇佣,k7893****2,店铺一共两层，共200平。1、店面时尚、大气、整洁、高档，有连锁店的形象和感觉。2、二楼可以设计成隔断,2021.09.29,2021.10.11,任务编号：967733,￥1200,4天,北京市-北京市-市辖区,谷瑞空间营造设计工作室,https://task.epwk.com/javascript:;
【医疗机构】试管医院一楼大厅设计,https://task.epwk.com/966859/,110人,1人,¥1000,圆满完成,雇佣,k1939****6,走廊和候诊厅应宽敞明亮，标识鲜明。候诊厅周围设护士站、问讯处、卫生间等辅助设施。,2021.09.28,2021.10.12,任务编号：966859,￥1000,5天,浙江省-丽水市-市辖区,感觉空间设计,https://task.epwk.com/javascript:;
【医疗机构】需要给口腔医院做整体设计,https://task.epwk.com/966860/,246人,1人,¥5000,圆满完成,雇佣,k3483****2,一楼负责接待和咨询，等候区布局要有沙发和书刊给病人。所有诊室的墙面要用耐腐蚀、易清洁的材料,2021.09.28,2021.10.11,任务编号：966860,￥5000,5天,广东省-汕头市-市辖区,k519318507,https://task.epwk.com/javascript:;
【娱乐休闲】五星级酒店美容Spa会所接待厅设计,https://task.epwk.com/967730/,182人,1人,¥500,圆满完成,雇佣,k8385****6,要求能体现美容会所特征，高端，大气，上档次。另外还有一块背景墙，该背景墙宽6.4米，高2.4米,2021.09.28,2021.10.12,任务编号：967730,￥500,3天,浙江省-温州市-市辖区,华艺装修设计,https://task.epwk.com/javascript:;
【娱乐休闲】楼盘休闲体验厅装修设计,https://task.epwk.com/967731/,166人,1人,¥500,圆满完成,雇佣,,,,,,,,,,
【自建房】自建房自住设计,https://task.epwk.com/966572/,254人,1人,¥1000,圆满完成,雇佣,k4188****5,一楼是车库。从第二层起，南面可向外跳1.3-1.5米，东面可向外跳0.6米；朝向：正门朝南面，背朝北面(为方便方向描述，以正门的方向为正面);东面自二楼以上与旁边的房子间隔0.6米，除过道外尽量不要开窗；西面自一楼起与隔壁房子间隔0.2米，除过道外尽量不要开窗;,2021.09.27,2021.10.07,任务编号：966572,￥1000,3天,湖北省-孝感市-市辖区,空间展示设计,https://task.epwk.com/javascript:;
【自建房】两层自建房设计做商铺用,https://task.epwk.com/966571/,392人,2人,¥1000,圆满完成,雇佣,k4291****5,第一层做门面，商铺设计，带厨房，卫生间，卧室，和车库。夹层带厨卫。二层中间一条通走廊，前面独立单间，后面做一个小套间带厨卫，计划做宾馆房或茶楼小型手游开发。,2021.09.27,2021.10.06,任务编号：966571,"￥1000,￥1000","3天,5天","浙江省-杭州市-市辖区,四川省-成都市-市辖区",顶构定制家具展厅设计,https://task.epwk.com/javascript:;
【样板间】我需要商品房的样板间设计,https://task.epwk.com/967852/,212人,1人,¥2000,圆满完成,雇佣,k8363****8,1.客厅前面大阳台与客厅合并 2.阳台设计洗衣烘干设备并有隐形的晾衣设备 3.客厅或餐厅一侧设置长条的贮藏柜 4.还要设置1500*600钢琴放置位置,2021.09.27,2021.10.08,任务编号：967852,￥2000,3天,上海市-上海市-市辖区,山东北川设计,https://task.epwk.com/javascript:;
【其他家装服务】8平方平面图施工图设计,https://task.epwk.com/957352/,373人,1人,¥100,圆满完成,雇佣,邬路遥,水电图铺砖图墙面图（护墙板）吊顶图（格栅）前台沙发布局图,2021.09.26,2021.09.28,任务编号：957352,￥100,1天,山西省-晋中市-榆次区,米兰全案设计,https://shop.epwk.com/09drj1qx353w/
