标题,查看数,参与数,需求价格,状态,需求方,需求文本,发布时间,完成时间,任务编号,交易价格,参与交稿,设计师,设计师类型,设计师等级,设计师信用,交易总次数,交易总金额,服务1,价格1,服务2,价格2,服务3,价格3,服务4,价格4,服务5,价格5,服务6,价格6,服务7,价格7,服务8,价格8,服务9,价格9
【广告策划】广告语征集,35134人,492人,¥500,圆满完成,mf180****8691,需要给本公司的蛋糕制作广告用语，主要要突出蛋糕里的鲜水果，把蛋糕和水果结合在一起，特出蛋糕鲜的特点和里面具有水果成分1、广告语要6到8个字 ，要用常用字2，要简短精简， 3，我们的蛋糕用的都是新鲜的水果，要突出蛋糕里的鲜水果,2015.09.07,2015.10.10,任务编号：378047,￥ 500,,图文春秋,个人,七品,37分,,,,,,,,,,,,,,,,,,,,
【店铺/网店起名】给一个钢琴凳的店铺取名字,10906人,117人,¥100,圆满完成,mf152****6529,要开一个专门卖钢琴凳的旗舰店，希望起一个欧洲范的名字，古典韵味的那种。,2015.09.07,2015.10.01,任务编号：378007,￥ 100,,意点品牌策划,,,,,,,,,,,,,,,,,,,,,,,
【店铺/网店起名】早餐店取名,16302人,212人,¥200,圆满完成,o55ec0a855a73b,早餐店以粉面为主，装修高档，店名易记！,2015.09.06,2015.10.08,任务编号：377865,￥ 200,,中国好点子,个人,七品,37分,,,,,,,,,,,,,,,,,,,,
【品牌起名】日用化化妆品品牌起名,13416人,126人,¥200,圆满完成,mf138****9069,"想要高端的风格，因为申请注册商标的，很难通过，所以要有创意、独特，字不要太过简单，能提供更多，已供选择。要求：1、名称朗朗上口，易记易传播2、最好有中、英文两种名称，字数：2—3个，并可注册商标3、附上创意说明。知识产权说明：1、所设计的作品为原创，为第一次发布，未侵犯他人的著作权，如有侵犯他人著作权，由设计者承担所有法律责任;2、中标的设计作品，我方支付设计制作费，即拥有该作品的知识产权，包括著作权,使用权和发布权等,有权对设计作品进行修改,组合和应用;设计者不得再向其他任何地方使用该设计作品谢谢！",2015.09.06,2015.10.04,任务编号：377866,￥ 200,,五艺之星,,,,,,,,,,,,,,,,,,,,,,,
【公司起名】服装（商标）辅料公司取一个公司名字,11037人,64人,¥100,圆满完成,o55eae7ab47e7a,我们是一家在上海做服装辅料，服装商标的公司，现在打算注册一个公司，希望可以根据我们公司的特性，取一个2--3个字 的名字，要求：1  没有被注册过，  2   名字好记，大气，朗朗上口，高端，国际化一点，中英文！      格式：  上海××服装辅料有限公司        后期 还有LOGO 和宣传单的设计。  希望大神们可以开动脑筋，帮我们想想。,2015.09.05,2015.10.09,任务编号：377648,￥ 100,,竹叶常青设计工作室,,,,,,,,,,,,,,,,,,,,,,,
【公司起名】影视传媒公司起名,3410人,151人,¥200,圆满完成,皇邦,"时装影视传媒公司名称征集，本公司位于广州。  产品主要三类： 1、经营介绍：主营影视摄影、个人艺术微电影、婚纱微电影、儿童艺术微电影、主要针对时尚中高端女性为主2、时尚时装私人定制3、个人形象设计及色彩诊断要求： 1、名字高端大气、有创意、有深度、有品位响亮、易记、个性十足2、要有中英文两种名称（并可注册商标）3、附上创意说明知识产权说明： 1、所设计的作品为原创，为第一次发布，未侵犯他人的著作权，如有侵犯他人著作权，由设计者承担所有法律责任; 2、中标的设计作品，我方支付设计制作费，即拥有该作品的知识产权，包括著作权,使用权和发布权等,有权对设计作品进行修改,组合和应用;设计者不得再向其他任何地方使用该设计作品;",2015.09.02,2015.10.08,任务编号：377230,￥ 200,,mf18761420955,,,,,,,,,,,,,,,,,,,,,,,
【品牌起名】灵璧石、灵璧石艺术品品牌、公司起名,19376人,218人,¥800,圆满完成,eastbw,"灵璧石工艺品品牌起名，同时也是公司的名字，我们是全国前三的灵璧石藏家，公司主营业务有灵璧石销售（主要客户群是50-60后）、灵璧石艺术品、工艺品、各种奇石艺术品、工艺品（奇石与不锈钢、铁艺、玻璃、木艺等现代艺术相结合）销售（主要客户群是70、80、90后）、园林假山，风水等；要求：1、因为灵璧石以黑色为主，所以倾向。   于“黑”字开头的名字；我最喜欢的名字是“黑马”，但是注册不了；（字数不限），可以是黑熊、黑驴（只是举例）等动物；也可以是卡通人物；也可以是来自古代的任何一本书或一段诗词；也可以是任何虚幻的物品；名字的来源范围不限；但因为灵璧石是很有文化底蕴与历史的物品，所以名字一定要有文化内涵，要大雅；名字要有前瞻性，以后成立集团公司，此名字会作为集团公司的名字；中英文都要可以注册；附上创意说明2、公司的后缀用什么比较高大上？？？帮忙想一下，品牌名字也是公司名字，比如：黑马文化发展有限公司；黑马投资有限公司；黑马实业有限公司；黑马创投……等等哪个比较好？3、老板是“包公”后代，名字如果能与包公扯上点关系就最好，但切记不要牵强；4、英文名要有创意，要放眼世界，可注册、寓意好；中英文都要可以注册；附上创意说明5、要可以注册的域名和一句响亮的广告语；6、建议各位创意前最好先百度一下灵璧石与包公，以助力各位能创意出更加贴切的名字7、附件中我会附上灵璧石与我生产奇石工艺品8、我会设2名入围奖，即使没入围，只要其中任一创意好（比如广告语不错），我都会发不低于200的红包二、知识产权说明：1、所设计的作品为原创，为第一次发布，未侵犯他人的著作权，如有侵犯他人著作权，由设计者承担所有法律责任;2、中标的设计作品，我方支付设计制作费，即拥有该作品的知识产权，包括著作权,使用权和发布权等,有权对设计作品进行修改,组合和应用;设计者不得再向其他任何地方使用该设计作品;PS:目前没有特别满意的稿件，以“黑”字开头不是绝对的，后续交稿不用以黑开头。",2015.09.02,2015.10.05,任务编号：377005,￥ 800,,mf13424275383,,,,,,,,,,,,,,,,,,,,,,,
【广告策划】【悬赏】女装公司品牌受众人群、品牌名称以及经营理念广告语原创征集,7138人,47人,¥100,圆满完成,xiangwan04551,悬赏女装公司品牌受众人群、品牌名称以及经营理念广告语原创征集。征集整体一套三个点：1、品牌的受众人群，就是品牌针对的是哪一类人群，比如喜欢小清新类的，或者文艺范的，或者韩版的，或者日系的等等。2、品牌名称：字数不限，尽量简洁一点4字左右比较好。3、经营理念：用一句话展现经营理念，要能打动受众人群，简洁而又有创意。范围是18-29岁的人群女装。要求以上三个点要互相匹配，需要原创，不能抄袭别人的。,2015.09.01,2015.10.23,任务编号：376902,￥ 100,,小飞侠170,,,,,,,,,,,,,,,,,,,,,,,
【公司起名】文化娱乐电商平台名称及释义征集活动(不需要设计，只是想个名称即可),5537人,27人,¥100,圆满完成,xuhaojay,"华夏美食网是整个中部地区规模、品类均占行业领先地位的B2C电子商务企业，华夏美食网具有国际领先水平的电子商务管理系统，并在平台、采购、仓储、配送、和用户体验等方面大力投入，打造自身的核心竞争力，华夏美食网要让中国数亿的家庭用户，足不出户，便能享受一站式网上购物的便捷和乐趣。目前，华夏美食网正蓬勃发展，公司决定，继续投入资金，成立一家文化娱乐电商平台，主要做艺术品、收藏品，以及剧院，演艺圈代言等业务；现面向全社会征集文化娱乐平台名称及释义征集活动，诚挚邀请社会各界有高端品牌发展经验的创作者，以个人或机构的身份积极参与，踊跃投稿。一、征集内容：文化娱乐平台名称及释义，名称包括中文名称二、作品设计要求：1、品牌名称要有鲜明的象征意义和文化内涵，能寓意文化娱乐的核心理念及特点，体现出文化娱乐的“厚重、高雅、时尚”的品牌形象。2、品牌名称主题鲜明，寓意丰富，简洁明快，大气稳重，具有较强的听觉感染力。三、征集截稿时间：2015年9月8日下午5点四、作品提交方式：1、请严格按照要求在下面把您想到的名称；理念，寓意列出，并附上必要的附件，另外请写上你的作品名称，提交在一品平台的同时，通过E-mail方式将作品发送至xuhao@hxms.cn，同时注明参赛作者姓名、联系方式、地址。邮件标题格式为“文化娱乐品牌名称及释义征集---作者姓名”。2、提交的作品内容包括品牌名称、品牌释义、创意说明及寓意。3,未尽事宜，请拨打华夏美食网官方客服热线：400-6879-689五、评选及奖项：1、本次征集活动将聘请有关专家组成评审委员会，从名称、释义、寓意等方面对投稿作品进行投票评选。2、应征个人（或机构）在应征过程中产生的一切费用自理。3、获奖者需按照国家的有关法律进行纳税。六、版权归属：1、应征作品必须是作者原创，未曾发表，不得侵犯他人著作权，不得违反任何法律法规。若有侵权或违法，责任自负。2、应征作品不得含有任何涉嫌民族歧视、宗教歧视或其他有悖于社会道德风尚的内容。3、除署名权由作者保留外，获奖作品的著作权及其他权利均归华夏美食网所有，未经允许，任何组织和个人不得擅自使用。华夏美食网有对设计不完善之处进行修改的权利。届时，除获奖奖金外，不再支付给创作者任何费用。                                                                                                                                                                                                                                                                                                                                                                             华夏美食网                                                                                                            2015年9月1日",2015.09.01,2015.09.24,任务编号：376752,￥ 100,,疯狂的小象.起名+logo+商标注册,个人,九品,37分,,,,,,,,,,,,,,,,,,,,
【公司起名】公司网站取名，以 inso 字母取名,7888人,90人,¥100,圆满完成,News,公司网站取名（以 inso 字母取名） 说出所取名字的含义，中文名字需和字母读音接近。注：（易搜，英索，应搜）此几个名字不纳入筛选。 名字只能 两个汉字，要求：读说易通好记，普通话和各家乡话读说简易。文字需要简介明了，不宜过多繁杂笔画。,2015.09.01,2015.12.21,任务编号：376793,￥ 100,,忆仙工坊,,,,,,,,,,,,,,,,,,,,,,,
【品牌起名】产品取名,20152人,230人,¥500,圆满完成,众熙,主营产品：日式烤鳗(零售)联系方式：1、设计者在投稿阶段附上QQ和电话等联系方式，方便及时沟通。2、如须沟通可站短、QQ或QQ邮箱我方联系QQ：2734566913。3、名字必须注册使用。,2015.09.01,2015.09.15,任务编号：376788,￥ 500,,妙笔生文案,工作室,五品,45分,,,各类中文、英文起名,￥360,广告语、宣传口号,"￥200
            /件",演讲稿代写,"￥240
            /件",软文写作,价格面议,,,,,,,,,,
【品牌起名】XX易物公司品牌英文名,10543人,106人,¥400,圆满完成,eastbw,XX换货网（也叫XX易物，公司经营范围可以参照“易物天下”，百度一下），包括线上与线下，公司的主旨是帮助企业间搭建一个换货平台，帮助企业以货易货，不花钱购物，目标是走向全球，做换货界的阿里巴巴。一、中文名暂定：书瑶（如果你有更好的中文名也可以提供），中文要求：易记、易识别、朗朗上口、简洁明快、古朴典雅，让人耳目一新；二、主要是“书瑶”这个服务品牌的英文名，最好是自创词，寓意好，与我们的服务相关。能体现服务创造价值、搭建平台等功能最好；能注册；三、XX换货网、换货会，易物网，这些后缀再帮我斟酌一下选哪个好。四、给出的名字要有详细的说明。五、中标者我们会有后续的很多的后续服务可以合作，还有另外一个品牌需要起名字；如果名字非常满意，我会给中标者发额外红包；同时，会给至少两位入围者不低于一百的红包；六、如果你特牛也可以联系我；备注：1.中文名是书瑶，是一个人名，跟书本没有关系。2.英文名和域名一定要是原创的，要可以使用的。,2015.08.31,2015.10.03,任务编号：376703,￥ 400,,半爿设计,,,,,,,,,,,,,,,,,,,,,,,
【公司起名】婚庆服务交易平台起名及广告语,6905人,67人,¥388,圆满完成,粒子流设计策划,"我们是一家网络科技公司，致力于打造国内最专业的婚庆服务交易平台
可以简单的这么理解，就好像上淘宝人们通常会去买衣服买鞋子等实物商品
而在我们这个网站平台上，可以进行司仪，摄影摄像，花车，化妆，场地布置等等所有和婚庆礼仪有关的服务的交易
本公司发展于南京，但是业务范围不限于本地，致力于全国

要求：
1，希望是四个字的名字（但是不局限于四个字）
2，我个人建议类似于“一品威客”这个名字的感觉，“一品”说明了档次上乘，“威客”明确的说明了行业特征，
3，威客们起名时不限于以上限制，名字不要有地理限制，让人一看就感觉是全国化的
4，除了起名，还要写一句广告语，（类似于：雀巢咖啡，味道好极了），中标威客的前提是这个名字要能在工商部门注册
5，不要打电话给我
~~~~~~~~~~
6，后续还将委托做一个logo",2015.08.31,2015.09.05,任务编号：376570,￥ 388,,厦门大鱼广告有限公司,,,,,,,,,,,,,,,,,,,,,,,
【品牌起名】设计、生产、销售棉花被（棉絮）的公司征集名字,8803人,89人,¥100,圆满完成,wusu2009,"经营范围：棉花被（棉絮）的设计，生产，销售棉花产地：新疆吐鲁番目标人群：18至29岁，比较注重健康，对生活品质比较在意的年轻人销售途径：电商平台品牌诉求：最纯净的棉絮详细需求：望各位小主帮忙给公司起个名字，要求：1、符合我们从事的事情，2、生动、符合互联网调性，3、迎合年轻人的喜好，4、尽量简洁易懂，5、附上名字含义产权说明：1、所创作的名字为原创，为第一次发布，为未被他人使用的（投稿前建议上网搜一下是否被使用）;2、中标名字我方支付创意服务费（即赏金）后，即拥有该作品的知识产权，包括著作权,使用权和发布权等;创作者不得在其他任何地方使用该名字。（留的电话是随便写的，骚扰电话太多了）",2015.08.29,2015.09.23,任务编号：376291,￥ 100,,佐易工作室,,,,,,,,,,,,,,,,,,,,,,,
【品牌起名】药店起名字,12242人,177人,¥300,圆满完成,chenshun7898,起个可以注册零售药店品牌名字，名字要有特点，一听就是药店的名字，名字不要带（堂）字：必须要可以注册的药店品牌名，注册35类和5类,2015.08.28,2015.09.18,任务编号：376128,￥ 300,,竹叶常青设计工作室,,,,,,,,,,,,,,,,,,,,,,,
【公司起名】商标命名,7806人,92人,¥150,圆满完成,奋起的猎人,需求，能通过商标注册，31大类。要求，体现生态农业，原始本真的含义。联系QQ：312744271,2015.08.28,2015.12.17,任务编号：375997,￥ 150,,沽名钓誉,,,,,,,,,,,,,,,,,,,,,,,
,,,,,,,,,,,,,,,,,,,,,,,,,,,,,,,,,,,
【品牌起名】男士皮鞋品牌起名,12637人,184人,¥100,圆满完成,好人一枚,公司主要经营男士休闲皮鞋，现在要起一个品牌名要求：1.简单好记，不拗口2.因为是男鞋所以不要起女性化的名字3.一定要是可以注册的，这一点非常重要,2015.08.28,2015.09.12,任务编号：375967,￥ 100,,星橙设计QQ1356183009,,,,,,,,,,,,,,,,,,,,,,,
【店铺/网店起名】水果连锁店起名,15567人,201人,¥100,圆满完成,mf137****2278,给水果连锁店起个名字，字数不限，要求时尚易上口,2015.08.27,2015.09.16,任务编号：375906,￥ 100,,华隆,,,,,,,,,,,,,,,,,,,,,,,
【品牌起名】五金锁具商标命名,6073人,41人,¥200,圆满完成,Hu781120,五金锁具中英文命名英文要求发音简短，易识别，易记忆，有含义中文名称要求字形简单，有美好形象的含义。中英文最好能结合起来,2015.08.27,2015.09.01,任务编号：375898,￥ 200,,乐活创享,,,,,,,,,,,,,,,,,,,,,,,
【品牌起名】品牌英文名取名,7652人,61人,¥100,圆满完成,o5450cb4b59e51,品牌中文名字：目艺中文已经在注册，先需要一个英文名字来配合后期的包装设计要求：简单好看些,2015.08.27,2015.11.20,任务编号：375867,￥ 100,,用心2015,,,,,,,,,,,,,,,,,,,,,,,
【店铺/网店起名】店铺取名,11954人,123人,¥300,圆满完成,mf132****0008,1、一店两产品链，左边经营虾蟹等带壳类产品，右边经营鱼类产品；2、店名要简单易懂，最好不要含yu谐音字，；3、所起的名字要能注册，需包含中英文；4、名称要有好的寓意，要有一句广告语；谢谢！,2015.08.26,2015.10.19,任务编号：375653,￥ 300,,意点品牌策划,,,,,,,,,,,,,,,,,,,,,,,
【公司起名】100元征集“金”字开头水果批发贸易公司名字,13427人,151人,¥100,圆满完成,huananmaoyi,100元征集“金”字开头，两个字（含金字）的水果批发贸易公司名字公司性质：泉州水果批发贸易商要求：名字响亮、向上，好的寓意             请简单介绍所取名字的寓意,2015.08.24,2015.09.26,任务编号：375063,￥ 100,,那一家店,,,,,,,,,,,,,,,,,,,,,,,
【宝宝起名】钱姓女宝宝起名,10671人,87人,¥120,圆满完成,mf132****3588,"出生时间：阳历2015年8月24日，上午7：10出生，父亲姓钱，母亲姓管
1、名字要有好的寓意，不俗气，最好带小名
2、和生辰八字，天地五行等对上
3、谢绝电脑起名，谢绝大众名字
4、名字阳光顺口，尽显儒雅气息
5、交稿时附带详尽的寓意及出处，命理分析",2015.08.26,2015.09.21,任务编号：375461,￥ 120,,gxhtyk,,,,,,,,,,,,,,,,,,,,,,,
【公司起名】征集公司起名,8797人,91人,¥300,圆满完成,mf135****6891,现要成立两个电子商务公司，分别为：（1）服装类   （2）电子产品类 ，需要起两个公司名字。      要求：        1、名称富有寓意、简短简洁易记、有创意但不失稳重（必需可注册的公司）；       2、两个字到三个字；       3、我们需要的是原创，不是起名软件，谢谢！请附上创意说明；,2015.08.26,2015.11.20,任务编号：375414,￥ 300,,竹叶常青设计工作室,,,,,,,,,,,,,,,,,,,,,,,
【公司起名】公司起名,8105人,96人,¥200,圆满完成,mf137****8827,要成立一个互联网公司，需要起一个名字，名字要贴近当前的社会文化,2015.08.25,2015.10.04,任务编号：375234,￥ 200,,一点灵感,工作室,九品,36分,,,,,,,,,,,,,,,,,,,,
【公司起名】征集网站英文域名起名,469人,32人,¥300,圆满完成,opspeed,具体设计要求看附件,2015.08.25,2015.09.11,任务编号：375232,￥ 300,,mf18309899332,,,,,,,,,,,,,,,,,,,,,,,
【公司起名】西北凉皮公司字号/品牌起名,8170人,59人,¥100,圆满完成,mf180****3529,"公司位于深圳背景介绍：1、经营内容：主营陕西凉皮、凉粉、凉面、手擀面等西北风味特色小吃加工。2、品牌定位：中高端消费人群，传统凉皮的升级版，本项目走品牌路线。3、客户群体：注重营养、卫生、安全、方便的中高端消费人群4、抽象描述：营养、健康、卫生、安全、天然、绿色。5、产品特色：填加各类蔬菜，营养又健康。要求： 1、名称响亮，易记，文雅，有创意但不失稳重;(必需可以注册公司,深圳市市场监督管理局http://app02.szaic.gov.cn/aiceqmis.webui/GeneralSearch.aspx) 2、公司及品牌名要朗朗上口、不俗气、易记......符合公司起名相关规则，最好能突出西北民族特色文化风情。3、最好有中、英文两种名称，并可注册商标 4、格式：深圳市XXXXXXXXX有限公司5、附上创意说明。 素材提示：凉皮及肉加馍是西北特色小食，习总书记和国民党荣誉主席连战连战是陕西老乡，曾于2014年2月28日设家宴招待连战。 知识产权说明： 1、所设计的作品为原创，为第一次发布，未侵犯他人的著作权，如有侵犯他人著作权，由设计者承担所有法律责任; 2、中标的设计作品，我方支付设计制作费，即拥有该作品的知识产权，包括著作权,使用权和发布权等,有权对设计作品进行修改,组合和应用;设计者不得再向其他任何地方使用该设计作品;",2015.08.25,2015.09.19,任务编号：375202,￥ 100,,意点品牌策划,,,,,,,,,,,,,,,,,,,,,,,
【品牌起名】绿色农业（生鲜果品）商标名称征集,26437人,104人,¥200,圆满完成,cahfzh,"具体设计要求看附件知识产权说明： 1、所设计的作品为原创，为第一次发布，未侵犯他人的著作权，如有侵犯他人著作权，由设计者承担所有法律责任; 2、中标的设计作品，我方支付设计制作费，即拥有该作品的知识产权，包括著作权,使用权和发布权等,有权对设计作品进行修改,组合和应用;设计者不得再向其他任何地方使用该设计作品;",2015.08.24,2015.11.05,任务编号：375072,￥ 200,,mf15755162646,,,,,,,,,,,,,,,,,,,,,,,
【店铺/网店起名】餐厅取名,11953人,125人,¥150,圆满完成,o5587****38903,"我餐厅原用名称:二娃重庆小面但因我司定位为城市连锁快餐厅,目前正处于急速扩张的过程中；原二娃小面感觉比较小气，没有特点，因此为了符合我餐厅的定位，现发布征名任务。任务要求：1、以附件中logo中的图像为原形进行取名，logo中的图像是我小孩的头像卡通化后的头像。2、所取名字必须与孩子有关系：比如：二娃，萌娃娃，福娃，福大头，大耳朵等等3、有创意，独创的，要求能通过商标注册的，比如：取名“大耳朵”；我们商标上注册即为：大耳朵小面4、要求：大气、顺口、活泼、欢乐，易于传博餐厅经营简介5、我店以重庆口味系列面条、米线、酸辣粉、米饭套餐为主营产品6、后期会引进机器人服务员为噱头",2015.08.23,2015.09.28,任务编号：374753,￥ 150,,起名取名+翻译,,,,,,,,,,,,,,,,,,,,,,,
【广告策划】企业网站标语征集,6673人,46人,¥100,圆满完成,o55bf0dc1739e5,要求如下：1、包装、印刷为主题的公司；2、要求主色调蓝色，有地球、中心、范围大而深的感觉；3、一句话标语，精简、上口，有行业感。最好20字以内。,2015.08.24,2015.11.09,任务编号：374888,￥ 100,,人本美名,,,,,,,,,,,,,,,,,,,,,,,
【公司起名】进口公司起名,7189人,70人,¥300,圆满完成,mf130****8558,"进口公司名称征集，是做牛肉进口生意的要求： 1、名称响亮，易记，文雅，有创意但不失稳重;(必需可以注册公司的) 2、名字要体现自己的行业以及主要经营的产品，让人一听就知道自己是做牛肉进口生意的。3.在两个字到三个字之间4、附上创意说明。 5.必须要能够注册的名字知识产权说明： 1、所设计的作品为原创，为第一次发布，未侵犯他人的著作权，如有侵犯他人著作权，由设计者承担所有法律责任; 2、中标的设计作品，我方支付设计制作费，即拥有该作品的知识产权，包括著作权,使用权和发布权等,有权对设计作品进行修改,组合和应用;设计者不得再向其他任何地方使用该设计作品;",2015.08.24,2015.09.10,任务编号：374928,￥ 300,,意点品牌策划,,,,,,,,,,,,,,,,,,,,,,,
