标题,查看数,参与数,需求价格,状态,需求方,需求文本,发布时间,完成时间,任务编号,交易价格,参与交稿,设计师,设计师类型,设计师等级,设计师信用,交易总次数,交易总金额,服务1,价格1,服务2,价格2,服务3,价格3,服务4,价格4,服务5,价格5,服务6,价格6,服务7,价格7,服务8,价格8,服务9,价格9
【公司起名】餐饮管理公司起名,7343人,90人,¥300,圆满完成,mf158****9990,"要求：

1.  新开餐饮管理有限公司，名字要大气不俗，简洁，中英文，要求通过工商局注册（需要提供注册查询切图）

2.说明创意


知识产权说明：
1、所设计的作品必须为原创，未在国家商标局注册过（中国商标网查询地址.saic.gov.cn/trade/，不侵犯他人著作权，如有侵犯他人著作权的由设计者承担所有法律责任。
2、中标的设计作品，我方支付设计制作费，即拥有该作品的知识产权，包括著作权,商业用途，使用权和发布权等,有权对设计作品进行修改,组合和应用;设计者不得再向其他任何地方使用该设计作品。",2015.12.25,2016.01.09,任务编号：398631,￥ 300,,mf13666892707,,,,,,,,,,,,,,,,,,,,,,,
【品牌起名】育儿母婴类app取名,6587人,159人,¥200,圆满完成,o567ca83c0be86,我们是做科学智慧育儿的app，里面的内容包含记录孩子的成长，专题育儿知识，与孩子互动的娱乐任务等功能。对象是爸爸妈妈，可以以动物名或者其他都行，但是要表达科学智慧育儿的主题 最好是2-4个字,2015.12.25,2016.02.13,任务编号：398541,￥ 200,,红枫林,,,,,,,,,,,,,,,,,,,,,,,
【品牌起名】食品品牌取名,4516人,95人,¥200,圆满完成,成都前沿单车,本公司销售 熟食 鸡肉 牛肉 兔丁 板鸭 需要一个品牌名字 希望名字和产品有牵连的比如（周黑鸭 棒棒鸡 久久呀 这样的品牌名字）,2015.12.24,2016.01.18,任务编号：398451,￥ 200,,航嘉山庄,工作室,七品,39分,,,,,,,,,,,,,,,,,,,,
【公司起名】公众号取名,3514人,41人,¥100,圆满完成,mf186****2682,起公众号的名字，文章内容大多就是妈妈在生活中与孩子成长中的感触。   要容易记起,2015.12.24,2016.02.13,任务编号：398422,￥ 100,,人本美名,,,,,,,,,,,,,,,,,,,,,,,
【公司起名】造价咨询公司起名,6990人,84人,¥300,圆满完成,st868****9,"要求：造价咨询招标代理公司1.公司取名两字，以江苏*******公司命名，名字要大气不俗，简洁，要求通过工商局注册（需要提供注册查询切图）2.说明创意知识产权说明：1、所设计的作品必须为原创，未在国家商标局注册过（中国商标网查询地址http://sbcx.saic.gov.cn/trade/，不侵犯他人著作权，如有侵犯他人著作权的由设计者承担所有法律责任。2、中标的设计作品，我方支付设计制作费，即拥有该作品的知识产权，包括著作权,商业用途，使用权和发布权等,有权对设计作品进行修改,组合和应用;设计者不得再向其他任何地方使用该设计作品。",2015.12.23,2016.01.17,任务编号：398263,￥ 300,,xdfswyyg,,,,,,,,,,,,,,,,,,,,,,,
【品牌起名】急需钻石品牌名字,4256人,106人,¥200,圆满完成,Diamond丶昊,具体要求：我公司现在运营一个新项目，主要是以钻石定制为主，钻戒、吊坠、手镯等饰品。现在要注册一个品牌，主打对象为年轻人。要求：1.中文名称为英文名称的音译，具有唯美，时尚，洋气的意境。2.中文名2-3个字，对应英文名发音相近，最好不要超过6个字母3.所取的名字需要是没有注册过的商标品牌。是否已经注册，请在http://www.chatm.com查询，商品分类选第14项，珠宝钟表。4.一旦成交，我公司对给名称具有所有权，可以任意使用、发布和修改。,2015.12.22,2016.08.18,任务编号：398119,￥ 200,,白刺猬工作室,,,,,,,,,,,,,,,,,,,,,,,
【品牌起名】商标取名／品牌起名,4394人,63人,¥100,圆满完成,创客微微,公司专业全屋家具定制，酒店家具定做。别墅，样板房家具生产定制。韩式简约风格家具，类似尚品宅配一样都性质，现在需求给商标取给名字，要时尚新颖，易记，通俗，易懂。产品风格为板式家具。公司名称：深圳市铭惠家居有限公司。要求：商标名要通过商标注册，商标名要在设计logo上容易设计出来，形体美。,2015.12.22,2016.02.05,任务编号：398103,￥ 100,,艾豆笔尖,,,,,,,,,,,,,,,,,,,,,,,
【广告策划】“嗨馆量贩KTV”开业广告语征集,6152人,124人,¥200,圆满完成,K888,老店新开求广告语以前是（万达大歌星量贩KTV）现在改名（嗨馆量贩KTV)求开业广告语要求：简洁大方,2015.12.20,2016.01.14,任务编号：397744,￥ 200,,新疆合赢智创信息科技服务有限公司,,,,,,,,,,,,,,,,,,,,,,,
【品牌起名】送餐网站/APP起名！（要英文的）,7570人,121人,¥500,圆满完成,感动心常在,1. 起名英文名优先于中文名 ，可以只提供英文名一种（因为本团在美国）2. 如果网络允许的情况下，请到北美云服务商networksolution（http://www.networksolutions.com/domain-name-registration/index.jsp）查询此名/域名有没有被占用3. 名字要有朝气，能让年轻人记住，顺口4. 希望投标的朋友集思广益，可以围绕主题起名，也可天马行空式取名，最终目标仅从第3条5. 提供中英两种语言名字的，有创意的，悬赏后会给予额外的奖金谢谢大家,2015.12.20,2016.07.04,任务编号：397699,￥ 500,,花野君的画铺15800372188,,,,,,,,,,,,,,,,,,,,,,,
【店铺/网店起名】奶茶店起名（急！！！）,5243人,91人,¥150,圆满完成,找设计人才,"公司产品：主打奶茶，配以果茶和咖啡。1，奶茶店取名，必须为原创名字，含皇家的意义，可以用“皇”“御”等字2，品牌名字两个或者三个字为主，需要中英文两种名称，可以注册商标。（需要提供注册查询切图）3.说明创意知识产权说明：1、所设计的作品必须为原创，未在国家商标局注册过（中国商标网查询地址687474703a2f2f736263782e736169632e676f762e636e2f74726164652f，不侵犯他人著作权，如有侵犯他人著作权的由设计者承担所有法律责任。2、中标的设计作品，我方支付设计制作费，即拥有该作品的知识产权，包括著作权,商业用途，使用权和发布权等,有权对设计作品进行修改,组合和应用;设计者不得再向其他任何地方使用该设计作品。",2015.12.19,2016.07.04,任务编号：397605,￥ 150,,人本美名,,,,,,,,,,,,,,,,,,,,,,,
【公司起名】餐饮管理公司起名,5554人,75人,¥100,圆满完成,mf158****9990,新开餐饮管理有限公司起名，要求简单大方，寓意好，能注册，中英文,2015.12.19,2016.01.04,任务编号：397639,￥ 100,,星奎影像记录工作室,,,,,,,,,,,,,,,,,,,,,,,
【品牌起名】为土特产品品牌起名,3440人,61人,¥100,圆满完成,张鑫xhc,1、我公司现为新宏昌重工集团，主营专用车的生产、销售与服务，官网为www.hctm.com.cn。现阶段，因公司发展需要，增加销售全国各地知名土特产品业务，现征求该业务品牌的名称。2、本品牌名称字数不超过4个字。3、本名称可进行文字商标注册。4、投标者须在投标时将本名称的寓意予以解释。,2015.12.18,2016.01.18,任务编号：397410,￥ 100,,白刺猬工作室,,,,,,,,,,,,,,,,,,,,,,,
【品牌起名】瓜子商标起名，要求原创能注册商标,5234人,63人,¥200,圆满完成,o5672af8422b68,一、中文取名要求1、瓜子生产企业在新疆，此次品牌取名定位于瓜子炒货行业。2、中文取名要求文字易辨认，不能有生僻字，取名字数请保持在2—3个字。3、品牌中文名称要朗朗上口，易于记忆和传播。4、亲切且突出主题，突出品牌元素、让人感觉舒服，醒目易识易记，要   求有创意。5、不要模仿、应回避市场上雷同的产品中英文和读音，要有自己的特色。6、请一定要确保取的名字在商标29类31类下可以注册。7、取名后，要附带若干字的创意说明，否则直接淘汰。8、取的名字需要有品牌起源的故事情节。解释品牌含义，请附上朗朗上口的广告语。9、要求必须可以注册文字类商标，读音、换序、加减字、部分相同 均为无效，凡是无法    实现商标注册要求（重名或冲突的）无论投稿创意多么优秀，一律弃选。10、要求必须是原创，不得是电脑取名。请设计者到中国商标网，商标近似查询栏目自    行查询一下是否有相同或相近注册。谢谢！  二、知识产权说明：1、作品必须要求是原创，为第一次发布，为侵犯他人的著作权。如有侵犯他人著作权，由  设  计师承担所有法律责任。2、中标的作品，我方支付费用。即拥有该作品的知识产权，包括著作权、使用权和发布权      等，并有权对作品进行修改、组合和应用，不得再向其他任何地方使用该作品。3、因为取得名字要进行商标注册，所以要求一切投稿隐藏保密。 三、注意事项：1、请各位参与取名的威客用点心思，仔细的看一下我上面写的要求在进行设计，由于任务   发布以后会有很多的人投稿，本人选稿的方式按照发布的要求为准则，请投稿者严格按   照上面的所写要求投稿，只有符合要求的才会提出修改意见，不符要求的稿件就不要投   稿了。2、交易流程严格按照网站规定的交易流程付款，拒绝在没完成任务之前提前选稿付款。3、提交前请先在商标注册网认证查询是否被注册，请勿提供与被注册商标相同的名称，中   标的名字须通过商标局注册，方视为有效，,2015.12.17,2016.01.11,任务编号：397377,￥ 200,,xdfswyyg,,,,,,,,,,,,,,,,,,,,,,,
【公司起名】教育机构起名（一对一课外辅导）,5456人,61人,¥100,圆满完成,o5672****2dbd9,"经营介绍： 本公司是一家以小学、初中、高中的个性化一对一课外辅导补习为主的教育机构，目标客户群为小初高中学生。应用内容：设计公司名称。设计要求：1、名称有格局，大气，积极向上，2-3个字（最好有中英文两种名称）；2、符合我公司的网络和教育的定位;3、附上创意说明知识；4、可以注册公司和商标；知识产权说明：1、所设计的作品为原创，为第一次发布，未侵犯他人的著作权，如有侵犯他人著作权，由设计者承担所有法律责任;2、中标的设计作品，我方支付设计制作费，即拥有该作品的知识产权，包括著作权,使用权和发布权等,有权对设计作品进行修改,组合和应用;设计者不得再向其他任何地方使用该设计作品。",2015.12.17,2016.01.18,任务编号：397342,￥ 100,,竹叶常青设计工作室,,,,,,,,,,,,,,,,,,,,,,,
【店铺/网店起名】便利店起名,5912人,97人,¥200,圆满完成,mf138****1906,"要求：                                    1、名称响亮，易记，文雅，有创意但不失稳重;(必需可以注册）                                        2、最好是两三个字，类似全家或者711                                         3、附上创意说明                                        知识产权说明：                                            1、所设计的作品为原创，为第一次发布，未侵犯他人的著作权，如有侵犯他人著作权，由设计者承担所有法律责任;                                        2、中标的设计作品，我方支付设计制作费，即拥有该作品的知识产权，包括著作权,使用权和发布权等,有权对设计作品进行修改,组合和应用;设计者不得再向其他任何地方使用该设计作品;",2015.12.17,2016.02.12,任务编号：397248,￥ 200,,五艺之星,,,,,,,,,,,,,,,,,,,,,,,
【品牌起名】接地气的商品名称征集,5309人,105人,¥500,圆满完成,Mr186****5530,寻找可注册接地气的商品名称1，必须是可以进行注册的商品名称。2，简单易懂，易于传播，推广，接地气的商品名称。 例如：土豆网，途牛旅游，赶集，芒果台，小米手机等。3， 新起跑公司是一家充满互联网基因的新型广告公司，致力于通过互联网的方式消除传统广告产业链中的信息不对称。     公司的理念是用互联网方式打造独一无二的广告主社群。,2015.12.17,2016.01.04,任务编号：397293,￥ 500,,竹叶常青设计工作室,,,,,,,,,,,,,,,,,,,,,,,
【其他】纪念日创意短语征集,4751人,49人,¥100,圆满完成,艾肯美道,需要四个字，六个字，或八个字的短语，一对情侣，男方名字里用“波”或者“磊”字，女方名字用“慧”，或者谐音主要用途：恋爱纪念日，结婚纪念日，个性logo要求：温馨，浪漫，个性，易记,2015.12.17,2016.01.18,任务编号：397266,￥ 100,,大鱼大肉的生活,,,,,,,,,,,,,,,,,,,,,,,
【公司起名】公司取名任务 诚邀能者取名,3669人,46人,¥128,圆满完成,mf139****0325,"详情请查看附件.投稿的时候,请传文档格式.有好名字,可提前截止任务.",2015.12.16,2016.02.02,任务编号：397193,￥ 128,,搞名堂123,,,,,,,,,,,,,,,,,,,,,,,
【品牌起名】休闲零食烤鱿鱼条品牌取名,4099人,69人,¥100,圆满完成,mf158****6560,名称要求：形象好记，比较中意3个字产品特点：来自深海的进口鱿鱼，鱿鱼肥且大条，有嚼劲公司名称：绿林豪客食品,2015.12.16,2017.11.27,任务编号：397178,￥ 100,,mf18780086114,,,,,,,,,,,,,,,,,,,,,,,
【品牌起名】【商标起名】适用于高新技术数码产品,8500人,127人,¥360,圆满完成,damaixiaomai,【商标起名】：2个字最佳，3个字也ok，商标注册在0907分类（中文和英文都必须在这个分类可注册）【适用产品】起名适用于产品：数字高清图像传输设备，高清设备接口，无线传输产品。【起名思路一】：体现数字，高清，现代高科技，跨越时空飞速传输【起名思路二】：另类，科学，高科技产品【起名思路三】：名字听过去有点像是进口产品或者中外合资产品温馨提示：商标注册需要在0907分类可注册哦，（中文和英文都必须在这个分类可注册）,2015.12.16,2016.03.07,任务编号：397111,￥ 360,,五艺之星,,,,,,,,,,,,,,,,,,,,,,,
,,,,,,,,,,,,,,,,,,,,,,,,,,,,,,,,,,,
【公司起名】征集公司名称,7093人,142人,¥200,圆满完成,十倍速,公司是做母婴类的线上社群、线下社区的网络科技公司，现征集公司名称。要求：1、有互联网元素2、容易记忆和传播3、2-4个字都可,2015.12.16,2016.01.09,任务编号：397067,￥ 200,,锐视企划,工作室,一品,55分,,,【LOGO设计】 郑重承诺/保证设计至您最终满意为止！,价格面议,【VI设计】 郑重承诺/保证设计至您最终满意为止！,价格面议,【画册/宣传册设计】 郑重承诺/保证设计至您最终满意为止！,价格面议,【包装设计】 郑重承诺/保证设计至您最终满意为止！,价格面议,【折页设计】 郑重承诺/保证设计至您最终满意为止！,价格面议,【宣传单设计】 郑重承诺/保证设计至您最终满意为止！,价格面议,【海报设计】 郑重承诺/保证设计至您最终满意为止！,价格面议,,,,
【品牌起名】塑性内衣名字征集,3196人,72人,¥300,圆满完成,mf132****0555,需要起一个高端私人量身定制的塑形内衣的名字，这个内衣都是女性使用，作用是塑形1、需要注册商标使用2、中文加英文，二个字到四个字都可以3、要高端大气，顺口,2015.12.15,2016.01.22,任务编号：396928,￥ 300,,xdfswyyg,,,,,,,,,,,,,,,,,,,,,,,
【品牌起名】快销食品取名,5622人,141人,¥200,圆满完成,成都前沿单车,主要销售 外送食品 兔丁 干牛肉 猪耳朵 鸡脚 鸡翅 卤菜类 取名的目的是 易记 易传播 做品牌 做口碑,2015.12.15,2016.01.22,任务编号：396888,￥ 200,,航嘉山庄,工作室,七品,39分,,,,,,,,,,,,,,,,,,,,
【宣传策划】古筝教育营销品牌故事撰写,4197人,19人,¥450,圆满完成,o5495****9b40e,"*可以借鉴：http://www.hsgz.net/hongshenggushi/（个人非常欣赏此网站宏声古筝的故事原创）*盛荷古筝（商标已注册），专注于高端古筝培训、及品牌古筝营销。中国音乐家协会会员单位，中国古筝网教学基地，河南首家双谱古筝教学基地。2014年1月起，由40平的小教室发展到现今初具规模的200平自营教学及展示区，现有一支优秀的教师队伍，及比较可观的生源，未来会发展多家分店，急需设计一个品牌故事用作宣传。（网站、单页、画册等）优势：1、师资：均为古筝专业本科毕业全职教师任教；2、教学：采用直接教学法、多媒体互动教学法、趣味启蒙教学法、沟通式教学法。3、理念：双谱（简谱、线谱）古筝教学，郑州第一家。4、环境：新古典禅意风格装修，一对一VIP教室N间，多媒体大教室，休息区，展示区，洽谈室，双温中央空调，及全新新风系统（过滤PM2.5）。5、网站：http://www.wpygz.com（新制作，内容还未丰满，可作参考）知识产权说明：1、所设计的作品为原创，为第一次发布，未侵犯他人的著作权，如有侵犯他人著作权，由设计者承担所有法律责任;2、中标的设计作品，我方支付设计制作费，即拥有该作品的知识产权，包括著作权,使用权和发布权等,有权对设计作品进行修改,组合和应用;设计者不得再向其他任何地方使用该设计作品;",2015.12.13,2016.01.21,任务编号：396605,￥ 450,,墨客文案工作室,,,,,,,,,,,,,,,,,,,,,,,
【文学创作】编一个银行场景的小品剧本,7714人,10人,¥200,圆满完成,mf135****3766,1、人物：2-3个人物，个性鲜明2、以银行员工的一天为主线3、人物对话、场景写清楚4、台词尽可能幽默搞笑，结局希望是积极的结局5、时长10—12分钟左右；6、附上创意说明。希望能直接交稿。,2015.12.13,2016.01.05,任务编号：396553,￥ 200,,新疆合赢智创信息科技服务有限公司,,,,,,,,,,,,,,,,,,,,,,,
【品牌起名】化妆品品牌取名,4210人,92人,¥100,圆满完成,M1331****686,产品特点：老祖宗传下来的验方，天然合成，提纵、紧致、美白功效特好，适合开发国内和国际市场,2015.12.12,2016.01.21,任务编号：396499,￥ 100,,mf15152332183,,,,,,,,,,,,,,,,,,,,,,,
【品牌起名】网站平台名称征集,7084人,144人,¥200,圆满完成,铭征集,主题：以0元、团购为主，免费，征集一个网名，附带一句震撼购买的广告语要求：要求平台名称有0元任意选的意思，震撼力高，吸引眼球，好记，顺口，微信公众号未被使用，平台主要做进出口商品，名字要求出现0元广告语要求霸气，让消费者看到免费，急着购买的欲望，免费捡好货参考网名：0元购0元天天够，免费零元购，0元正品汇，0元商场，0元海购,2015.12.12,2016.01.24,任务编号：396493,￥ 200,,花野君的画铺15800372188,,,,,,,,,,,,,,,,,,,,,,,
【公司起名】“上海xx生物科技有限公司”起名,5830人,102人,¥200,圆满完成,waywayne,上海xx生物科技有限公司公司主要从事生物技术和检测方面的研发，生产，销售，技术服务等名字要求如下：1、2～4个汉字组成2、最好有英文名称对照3、名字的含义解释4、工商注册核名能通过的,2015.12.12,2016.01.31,任务编号：396437,￥ 200,,攸木灵,,,,,,,,,,,,,,,,,,,,,,,
【公司起名】服装公司起名,4262人,64人,¥100,圆满完成,wswna,"服装公司名称征集，本公司位于苏州。                            经营介绍： 主营婚纱，礼服。，， 服装特色：时尚，大方。 主要通过网络销售，销售目的地为欧美主要国家，页需要在国内销售的，注重英文的流行性和中文的可记忆性。                           产品主要三类：                                            1、主要是女装，婚纱，伴娘服，舞会礼服，派对礼服，妈妈装，消费人群以18-35岁女性为主                                                  要求：                                            1、名称响亮，易记，文雅，有创意但不失稳重;(必需可以注册公司的)                                        2、一定要有中、英文两种名称，并可注册商标                                        3、附上创意说明。                                        知识产权说明：                                            1、所设计的作品为原创，为第一次发布，未侵犯他人的著作权，如有侵犯他人著作权，由设计者承担所有法律责任;                                        2、中标的设计作品，我方支付设计制作费，即拥有该作品的知识产权，包括著作权,使用权和发布权等,有权对设计作品进行修改,组合和应用;设计者不得再向其他任何地方使用该设计作品;",2015.12.12,2016.01.24,任务编号：396436,￥ 100,,mf13348868459,,,,,,,,,,,,,,,,,,,,,,,
【店铺/网店起名】高端卖场取店名,4849人,86人,¥100,圆满完成,mf159****0590,我们是在写字间里面的一家高端卖场主要是卖奢侈品 珠宝 古玩 高端家具等等也帮助客人寻找想要的东西平时是类似会所形式  客人不买东西 也经常来喝茶聊天名字2-4个字 要中英文的 并且要有释义老板属木  最好名字里面带水或者土  偏旁带也算名字要高端大气有寓意 好记,2015.12.10,2016.01.15,任务编号：396211,￥ 100,,陈家商铺,,,,,,,,,,,,,,,,,,,,,,,
【公司起名】上海公司取名,4921人,42人,¥100,圆满完成,黑豆先生,"1、公司主要产品是酒店洗漱用品，旅行套装，清洁用品2,  公司名需要提供中文和英文（附件图片为参考）3、名字无限制，但念起来要顺，需要大气，好记，能体现行业特点，同时具有国际化的风格，容易给消费者留下深刻的印象。4、名字可以注册公司，交稿前可先去查询一下是否被注册，最好看一下能否注册商标。5、需附上创意说明和广告语6、作品必须要求是原创，为第一次发布，无侵犯他人的著作权。如有侵犯他人著作权，由设计师承担所有法律责任。7、中标的作品，我方支付费用。即拥有该作品的知识产权，包括著作权、使用权和发布权等，并有权对作品进行修改、组合和应用，设计师不得再向其他任何地方使用该作品。8、因为取得名字要进行商标注册，所以要求一切投稿隐藏保密。",2015.12.10,2015.12.30,任务编号：396141,￥ 100,,五艺之星,,,,,,,,,,,,,,,,,,,,,,,
【公司起名】贸易公司取名,4353人,78人,¥150,圆满完成,开水是凉的,"1、要求中文和英文2、喻意好、大器、响亮3、无生僻字4、英文要求字母少, 中文名两个字最好注意: 公司名需要没被注册过.背景：公司做进出口贸易，玩具和工艺品",2015.12.09,2015.12.28,任务编号：396011,￥ 150,,五艺之星,,,,,,,,,,,,,,,,,,,,,,,
【公司起名】教育培训机构取名,4773人,72人,¥100,圆满完成,风铃1016,"教育培训机构位于美丽的江城武汉，经营范围为文化教育培训及各类艺术培训。日后将会参与公益及慈善相关的活动，请在取名时考虑到这一方面信息。一、取名要求：1、名称响亮，易记，文雅，与教育培训行业及公益相关，易于传播；2、最好有中、英文两种名称，并可注册商标；3、附上创意说明。二、知识产权说明：1、所设计的作品为原创，为第一次发布，未侵犯他人的著作权，如有侵犯他人著作权，由设计者承担所有法律责任;2、中标的设计作品，我方支付设计制作费，即拥有该作品的知识产权，包括著作权,使用权和发布权等,有权对设计作品进行修改,组合和应用;设计者不得再向其他任何地方使用该设计作品;",2015.12.09,2016.01.03,任务编号：395875,￥ 100,,墨客文案工作室,,,,,,,,,,,,,,,,,,,,,,,
