标题,查看数,参与数,需求价格,状态,需求方,需求文本,发布时间,完成时间,任务编号,交易价格,参与交稿,设计师,设计师类型,设计师等级,设计师信用,交易总次数,交易总金额,服务1,价格1,服务2,价格2,服务3,价格3,服务4,价格4,服务5,价格5,服务6,价格6,服务7,价格7,服务8,价格8,服务9,价格9
【品牌起名】陕西小吃命名,3313人,93人,¥100,圆满完成,Mr186****2165,我们主营陕西小吃，属于餐饮行业，比如凉皮，肉夹馍，羊肉泡馍，biangbiang面，油泼面，炒面、拉条子等，将来的模式是加盟连锁，除了到店消费，也外卖，目前有一家店。要求：1.名称新颖，能和大街上常规的命名区分开，比如，陕西小吃，军哥泡馍；2.有一些传统气息，毕竟陕西小吃历史悠久，源远流长，名称看上去有一定底蕴，像个有历史，有个性、有时间沉淀的店铺；3.照顾年轻消费群体的心理需求。4.能够在相关类目注册商标。,2016.04.23,2016.06.06,任务编号：417577,￥ 100,,byt_lei,,,,,,,,,,,,,,,,,,,,,,,
【品牌起名】糖尿病专业康复机构取名和广告语征集,2773人,48人,¥200,圆满完成,Mr137****6708,糖尿病这一世界性难题，在我公司（四川中航农业科技公司和成都万物升科技有限责任公司）专家团队的努力下，通过食物疗法，1-3个月修复胰岛细胞，彻底戒掉降糖药和胰岛素，是亿万糖尿病患者的福音！我们可跟患者签约治疗，没有达到签约效果，全额退款！要求：形象，容易记住，简单，便于推广，名字最好能够注册,2016.04.22,2016.07.02,任务编号：417374,￥ 200,,五艺之星,,,,,,,,,,,,,,,,,,,,,,,
【品牌起名】厦门艾米贝贝科贸有限公司品牌起名,3077人,56人,¥100,圆满完成,mf181****8667,公司主要经营母婴用品，为公司纸尿裤取一个品牌名，名字有吸引力能够让宝宝，宝妈有深刻印象，有长远的品牌影响，有创意国际范,2016.04.22,2016.05.09,任务编号：417522,￥ 100,,竹叶常青设计工作室,,,,,,,,,,,,,,,,,,,,,,,
【品牌起名】APP取名征集,3657人,75人,¥100,圆满完成,mf186****8878,您的任务是为一款社交类微信服务号取名（三个月后开发成app），目前面对的客群是同姓氏的宗亲会。一期上线的功能是，互助众筹及活动发起。二期开发成app，客群目标是百姓，当然宏大的未来目标用户群是全人类。命名规则必须符合是还未被注册的.com域名全拼，以及国家商标第9类未被注册过的。,2016.04.21,2016.05.24,任务编号：417352,￥ 100,,五艺之星,,,,,,,,,,,,,,,,,,,,,,,
【品牌起名】水果品牌名称征集（在内蒙古）,3749人,86人,¥100,圆满完成,伟爷吉祥,"起一个水果品牌名称，公司在内蒙古。要求：1、名称响亮，易记，文雅，有创意但不失稳重;2、最好名字最多2-3个字之内，并可注册商标3、附上创意说明。知识产权说明：1、所设计的作品为原创，为第一次发布，未侵犯他人的著作权，如有侵犯他人著作权，由设计者承担所有法律责任;2、中标的设计作品，我方支付设计制作费，即拥有该作品的知识产权，包括著作权,使用权和发布权等,有权对设计作品进行修改,组合和应用;设计者不得再向其他任何地方使用该设计作品;",2016.04.21,2016.06.07,任务编号：417322,￥ 100,,锲卡设计,,,,,,,,,,,,,,,,,,,,,,,
【品牌起名】男装品牌名称征集,3002人,73人,¥300,圆满完成,nanzhuang,"本品牌主要是做男装，男装风格类似于：GXG 和太平鸟男装，主要做的是中端市场设计要求：1、大气、简洁、明快;2、有视觉冲击力，醒目易识别，突出服装品牌元素;3、名字可以是英文和中文，若是英文的话一定要有一个中文的名字4、附上创意说明，名字要能注册商标知识产权说明：1、所设计的作品为原创，为第一次发布，未侵犯他人的著作权，如有侵犯他人著作权，由设计者承担所有法律责任;2、中标的设计作品，我方支付设计制作费，即拥有该作品的知识产权，包括著作权,使用权和发布权等,有权对设计作品进行修改,组合和应用;设计者不得再向其他任何地方使用该设计作品;",2016.04.20,2016.05.27,任务编号：417044,￥ 300,,张佩浅,,,,,,,,,,,,,,,,,,,,,,,
【宣传策划】访谈国际金融理财策划师的新闻软文撰写,1758人,3人,¥100,圆满完成,海琳娜金融理财,"软文主要围绕“国际金融理财策划师”来写，要以采访一位生在武汉通过多年努力拿到国际金融理财策划师PASS和香港永久居民的青年女性励志故事，谈论她为什么要赖在香港发展，话题中从生活、工作方面，引出她所从事的香港保险的优势及已经投身的帮助高端客户进行海外资产配置的事业。考虑到很多威客对香港保险和海外资产配置不熟悉，需要详细了解则大家务必和我直接联系，我的QQ是575172656，邮箱是575172656@71712e636f6d 软文要求： 1、软文将用于发布在腾讯大楚网、新浪网、搜狐网等大网在当地的新闻类栏目，标题和内容绝对不能有广告味，要能引起点击和共鸣，能吸引网友参与讨论。 2、文章要有吸引力，有趣味性， 要站在高资产客户的角度来描写，帖子内容与标题给人感觉以成功人士追求自我价值实现、经验分享或消费指导为表现形式,以宣传推广我司业务（香港保险及海外资产配置）。 3、要求原创(不能在网上搜了抄袭)，文笔或专业，或幽默，或结合时事，具备新闻性皆可。不要做的太像推广。 4、附上创意说明。 知识产权说明： 1、所设计的作品为原创，为第一次发布，未侵犯他人的著作权，如有侵犯他人著作权，由设计者承",2016.04.20,2016.05.13,任务编号：417141,￥ 100,,威威小妖,,,,,,,,,,,,,,,,,,,,,,,
【店铺/网店起名】餐饮店铺起名,4170人,113人,¥100,圆满完成,a1471****8,我店坐落于重庆，经营餐饮娱乐一条龙、面积10000平米，需起一个大气的名字。要求原创。,2016.04.20,2017.01.17,任务编号：417065,￥ 100,,梦玑文字创意馆,工作室,七品,39分,,,品牌故事创作,价格面议,店铺名称设计,价格面议,宝宝名字设计,价格面议,广告语创作,价格面议,品牌名称设计,价格面议,,,,,,,,
【店铺/网店起名】高端女子会所取名,4554人,83人,¥100,圆满完成,mf181****9922,要求：清雅脱俗，高端大气上档次。(两个茶吧包房附带取名),2016.04.20,2016.08.06,任务编号：417067,￥ 100,,锲卡设计,,,,,,,,,,,,,,,,,,,,,,,
【品牌起名】激光投影仪品牌命名,3816人,65人,¥500,圆满完成,fjq15****0,1.名称可从多个角度命名，希望结合公司行业背景（核电和船舶)、企业文化、字音谐音方面多考虑，同时体现产品特色。2.品牌名称联想度高，朗朗上口，尽量避免生僻字。3.命名方案需可以注册，商标注册类别为：9，28，41，42四个大类别。,2016.04.20,2016.05.04,任务编号：417057,￥ 500,,楚韵意品品牌设计,企业,七品,40分,,,原创LOGO设计,价格面议,高端原创自适应企业网站开发,价格面议,企业VI设计,价格面议,活动宣传单设计,价格面议,画册设计,价格面议,名片设计,价格面议,,,,,,
【广告策划】海涛教育宣传语征集,3672人,64人,¥200,圆满完成,mf139****0723,海涛教育：常年招生初、高中各年级精品小班、冲刺班、全托班； 1对1VIP全方位、个性化教学。“一对一”模式:为学生量身定做个性化辅导方案，全方位、策略性辅导，改善不良学习习惯，稳固提升学科知识，树立自信，完善人格。精品小班：查缺补漏，定向突破，激发兴趣，开发潜能，确保快速提分！要求：1.宣传语要有鲜明的时代气息，寓意深刻。2、要朗朗上口，简单流畅，易懂易记。每条不超过10个字，3-5条。3、适合做媒体宣传，能很好的在家长和学生中传播开来。任务比较着急。这两天就要，麻烦大家尽快提交稿件，非常感谢！,2016.04.19,2016.06.13,任务编号：416934,￥ 200,,小青欣,,,,,,,,,,,,,,,,,,,,,,,
【宝宝起名】杨姓女宝宝改名,8780人,202人,¥100,圆满完成,o53ee15f655867,"杨姓宝宝,性别女,出生年月2014年2月2号21:00,出生地北京,原名杨子涵,重名太多,所以重新起名.软文要求：1、单字双字都可以.2、重名率低.3、好记好写,不要类似曦这种难写的字.4、名字里不要涵,萱,琪同音的,重名的太多了.5、附上起名说明。谢谢.",2016.04.20,2016.06.07,任务编号：417036,￥ 100,,星橙设计QQ1356183009,,,,,,,,,,,,,,,,,,,,,,,
【广告策划】自行车销售广告语征集,4683人,82人,¥300,圆满完成,成都前沿单车,本公司从事自行车销售 （品牌有GNUU 攻路、KACIO 喀索）需要一个广告词 也就是口号哈，要求：易记，顺口，简洁,2016.04.20,2016.06.07,任务编号：416982,￥ 300,,高阁雅依创意工作室,,,,,,,,,,,,,,,,,,,,,,,
【产品卖点】论坛推广鞋子软文征集,4668人,16人,¥100,圆满完成,vivien2016yy,产品如下：椰子鞋运动鞋，价格60上下要求软广告，能让人出生兴趣，通过搜索店铺名进来浏览，突出物美价廉，性价比高，买了不后悔,2016.04.20,2016.05.17,任务编号：416948,￥ 100,,语道工作室,,,,,,,,,,,,,,,,,,,,,,,
【品牌起名】足浴粉的品牌商标起名（可以注册R标的）,3150人,116人,¥288,圆满完成,o5715****9f187,商标起名需求：足浴粉、泡脚药的品牌。产品特点：广西省巴马瑶族自治县原产地的，采用巴马瑶族的瑶药材制作而成，该产品原材料均采自广西和贵州地区的大瑶山纯天然瑶草、原生态的瑶药材，配方按照瑶医瑶药配制而成。瑶族洗浴的习惯造就了瑶族是很少得风湿病、妇科病、皮肤病的民族。相关信息：广西巴马是世界长寿之乡，有很多百岁老人，这个被多家电视媒体报道过，瑶族洗浴、瑶医瑶药材也被央视等媒体报道过。商标名需突出产品特点，要可以注册的。同类产品有巴马汤。,2016.04.19,2016.07.21,任务编号：416806,￥ 288,,派思马品牌创意机构,企业,七品,40分,,,背景墙设计,价格面议,PPT设计,30,台历设计,110,宣传册页,150,广告语编辑,"￥80
            /件",H5页面设计,200,画册设计,150,VI设计,￥3000,原创LOGO/高端LOGO/商业LOGO/满意为止,1000
【品牌起名】亲子游品牌的名字征集,5510人,84人,¥380,圆满完成,xiaozhufeifei1,1、为亲子游品牌取名字，名字要健康向上，郎朗上口，有童趣，有寓意。2、适合设计卡通logo，可以是与动物、植物或人物相关。如已有的三只熊亲子，小脚丫走天下等。2、不能重名，要可注册。,2016.04.18,2016.05.27,任务编号：416585,￥ 380,,星橙设计QQ1356183009,,,,,,,,,,,,,,,,,,,,,,,
【公司起名】婴儿用品公司商标名,3258人,56人,¥100,圆满完成,o5712****e5af5,"以生产婴儿背带为主 附带一系列婴儿用品
征集一个好听  上口  的中文 英文商标名",2016.04.16,2016.05.16,任务编号：416382,￥ 100,,悟本设计,企业,三品,70分,,,电商vi设计,"￥11000
            /件",画册设计,300,推广设计,价格面议,文案设计,价格面议,品牌策划,"￥8000
            /件",包装设计,"￥3000
            /件",,,,,,
【品牌起名】泳装产品取品牌名称（中英文结合）,2998人,34人,¥100,圆满完成,hsq2012,泳装零售企业需要取个名字注册，作为销售用的品牌名称。泳衣多以比基尼为主，偏女性泳装为侧重点，档次为中高档女性泳装，有3种风格（运动风格、年轻少女风格、成年人sexy风格），根据不同风格各取一个名称。需要同时有中文和英文名称，需要有名称的含义注释，且没有被其他公司商标注册过的。提交前麻烦先在商标注册网查询下，谢谢。,2016.04.16,2016.07.01,任务编号：416374,￥ 100,,派思马品牌创意机构,企业,七品,40分,,,背景墙设计,价格面议,PPT设计,30,台历设计,110,宣传册页,150,广告语编辑,"￥80
            /件",H5页面设计,200,画册设计,150,VI设计,￥3000,原创LOGO/高端LOGO/商业LOGO/满意为止,1000
【品牌起名】湖州童装品牌起名（必须可以注册R标的）,2747人,57人,¥188,圆满完成,蓝冰如梦,童装公司品牌征集，本公司位于湖州。经营介绍： 主营童装的设计和销售。要求：1、服装品牌取一个中文名字还可以英文缩写的名字。注（必须可以注册商标的 R标）  2、 名字要时尚，大气，简约，有内涵，易记忆，可爱一点，不失童真，朗朗上口，易于传播。（不能注册的就不要发了）3、 有视觉冲击力，醒目易识别，突出品牌元素 。4 、最好能帮忙设计LOGO，当然没有也可以，可以说出对这个LOGO的建议也行！【品牌定位】1、品牌产品：韩版童装2、目标定位年龄3---16岁，可爱时尚的儿童。【注意事项】1、还请大家创意作品后，在中国商标网上，查询未被注册后再发上来吧。好多名字都被注册了。2、衷心的感谢每一位用心参与的设计师，非常感谢大家。3、若无法通过注册，中标威客务必配合我公司进行修改 。所设计的作品为原创，为第一次发布，未侵犯他人的著作权，如有侵犯他人著作权，由设计者承担所有法律责任童装公司品牌征集，本公司位于湖州。【知识产权说明】1、所设计的作品为原创，为第一次发布，未侵犯他人的著作权，如有侵犯他人著作权，由设计者承担所有法律责任； 2、设计作品，我方支付设计制作费，即拥有该作品的知识产权，包括著作权，使用权和发布权等，有权对设计作品进行修改，组合和应用，设计者不得再向其他任何地方使用该设计作品。,2016.04.16,2016.05.15,任务编号：416342,￥ 188,,星橙设计QQ1356183009,,,,,,,,,,,,,,,,,,,,,,,
【品牌起名】白酒名字征集,3517人,83人,¥100,圆满完成,mf131****6665,要求，与道教传统文化相关，带一点仙气，大气好听，四个字内。,2016.04.13,2016.05.26,任务编号：415651,￥ 100,,mf13918394726,,,,,,,,,,,,,,,,,,,,,,,
【公司起名】儿童摄影公司起名,8582人,180人,¥100,圆满完成,o54c39808adb15,"儿童摄影公司名称征集，本公司位于成都。                            经营介绍： 主要经营儿童摄影，新生儿出生照，满月照，百天照，周岁照，孕妈妈照，亲子照等。 拍色特色：采用定制式拍摄服务，根据客户的需求来策划主题和拍摄，定位中高端市场。            要求：                                            1、名称简洁，大气，有国际范儿（洋气），有创意但不失稳重;(必需可以注册公司的)                                        2、最好有中、英文两种名称，并可注册商标                                        3、附上创意说明。                                        知识产权说明：                                            1、所设计的作品为原创，为第一次发布，未侵犯他人的著作权，如有侵犯他人著作权，由设计者承担所有法律责任;                                        2、中标的设计作品，我方支付设计制作费，即拥有该作品的知识产权，包括著作权,使用权和发布权等,有权对设计作品进行修改,组合和应用;设计者不得再向其他任何地方使用该设计作品;",2016.04.15,2016.06.17,任务编号：416162,￥ 100,,优派印象品牌设计机构,工作室,七品,40分,,,杂志/画册设计,价格面议,单页/折页/海报设计,价格面议,标志/LOGO设计,价格面议,品牌创建/企业VIS,价格面议,,,,,,,,,,
【品牌起名】厨卫电器产品商标起名字征集,5347人,104人,¥200,圆满完成,QQ客栈,厨卫电器产品商标起名字：要求：1.带“金”字或者带“钅”偏旁部首            2.名字简单明了 （两字 三字都可以）            3.一看能让人联想到是厨卫电器方向的            4.名字将来运用的方向在：油烟机 燃气灶 热水器 净水器 烤箱 小家电 整体橱柜 衣柜等等方向,2016.04.15,2016.05.08,任务编号：416152,￥ 200,,星橙设计QQ1356183009,,,,,,,,,,,,,,,,,,,,,,,
【店铺/网店起名】旅行社品牌的名字征集,3872人,80人,¥300,圆满完成,o56f4f4782a86b,"旅行社品牌的名字征集名字征集要求：我们是用工匠精神打造旅行产品的1、能让客户感觉每一次旅行都能够留下美好记忆2、有视觉冲击力，醒目易识别，突出旅行社元素;3、名字字数没有限制，简单易记，要能注册商标4、附上创意说明。知识产权说明：1、所设计的作品为原创，为第一次发布，未侵犯他人的著作权，如有侵犯他人著作权，由设计者承担所有法律责任;2、中标的设计作品，我方支付设计制作费，即拥有该作品的知识产权，包括著作权,使用权和发布权等,有权对设计作品进行修改,组合和应用;设计者不得再向其他任何地方使用该设计作品;",2016.04.15,2016.05.02,任务编号：416138,￥ 300,,tomzhouwei,,,,,,,,,,,,,,,,,,,,,,,
【品牌起名】品牌名称征集,3819人,87人,¥360,圆满完成,eekoo,"主要做：户外烧烤、肉类销售；食物是纯天然，不是人工饲养名字征集要求：1、能体现绿色，健康2、有视觉冲击力，醒目易识别，突出品牌元素;3、名字字数没有限制，要好记，要能注册商标4、附上创意说明。知识产权说明：1、所设计的作品为原创，为第一次发布，未侵犯他人的著作权，如有侵犯他人著作权，由设计者承担所有法律责任;2、中标的设计作品，我方支付设计制作费，即拥有该作品的知识产权，包括著作权,使用权和发布权等,有权对设计作品进行修改,组合和应用;设计者不得再向其他任何地方使用该设计作品;",2016.04.15,2016.05.23,任务编号：416094,￥ 360,,小青欣,,,,,,,,,,,,,,,,,,,,,,,
【公司起名】急需信息技术公司起名字,2817人,43人,¥150,圆满完成,mf185****8953,公司经营范围:软件开发，销售及平面设计，系统集成，硬件耗材，办公设备租赁，销售，网络技术咨询服务，办公自动化产品销售等。。。。起名格式为:宁夏***信息技术有限责任公司。要求:百度搜索不到，能过工商，名字寓意好,2016.04.15,2016.04.22,任务编号：416080,￥ 150,,乐活创享,,,,,,,,,,,,,,,,,,,,,,,
【广告策划】阿胶糕包装上广告语,5271人,54人,¥100,圆满完成,gagadegagg,本公司最近推出新的阿胶糕产品，品牌为：千年的秘密。考虑到包装及营销方面，现征集一句广告语，要求如下：1、本产品主要网上销售，要求征集者回稿必须屏蔽其他游客看到，否则不纳入悬赏范围；2、广告语要求不在字面上突出产品功效、疗效类的如：美容、养颜、补血等类的字眼，但可出现：美丽、年轻、健康等等；3、因此广告语印刷在产品外包装上，广告语尽可能让人听、看一遍就记住，具有现代网络气息。,2016.04.14,2016.07.04,任务编号：416036,￥ 100,,语道工作室,,,,,,,,,,,,,,,,,,,,,,,
【店铺/网店起名】服装店铺的取名,4689人,102人,¥150,圆满完成,hxianxue,精品女装店起名3线城市，人群年龄20-45，服装类型有特色，时尚 大气，走品牌化路线，名字易记 有一看到或听到就能深入这类人群心里  好讲品牌故事，容易推广，门店装修简欧 复古，名字能洋气一点，能带'斯'字最好字数要求：1-4个字,2016.04.14,2016.05.03,任务编号：415909,￥ 150,,星橙设计QQ1356183009,,,,,,,,,,,,,,,,,,,,,,,
【品牌起名】儿童脑开发机构起名,2964人,57人,¥100,圆满完成,xiaosjy,"开发大脑，提高注意力记忆力，一目十行不再是梦，要求：名称简单，好记1、名称响亮，易记，文雅，有创意但不失稳重;(必需可以商标局注册的)2、最好有中、英文两种名称，并可注册商标3、附上创意说明。知识产权说明：1、所设计的作品为原创，为第一次发布，未侵犯他人的著作权，如有侵犯他人著作权，由设计者承担所有法律责任;2、中标的设计作品，我方支付设计制作费，即拥有该作品的知识产权，包括著作权,使用权和发布权等,有权对设计作品进行修改,组合和应用;设计者不得再向其他任何地方使用该设计作品;",2016.04.13,2016.07.18,任务编号：415827,￥ 100,,小青欣,,,,,,,,,,,,,,,,,,,,,,,
【品牌起名】白酒品牌起名,3672人,60人,¥100,圆满完成,OliviaXia,"要求：1.名称响亮、易记、高端、有内涵；2.名称出处：（1）著名文化典籍或历史典故（需备注好出处）；（2）或 本司位于江苏省无锡市，名称也可以与无锡或者江南有一定的关联；（3）或 自我创新，并附上创意说明；3. 强调”以酒会友”特质，易于传播和宣传，与广告语连贯，有延伸性4.赋予品牌一个品牌故事，可读性与拓展性强；5.需有中英文两种名称，并可全部注册，英文不一定要现成的单词，可自己自由组合字母；6.需在中国商标局网站查询并截图，中标作者需配合后期修改；   知识产权说明：1.所设计的作品为原创，为第一次发布，未侵犯他人的著作权，如有侵犯他人著作权，由设计者承担所有法律责任；2.中标的设计作品，我方支付设计制作费，即拥有该作品的知识产权，包括著作权,使用权和发布权等,有权对设计作品进行修改,组合和应用;设计者不得再向其他任何地方使用该设计作品。",2016.04.13,2016.06.24,任务编号：415777,￥ 100,,竹叶常青设计工作室,,,,,,,,,,,,,,,,,,,,,,,
【宝宝起名】属猴女宝宝起名字,5511人,102人,¥100,圆满完成,宋朝传媒,我家宝宝出生在（阳历）2016年4月8日20；11分，我姓宋，我媳妇姓陈，我和老婆都是学美术的，小孩的爷爷是国画家，，起名字要求显得有文化气息一点，，希望帮起名的朋友说出名字的来源和寓意。谢谢！,2016.04.13,2016.04.18,任务编号：415662,￥ 100,,宋朝传媒工作室,,,,,,,,,,,,,,,,,,,,,,,
,,,,,,,,,,,,,,,,,,,,,,,,,,,,,,,,,,,
【店铺/网店起名】帮忙想一个艺术培训班的名字,5952人,94人,¥110,圆满完成,XH136****8861,《                  》艺术培训班起名              本艺术中心是面向儿童成年人的，主打是钢琴、舞蹈、美术、乐器等成年人瑜伽格式：《名字》+词义解释                        要求：①简单、大气、最好有点国际感觉            ②也可以从《肖》和《慧》两字出发!      比如：肖邦艺术培训中心            ③不要出现那些偏向儿童培训的词眼！培训班是面向儿童和成年人的            错误比如：彗星艺术培训              要求一句概括：简单大气易上口、勿偏向儿童培训，中性化国际化！结合以上要求发挥你们天马行空的才艺,2016.04.11,2016.04.26,任务编号：415402,￥ 110,,東目设计,,,,,,,,,,,,,,,,,,,,,,,
【公司起名】公司起名,3288人,79人,¥100,圆满完成,叶子一片,股票配资公司起名。要求贴近公司行业，简单易记，原创。,2016.04.12,2016.08.20,任务编号：415488,￥ 100,,石枯沙老,,,,,,,,,,,,,,,,,,,,,,,
【公司起名】商标起名,3232人,69人,¥360,圆满完成,mf151****9635,名字2、3个字，经营范围食用油 29、30、35类，这三个类别，起好的名字一定要在商标网有查过没有人注册  因为名字要用于商标注册的,2016.04.12,2016.06.24,任务编号：415421,￥ 360,,五艺之星,,,,,,,,,,,,,,,,,,,,,,,
【公司起名】净水设备公司取名,3108人,62人,¥108,圆满完成,Mr136****5577,经营业务:净水设备，水处理，要求简单易记，字数不限，一定要能工商注册的,2016.04.12,2016.05.16,任务编号：415429,￥ 108,,五艺之星,,,,,,,,,,,,,,,,,,,,,,,
【品牌起名】放养黑猪商标取名,5371人,114人,¥100,圆满完成,细水长流39666,"1、所设计的作品为原创，为第一次发布，未侵犯他人的著作权，如有侵犯他人著作权，由设计者承担所有法律责任;2、中标的设计作品，我方支付设计制作费，即拥有该作品的知识产权，包括著作权,使用权和发布权等,有权对设计作品进行修改,组合和应用;设计者不得再向其他任何地方使用该设计作品;",2016.04.11,2016.08.13,任务编号：415401,￥ 100,,悟本设计,企业,三品,70分,,,电商vi设计,"￥11000
            /件",画册设计,300,推广设计,价格面议,文案设计,价格面议,品牌策划,"￥8000
            /件",包装设计,"￥3000
            /件",,,,,,
