标题,查看数,参与数,需求价格,状态,需求方,需求文本,发布时间,完成时间,任务编号,交易价格,参与交稿,设计师,设计师类型,设计师等级,设计师信用,交易总次数,交易总金额,服务1,价格1,服务2,价格2,服务3,价格3,服务4,价格4,服务5,价格5,服务6,价格6,服务7,价格7,服务8,价格8,服务9,价格9
【广告策划】营销广告语的征集,9153人,64人,¥300,圆满完成,欢欣网,欢欣网是做手机回收，手机以旧换新的一个APP（最初欢欣网准备做优惠促销，领取优惠吗等活动，考虑到现如今 优惠 促销 等系列活动策划在朋友圈已经走不通了）因此需要增求各大网友的建议，发布什么内容和口号，不被朋友圈反感）-------------------------------------------------------------------------------------------------------格式和要求：可以走极端，发挥想象，站在用户角度去思考 分享的主题怎么能让用户点击，或者分享，主题围绕以旧换新来写一句简短的营销广告语，点击进去的落地页 是我们（猛戳！领钱啦！）查看活动页 关注微信号：欢欣网-最新活动（一级菜单）-猛戳！领钱啦！（猛戳！领钱啦！）不明白的请咨询,2015.05.26,2015.06.06,任务编号：355688,￥ 300,,zllovely,,,,,,,,,,,,,,,,,,,,,,,
【宣传策划】征集深度微信推广软文,399人,9人,¥500,圆满完成,厦门佰斯德,详情见附件,2015.05.25,2015.05.31,任务编号：355426,￥ 500,,神广网络推广旗舰店,工作室,四品,40分,,,【整合营销】品牌推广企业推广网站推广产品推广口碑推广百度推广百度霸屏,"￥2988
            /件",【问答推广72小时被删包补】问答推广百度知道百度问答360问答搜搜问答,"￥6
            /件",【新闻稿发布】新闻发布新闻营销新闻发稿全国各大门户网站发稿超值低价套餐,"￥90
            /件",【90元手工发100帖】论坛推广论坛发帖纯手工发帖论坛加精置顶,"￥90
            /件",百度百科词条创建百度百科修改360百科SOSO百科互动百科,"￥600
            /件",新闻稿代写软文代写各类宣传文稿代写【全国获奖写手亲自操刀】,"￥150
            /件",万能投票营销推广新媒体推广专家策划投票提升投票排名,"￥1
            /次",,,,
【店铺/网店起名】酒类批发部取名,10484人,113人,¥100,圆满完成,mf185****8315,酒类批发部取名，简单、醒目、,2015.05.24,2015.06.08,任务编号：355146,￥ 100,,五艺之星,,,,,,,,,,,,,,,,,,,,,,,
【宝宝起名】李姓女宝宝起大名,7783人,56人,¥100,圆满完成,o5560****e4fef,农历2015.4.2阳历2015.5.19上午十点五十八出生女宝宝，要求好听，笔画不要太繁，：请结合周易五行八卦的算法、生辰八字、五行旺衰喜忌进行综合分析，交稿时附带详尽的名称寓意，命理分析，解释名字并说明名字和生辰八字的联系，提交详细的起名方案。不要用软件生成的姓名。,2015.05.23,2015.10.13,任务编号：355050,￥ 100,,易The name,个人,九品,34分,,,,,,,,,,,,,,,,,,,,
【品牌起名】急需男装公司取名 要求有内涵  有品位！,6301人,74人,¥100,圆满完成,Mr158****2199,"男装类新公司取名，包括公司名称和品牌名公司在广州经营介绍： 主营男装,生产和销售，消费人群以18-35岁为主， 服装特色：个性，时尚，彰显个性而不失传统。要求： 1、名称响亮，易记，复古，有创意，有内涵;(必需可以注册公司的)2、可考虑例如包含有：帝、梵、熙、古、哲、吉（主要是带有时尚感、美感、内涵的名字）3、最好有中、英文两种名称，并可注册商标知识产权说明： 1、所设计的作品为原创，为第一次发布，未侵犯他人的著作权，如有侵犯他人著作权，由设计者承担所有法律责任; 2、中标的设计作品，我方支付设计制作费，即拥有该作品的知识产权，包括著作权,使用权和发布权等,有权对设计作品进行修改,组合和应用;设计者不得再向其他任何地方使用该设计作品; ，",2015.05.23,2015.10.13,任务编号：354988,￥ 100,,品牌天下，名者为先,个人,七品,40分,,,品牌取名,"￥100
            /次",,,,,,,,,,,,,,,,
【品牌起名】征集两个字的品牌名称，可注册也可注册商标,9515人,96人,¥100,圆满完成,Mr139****2306,品牌主要是婴童行业的服装、化妆品、纸尿裤，名字急用，请尽快投稿哦！,2015.05.22,2015.09.05,任务编号：354822,￥ 100,,YIMI创意工作室,,,,,,,,,,,,,,,,,,,,,,,
【广告策划】奶茶品牌征集广告语,12465人,114人,¥300,圆满完成,mf180****6878,"我们是做奶茶甜品品牌加盟连锁的,品牌名叫  芒一Q  想起一个经典广告语,要经典简洁响亮另类也要有个性,主要体现我们的品牌,利于我们的品牌推广的广告语,这句话要能吸引路过人群的眼球,让顾客为了这句话,都想到店里看看,或者消费.让人们产生好奇心",2015.05.22,2015.07.23,任务编号：354779,￥ 300,,MID STUDIO,工作室,七品,39分,,,,,,,,,,,,,,,,,,,,
【公司起名】医疗投资公司取名,11698人,100人,¥200,圆满完成,mf186****0330,需要在重庆地区办理工商注册从事医疗产业，医院、养老投资最好两个字或三个字，不要太千篇一律，要利于传播，树立品牌需要结合英文名称及寓意，好翻译或者有能结合的音译英文名之类的可随时联系qq53414409，验证信息：取名,2015.05.22,2015.06.26,任务编号：354802,￥ 200,,Nurse_李,,,,,,,,,,,,,,,,,,,,,,,
【公司起名】西服高级私人定制工作室起名称,11388人,99人,¥200,圆满完成,mf185****3157,具体要求：一、设计要求：1、符合行业特性，客户在看到名称后会有联想。2、名称简约好记。最好能体现定制的传统与绅士的优雅。3、作品风格、但必须原创。能够商标注册的。知识产权说明：1、选中的设计作品，我方支付悬赏金后，即拥有该作品知识产权，包括著作权、使用权和发布权等，有权对设计作品进行修改、组合和应用，设计者不得再在其它任何地方使用该设计作品。2、所设计的作品应为原创，未侵犯他人的著作权；如有侵犯他人著作权，由设计者承担所有法律责任。3.征集结果公布后，未采用的作品即可自行处理。4.参加此设计任务者被视为同意以上所有声明,2015.05.21,2015.10.01,任务编号：354711,￥ 200,,广东聚力开元广告设计服务工作室,工作室,四品,40分,,,企业全套VI品牌策划,价格面议,精美个性包装袋/盒/手提袋等设计制作及印刷,价格面议,{全网最精}各类电子商务型网站装修及策划设计全套包办,价格面议,,,,,,,,,,,,
【专业代笔】帮忙写一篇关于经济学的案例分析报告,5541人,6人,¥500,圆满完成,joice,根据经济学理论结合工作实际，选择一个经济金融现象或者问题。或者对该问题给出解决的方案，完成一篇经济学的案例分析报告。一万字以上，确定原创，无抄袭，无发表，禁止使用百度，google等搜索引擎收录的文章。,2015.05.21,2015.11.20,任务编号：354634,￥ 500,,莫考婷win,,,,,,,,,,,,,,,,,,,,,,,
【品牌起名】男性专用面膜品牌取名,9564人,95人,¥100,圆满完成,o555c1c9f5e042,1、体现男性专用。2、简单容易记忆，顺口。3、品牌名称意义需要附文字说明。4、名称在商标局同类别中未被注册过。,2015.05.20,2015.07.16,任务编号：354394,￥ 100,,一冷寒冰一,个人,七品,37分,,,,,,,,,,,,,,,,,,,,
【公司起名】跨境电商网站名称征集,10870人,86人,¥600,圆满完成,M1855****879,"跨境电商网站名称征集                    经营介绍： 主营海外母婴产品、化妆品、家居日用、进口美食、保健品等。        详细要求：                                      1、名称简短易记，不能拗口，2-4个字，最好是两个字；(必需可以注册公司的)                                        2、必须原创，有创意说明；3、名称的域名必须中英文一致或者很相近，比如百度（baidu.com），小米（mi.com），域名没被注册，且可注册商标；            4、一旦被采纳后的名称、域名及其商标注册的所有权均归我方所有，任何被采纳的投稿人或机构均无任何所有权或话语权。5、一旦采纳签订中标授权书之后即可发放征集奖金。                我们收到的投稿必须包含的内容有：名称+域名+创意说明+商标是否被注册。            知识产权说明：                                            1、所设计的作品为原创，为第一次发布，未侵犯他人的著作权，如有侵犯他人著作权，由设计者承担所有法律责任;                                        2、中标的设计作品，我方支付设计制作费，即拥有该作品的知识产权，包括著作权,使用权和发布权等,有权对设计作品进行修改,组合和应用;设计者不得再向其他任何地方使用该设计作品;",2015.05.20,2015.08.16,任务编号：354393,￥ 600,,星光熠熠,,,,,,,,,,,,,,,,,,,,,,,
【公司起名】文化公司起名,16930人,224人,¥200,圆满完成,zhangzili222,"文化公司起名1.  简单好记2.  容易传播3. 朗朗上口搜索复制< iframe src="""">< /iframe>",2015.05.20,2015.09.12,任务编号：354221,￥ 200,,微龙文化咨询工作室,,,,,,,,,,,,,,,,,,,,,,,
【店铺/网店起名】跨国交友网站（APP）取名,18472人,155人,"¥1,000",圆满完成,epweike,要求：易记、朗朗上口，名字能体现一定的行业特性。也就是看到名字就知道，你大概是干啥的。如：陌陌（imomo.com），定位于陌生人交友。最好是域名、商标都能注册注册。中文、英文名字均可。请到万网和中国商标注册网上查询可以注册后再提交。,2015.05.18,2015.09.04,任务编号：353629,￥ 1000,,微龙文化咨询工作室,,,,,,,,,,,,,,,,,,,,,,,
【公司起名】美术工作室起名字征集,18181人,130人,¥200,圆满完成,o55576ee5b0322,一个美术工作室起名，要求欢乐现代时尚，有互联网的多人概念的。字数2-4个,2015.05.17,2015.06.19,任务编号：353472,￥ 200,,MID STUDIO,工作室,七品,39分,,,,,,,,,,,,,,,,,,,,
【公司起名】创意APP名称征集,19471人,162人,¥150,圆满完成,mf541****c00e10,征集一个创意APP名称   关键词：拍照 摄影 图片美化 定位 社交 分享  名字最好是2-4字  2   名字用于注册公司 发布APP  若市面上有重复恕不选标投标规范：中文名称+英文名称+威客的年龄段+从事职业  列如：微信+Wechat+90后+设计师 之所以要了解威客的年龄段和从事职业 是因为后期若有相关创意想法等某些合作，会优先考虑。,2015.05.14,2015.07.20,任务编号：353010,￥ 150,,子轩品牌策划,,,,,,,,,,,,,,,,,,,,,,,
【品牌起名】取一本菜谱的名字,12351人,198人,¥100,圆满完成,mf152****6529,主要是一些喜欢做饭的女性菜谱集，这些女性大都比较喜欢旅游，好玩，她们把自己的菜谱搜集整理起来。我们希望这本的名称能够快乐，休闲感，比较有意思。,2015.05.14,2015.07.04,任务编号：352932,￥ 100,,mf18734137809,,,,,,,,,,,,,,,,,,,,,,,
【品牌起名】创意设计品牌起名,8495人,108人,¥100,圆满完成,mf152****6529,主要针对年轻人的创意品牌起名，品牌的主要功能是通过提供创意设计的产品，比如说小礼品，家居用品，科技产品；让客户感觉好玩，亲近，可爱，简约的名称；两到四个字的名称名称可以注册。,2015.05.14,2015.11.13,任务编号：352928,￥ 100,,lijie28,,,,,,,,,,,,,,,,,,,,,,,
【公司起名】取个p2p网贷平台名字,1845人,113人,¥400,圆满完成,mf186****1289,具体内容看附件,2015.05.14,2015.05.25,任务编号：352885,￥ 400,,zllovely,,,,,,,,,,,,,,,,,,,,,,,
【店铺/网店起名】舞蹈培训中心取名字,10751人,80人,¥100,圆满完成,o55536b03d5df4,主要做成 人爵士舞，拉丁舞和瑜伽，少儿只针对暑寒假，希望名字大气一些，不要一些舞魅啊，舞韵啊之类的，名字大气一点，名字不要超过4个字，保证原创。,2015.05.14,2015.05.27,任务编号：352832,￥ 100,,星橙设计QQ1356183009,,,,,,,,,,,,,,,,,,,,,,,
【公司起名】北京某科技公司起名字，急需,2496人,135人,¥300,圆满完成,merlin,设计需求具体看附件,2015.05.13,2015.10.30,任务编号：352775,￥ 300,,深圳市名刻设计事务所,企业,六品,40分,,,施工图深化制图描图节点大样剖面详图水电结构商场家装报建土建等,"￥18
            /㎡",草图大师3 D家具产品建筑室内景观道具摆场舞台戏台结构造型模型建模,"￥1500
            /次","别墅,自建房,豪宅住房,新房,商品房公寓施工图效果图定制设计","￥80
            /㎡","高端别墅,自建房,豪宅住房,新房,商品房公寓欧式中式风格定制","￥50
            /㎡","四合院,三合院,名宿,农家乐,酒店,公寓,别墅,宅院全套设计","￥15000
            /套",高端自建房/别墅商铺出租商住四合院住宅酒店全套建房图纸设计,"￥9800
            /套",商铺出租自建房别墅办公四合院公寓酒店住宅平面户型布置优化设计,"￥1500
            /次",一层自建房/别墅/四合院/房子/住房/楼房农家乐建房全套设计,"￥2600
            /次",二层自建房/别墅/四合院/房子/住房/楼房农家乐建房全套设计,"￥4500
            /次"
【品牌起名】给豆芽产品起名,9258人,88人,¥200,圆满完成,mf186****1290,"一、 商标名称取名 , 应用在豆芽产品上。二、经营介绍，该产品为无添加，无公害豆芽，自然6天生长三、设计要求：1、商标名称要能体现出绿色食品、或原生态、健康的元素，跟农业有一定关联。2、本标识委托人需要进行商标注册，竞标者设计要有独创、显著特点。 3、 竞标者需要提供商标的设计方案。详细阐述设计说明及理念。 四、知识产权说明1、所设计的商标名称为原创，未在国家商标局注册过，没有抄袭、模仿他人作品，若存在侵犯他人版权由设计者承担法律责任。2、中标的设计作品，我方支付设计制作费，设计方必须提供以上要求设计作品完整的方案，包括各种矢量图形源文件和所用到的字体，以方便进行修改完善和印刷。3、设计者不得将设计作品对第三人进行展示、或者提供第三方使用。设计作品一经采用，所有权、修改权和使用权均归我方所有，设计者不得在其他任何地方使用该设计作品，包括并不限于著作权、使用权、发布权以及对设计作品进行修改、组合、应用等权利。否则构成侵权，本公司保留依法追究设计方法律责任的权利。4.征集结果公布后，未采用的作品即可自行处理。5.参加此设计任务者被视为同意以上所有声明。任务征集期间，如有疑问请联系QQ 24710447联系电话:翟女士 18645071290",2015.05.12,2015.06.06,任务编号：352299,￥ 200,,mfUCKER,,,,,,,,,,,,,,,,,,,,,,,
【公司起名】商务公司起名,6914人,42人,¥100,圆满完成,o53c10a203ba1e,网络营销公司起名，要能注册，有寓意，能够琅琅上口，好记,2015.05.09,2015.05.20,任务编号：351670,￥ 100,,ellina的店铺,个人,九品,37分,,,,,,,,,,,,,,,,,,,,
【宝宝起名】宝宝起名,6762人,32人,¥120,圆满完成,mf136****7835,宝宝信息性别：男孩  重量：6斤3两   出生时间新历历2015年5月8日14时53分父亲   朱    晓科  情况：生肖（虎），出生日期 阴历1986年6月30日， 母亲   张 文 娟  情况：生消（虎），出生日期 阴历1986年2月25日，说明：1、请大家根据父亲姓氏取名，在取名时注意名字洋气顺口，尽显儒雅书香气息，不要用太生僻的字。            2、请根据父母及宝宝的生辰八字取一个100分的名字（加小名）                 伴随宝宝一生的名字，就先拜谢大家了！重要提示：1、字音好：读起来顺口、字音悦耳，注意阴阳平仄，富于节奏感，朗朗上口（顺溜不拗口），不要有不好的谐音，不易联想起外号2、字义好：寓意深刻、蕴涵丰富、积极健康向上，名字喜庆3、构思好：清新不俗、独具特色、与众不同4、易认易念易写，好听好看好记，无歧意无不良联想谐音，吉利吉庆吉祥 重要要求： 根据出生时间分析八字，找出用神（对孩子一生都有利的五行）起名时用上。再找出忌神（对孩子一生都不利的五行）起名时避开不用。然后根据性别，再根据笔划，三才要相生，数理要吉祥。同时照顾字音、字义、字形的配合，还要好听！以上要求，请提交详细分解。宝宝的名字要求三个字,2015.05.09,2015.05.24,任务编号：351626,￥ 120,,五艺之星,,,,,,,,,,,,,,,,,,,,,,,
【公司起名】公司起名,11123人,148人,¥500,圆满完成,mf138****3723,专门帮助企业做高端洗护品牌订制，做品牌推广和策划以及培训，服务为一体的公司。有自己的工厂，实体店及运营公司。名字必须能通过工商局注册2-4个字之间,2015.05.08,2015.08.16,任务编号：351480,￥ 500,,五艺之星,,,,,,,,,,,,,,,,,,,,,,,
【公司起名】软装设计公司起名,10022人,77人,¥300,圆满完成,mf139****8915,"一定要突显品味,我们公司经营方向就是:整体软装设计公司,设计为主,施工为辅。有做工程、样板房、别墅、会所为主。艺术品的制作于安装施工一体化。设计要求：1、名字最好是2-3个字，类似深圳市xx空间设计艺术有限公司或者深圳市xx艺术设计事务所。2、名字必须要通过工商局注册的3、取一个中文和英文名字",2015.05.08,2015.10.30,任务编号：351377,￥ 300,,一点灵感,工作室,九品,36分,,,,,,,,,,,,,,,,,,,,
【店铺/网店起名】起一个做门窗的店名,11235人,117人,¥100,圆满完成,mf159****1498,起一个做门窗的店名 一定要有一个林字 因为我的名字里面有个林字 不能多于6个字,2015.05.07,2015.06.13,任务编号：351341,￥ 100,,高阁雅依创意工作室,,,,,,,,,,,,,,,,,,,,,,,
【品牌起名】生活用纸取名,16670人,218人,¥200,圆满完成,mf186****2600,生活用纸取名详细要求及介绍：1，定位高端生活用纸，参考洁柔、维达、心相印2，抽纸、卷纸3，可以注册商标4，清爽、顺口、高雅、有内涵。容易记住、贴近生活的5，最多不超过4个字，最好是2-3个字的，简单英文或字母也可以6，其它不是做纸巾的知名品牌，但是它没有注册纸巾这个类别的，我们可以注册的也行。例如：我身边的“碧桂园”是做房地产的，但有一家饮用水公司注册了“碧桂园”饮用水。,2015.05.07,2015.05.31,任务编号：351167,￥ 200,,小旺福视觉设计,工作室,八品,38分,,,DS,"￥500
            /次",zt字母完美契合,￥300,a字母变形设计,￥500,田字,￥350,G字母,￥300,建筑,￥500,飞驰,￥200,,,,
,,,,,,,,,,,,,,,,,,,,,,,,,,,,,,,,,,,
【品牌起名】工业产品品牌取名,7404人,69人,¥300,圆满完成,泛道国际,任务需求一、设计内容：品牌起名。品牌用于工业缝纫机及其相关产品。如缝纫机台板、机架、电机等。二、设计名称：英文、中文名称三、设计要求：1、名称读音响亮，易读易定，易记易识别，符合产品特质；2、名称有一定含义，与产品相匹配；3、名称不可太长，英文名称不超过5个字母；四、知识产权说明：1、设计稿必须为原创，未侵犯他人的著作权，如有侵犯他人著作权，由设计者承担所有法律责任。2、取名需在工商局可进行登记注册,2015.05.06,2015.05.26,任务编号：351038,￥ 300,,小九哥,,,,,,,,,,,,,,,,,,,,,,,
【品牌起名】给商品取名称,4166人,58人,¥150,圆满完成,mf136****5327,"任务需求一、 商标名称取名 , 应用在特殊功能大米商品上。二、经营介绍，该产品富含对人体有益的微量元素，大米蛋白质和抗性淀粉，为糖尿病患者一日三餐的主食，是糖尿病食疗的首选产品。目前有在经营的类似商品有“绿巨人”牌宜糖米，“秀泉”牌益糖加钙米，“朴博士”牌优糖米等。三、设计要求：1、商标名称要能体现出绿色食品、或原生态、健康的元素，跟农业有一定关联。2、本标识委托人需要进行商标注册，竞标者设计要有独创、显著特点。 3、 竞标者需要提供商标的设计方案。详细阐述设计说明及理念。 四、知识产权说明1、所设计的商标名称为原创，未在国家商标局注册过，没有抄袭、模仿他人作品，若存在侵犯他人版权由设计者承担法律责任。2、中标的设计作品，我方支付设计制作费，设计方必须提供以上要求设计作品完整的方案，包括各种矢量图形源文件和所用到的字体，以方便进行修改完善和印刷。3、设计者不得将设计作品对第三人进行展示、或者提供第三方使用。设计作品一经采用，所有权、修改权和使用权均归我方所有，设计者不得在其他任何地方使用该设计作品，包括并不限于著作权、使用权、发布权以及对设计作品进行修改、组合、应用等权利。否则构成侵权，本公司保留依法追究设计方法律责任的权利。4.征集结果公布后，未采用的作品即可自行处理。5.参加此设计任务者被视为同意以上所有声明。任务征集期间，如有疑问请联系QQ 425987836 联系电话:陈先生 13665925327",2015.05.06,2015.05.21,任务编号：350809,￥ 150,,OMG文案专业创作,,,,,,,,,,,,,,,,,,,,,,,
【店铺/网店起名】精品配饰店店铺命名,14454人,171人,¥500,圆满完成,mf136****8860,本人近期内计划开设一家日韩风格的精品、配饰店，未来计划走“无印良品”、“名创优品”的连锁路线，请各位达人支招起个品牌名，具体需求如下：1.中英文命名，字数不限2、中文名可以考虑谐音或翻译，便于记忆3、简洁易记，又有想象空间4、需配有对该品牌名的简单解释,2015.05.05,2015.05.29,任务编号：350674,￥ 500,,高阁雅依创意工作室,,,,,,,,,,,,,,,,,,,,,,,
【品牌起名】洁身器名字征集,5499人,178人,"¥1,000",圆满完成,mf135****5108,详情见附件,2015.05.04,2015.05.21,任务编号：350480,￥ 1000,,简简单单,,,,,,,,,,,,,,,,,,,,,,,
【店铺/网店起名】奶茶店起名,13107人,163人,¥100,圆满完成,mf188****9500,"奶茶店的名字征集                           经营介绍：主要是奶茶，咖啡以及现窄果汁，果汁以柠檬和橘子为主                要求：                                            1、名称响亮，易记，文雅，有创意但不失稳重;(必需可以注册公司的)                                        2、字数不限，能够朗朗上口的   ，简洁大方点                            3、附上创意说明。                                        知识产权说明：                                            1、所设计的作品为原创，为第一次发布，未侵犯他人的著作权，如有侵犯他人著作权，由设计者承担所有法律责任;                                        2、中标的设计作品，我方支付设计制作费，即拥有该作品的知识产权，包括著作权,使用权和发布权等,有权对设计作品进行修改,组合和应用;设计者不得再向其他任何地方使用该设计作品;",2015.05.04,2015.05.22,任务编号：350385,￥ 100,,竹叶常青设计工作室,,,,,,,,,,,,,,,,,,,,,,,
【品牌起名】品牌名称征集,7931人,39人,¥200,圆满完成,简伦,公司简介：家居家纺，公司专门销售进出口家纺产品，属欧洲文化，产品有床上多件套，枕头，被子，床垫等等。消费者以70后80后居多要求：1、全英文名称，不超过9个字母；2、能提供产品功能广告语，中标威客需要配合后期修改；3、请附上创意说明，未提供创意说明的朋友，我方不采纳；4、每位投标者所取名字不得多于3个，所创作的名称必须为原创，不得抄袭剽窃他人作品，如有侵犯他人著作权，由竞标者承担所有法律责任；5、请附带在中国商标网查询结果截图商标涉及类别，20类，24类。知识产权说明：       1、所设计的作品为原创，为第一次发布，未侵犯他人的著作权，如有侵犯他人著作权，由设计者承担所有法律责任；         2、中标的设计作品，我方支付设计制作费，即拥有该作品的知识产权，包括著作权，使用权和发布权等，除征集费外，无需向竞标者支付任何费用。我发有权对设计作品进行修改，组合和应用，设计者不得再向其他任何地方使用该设计作品。,2015.05.04,2015.06.06,任务编号：350253,￥ 200,,ljyi嘉懿传媒,,,,,,,,,,,,,,,,,,,,,,,
