标题,标题链接,查看数,参与数,需求价格,状态,任务类型,需求方,需求文本,发布时间,完成时间,任务编号,交易价格,参与交稿,设计师,字段1_link,字段1_link1,设计师类型,设计师等级,设计师信用,交易总次数,交易总金额,服务1,价格1,服务2,价格2,服务3,价格3,服务4,价格4,服务5,价格5,服务6,价格6,服务7,价格7,服务8,价格8,服务9,价格9
【广告策划】家庭小伤口护理盒广告语征集,https://task.epwk.com/490107/,4280人,131人,¥100,圆满完成,单人悬赏,o58de58c2480b3,产品：家庭小伤口护理盒；品牌：栋栋。需要一广告语，广告语内容里要包含栋栋。比如：小伤口，找栋栋。,2017.04.07,2017.05.05,任务编号：490107,￥ 100,168,笔下有余创意,https://shop.epwk.com/2j5jj2zo25pz/,,,,,,,,,,,,,,,,,,,,,,,,
【品牌起名】食品商标名称征集,https://task.epwk.com/490109/,2948人,105人,¥200,圆满完成,单人悬赏,o58e7****92190,食品商标名称取名1、能够保证在29，30，35类注册2、不能出现“敏”3、最好能提供后续注册服务，不能也没关系就是我麻烦一点食品包含：牛奶硬块糖（糖果）300032蛋白杏仁糖果300039咖啡300026茶300037糖*3000693005 蜂蜜3006 面包，糕点3007 方便食品3011 豆粉，食用面筋3012 食用淀粉及其制品 3013 食用冰，冰制品 3001 咖啡，咖啡代用品，可可,2017.04.07,2017.04.25,任务编号：490109,￥ 200,119,中国商标设计在线,https://shop.epwk.com/m7d7ww6qv5q8/,,,,,,,,,,,,,,,,,,,,,,,,
【公司起名】公司名字征集,https://task.epwk.com/490001/,4057人,106人,¥100,圆满完成,单人悬赏,mf139****7266,公司起名，必须保证工商局验证通过1、我们公司主要经营有色金属、机电五金、金属材料、普通机械、五金交电、化工原料、针纺织品、塑料制品等；    2、我们想要取一个简单大气的名字，不要偏门奇怪的名字，不要随意拼凑，字数不宜超过五个，同时必须保证能够工商局注册通过；      3、同时名字设计需要考虑到后期商标设计的元素。,2017.04.07,2017.06.11,任务编号：490001,￥ 100,116,意点品牌策划,https://shop.epwk.com/7lngqj21rdmr/,,,,,,,,,,,,,,,,,,,,,,,,
【品牌起名】家居日用品品牌商标取名,https://task.epwk.com/489924/,4247人,105人,¥200,圆满完成,单人悬赏,o58e5****69000,家居日用品使用 玻璃杯 保温杯 要求：1、2-3字内 名称简洁 顺口，易记。并可注册21类商标。查询好是否已经使用 2、有中、英文相对应的两种名称3、谢绝电脑取名的避免浪费精力 谢谢！,2017.04.06,2017.05.09,任务编号：489924,￥ 200,127,金名创鑫,https://shop.epwk.com/4rn8q16qgngm/,https://shop.epwk.com/4rn8q16qgngm/chushou/,工作室,七品,37分,,,,,,,,,,,,,,,,,,,,
【产品卖点】产品文案撰写,https://task.epwk.com/489844/,2896人,13人,¥100,圆满完成,单人悬赏,o58e5f659b3947,1、分别向你家中的奶奶、妈妈以及小表妹（5-6岁），推荐或者说明陌陌这个APP。（每段文字不超过60字。） 2、看来毫不相关的两类事物，可以经由文案的巧思将它们入情入理的联系起来。（每段文字不超过150字）ü 口红和海豚 ü 柚子和美女 ü 素颜霜和撒哈拉沙漠,2017.04.06,2017.05.08,任务编号：489844,￥ 100,15,这个名字不太冷,https://shop.epwk.com/3gd2m6rmgner/,https://shop.epwk.com/3gd2m6rmgner/chushou/,个人,九品,37分,,,,,,,,,,,,,,,,,,,,
【品牌起名】网站起名及网址域名征集,https://task.epwk.com/489633/,3265人,96人,¥200,圆满完成,单人悬赏,o58e50d2e23aa9,"网站主要从事百度下拉框/360下拉框等推广,及全网性的负面压制,,属网络推广的一类,自己想的名字,都不理想,想借用各位大神的智慧,帮忙给网站起名,及网址域名1.**营销,**推广,**优化,**网络:…… 类似这样的,不局限这几种,名字要感觉高端大气一些,正规一些,顺口一些,能诠释其意义2.要利于搜索引擎的搜索3.网址要好记,有意思,不要过长,和网站名有关系,最重要的就是不要被人注册过以上只是个人意见,各位大神请自由发挥即可如果那位朋友有LOGO设计,可以在提交稿件的时候说一下,价格另算的",2017.04.05,2017.06.08,任务编号：489633,￥ 200,124,高阁雅依创意工作室,https://shop.epwk.com/p05qjor3ydev/,,,,,,,,,,,,,,,,,,,,,,,,
【宝宝起名】女宝宝起名,https://task.epwk.com/489546/,6939人,148人,¥100,圆满完成,单人悬赏,o58e4b6eccba28,"鸡年女宝宝取名（包括小名），宝宝姓“张”，出生于农历2017年3月27日14点14分出生，体重6斤4两 父亲姓张，属虎农历1986年8月21日，母亲姓廖，属牛农历1985年4月13日一、名字要有内涵、简单、清新，不浮华，不使用生僻字,简洁大气，；用字要有意义，字型书写出来匀称好看，读起来朗朗上口，不拗口，不易重名，名字谐音没有不好的联想，能有特色最好，别出心裁或独具匠心，能使人过目难忘,印象深刻。 二、寓意要吉祥，听起来没有歧义,字义好。 三、名字要符合传统命理五行、五格数理格局。请结合周易五行八卦的算法、生辰八字、五行旺衰喜忌进行综合分析，三才配置要好。格数理最好全是吉数，避免有凶，交稿时附带详尽的名称寓意，命理分析，解释名字并说明名字和生辰八字的联系，提交详细的起名方案。 包括姓氏在内3个字",2017.04.05,2017.04.22,任务编号：489546,￥ 100,179,五艺之星,https://shop.epwk.com/78dljwoxp5lx/,,,,,,,,,,,,,,,,,,,,,,,,
【公司起名】生产制造公司名字征集,https://task.epwk.com/489456/,3019人,102人,¥100,圆满完成,单人悬赏,ceic2012,公司主要经营范围：半挂车、厢式车、自卸车、罐式车、粉粒物料运输车、低平板运输车、混凝土搅拌车、特种车生产、销售；全挂车生产、销售；汽车、拖拉机、农用车整车及配件设计、开发、制造、加工及销售；无人机、多功能飞行器及配件的生产、设计、开发、制造、销售及技术服务；无人机、多功能飞行器软件的设计、开发、销售；汽车、半挂车配件生产、销售；﻿﻿要求：1、名称响亮，易记，有含义，有创意但不失稳重，不要太俗气;(必需可以注册公司的)2、名字再2-3字之内。3、附上创意说明。,2017.04.05,2017.07.13,任务编号：489456,￥ 100,117,万思新的商铺,https://shop.epwk.com/09drjxwl153w/,,,,,,,,,,,,,,,,,,,,,,,,
【店铺/网店起名】羊肉粉馆取名,https://task.epwk.com/489004/,8383人,152人,¥100,圆满完成,单人悬赏,mf156****1573,"羊肉粉馆取名，要求通俗，易记忆，能注册！知识产权说明：1、所设计的作品为原创，为第一次发布，未侵犯他人的著作权，如有侵犯他人著作权，由设计者承担所有法律责任;2、中标的设计作品，我方支付设计制作费，即拥有该作品的知识产权，包括著作权,使用权和发布权等,有权对设计作品进行修改,组合和应用;设计者不得再向其他任何地方使用该设计作品;",2017.04.04,2017.07.31,任务编号：489004,￥ 100,185,明尼苏达猪工作室,https://shop.epwk.com/81n41164onp6/,,,,,,,,,,,,,,,,,,,,,,,,
【店铺/网店起名】淘宝店、公司起名字,https://task.epwk.com/489003/,5583人,195人,¥120,圆满完成,单人悬赏,mf185****8412,淘宝店、公司起名字（卖单板滑雪板，还有滑雪服装、滑雪鞋等雪具）任务需求：淘宝店、公司起名字，可注册。店内主要卖单板滑雪板，还有滑雪服装、滑雪鞋等雪具。要求：1，名字4个字以内，最好1~2个字。2，要有创意，好记。3，必须能注册商标使用。4，28类。5，我店认为同行比较好的名字：冷山、瓷雪具、傲雪、雪圈雪具、零度……,2017.04.03,2017.06.23,任务编号：489003,￥ 120,246,飞天文化,https://shop.epwk.com/v0n1x6lwk57y/,,,,,,,,,,,,,,,,,,,,,,,,
【品牌起名】夏凉被棉名字征集,https://task.epwk.com/488813/,4121人,137人,¥100,圆满完成,单人悬赏,mf152****5180,我需要1个名子注册商标。我是做夏凉被的，里面装的棉是纯天然植物的学名再生纤维素纤维。我想给这棉起一个名字。,2017.04.02,2017.04.28,任务编号：488813,￥ 100,165,潮落潮起的商铺,https://shop.epwk.com/09drj38oq53w/,https://shop.epwk.com/09drj38oq53w/chushou/,个人,四品,37分,,,,,,,,,,,,,,,,,,,,
【品牌起名】智能APP取名,https://task.epwk.com/488906/,4745人,157人,¥100,圆满完成,单人悬赏,o586226bf90ee0,这款APP是基于大数据+ai为基础的综合服务平台，所以非常智能化比如你一打开app，大数据就能计算出你想要的是什么，给你定制化推送，从而起到智能作用类似于大众点评，里面有商城和餐饮、酒店等等的，但是需要创新的名称名字一定要新颖，体现出智能化管家服务,2017.04.02,2017.05.21,任务编号：488906,￥ 100,184,断肠人在天涯,https://task.epwk.com/javascript:;,,,,,,,,,,,,,,,,,,,,,,,,
【公司起名】电商贸易公司起名,https://task.epwk.com/488884/,7634人,155人,¥150,圆满完成,单人悬赏,Qd滴水藏海,1.简介： 因为跟朋友打算开网店去做外贸，所以需要起一个公司名字。2.主营业务： 会开成几个电商店，主营业务有手机壳类配件、服饰类等。3.要求： 名字可以以动物、历史典故、古诗词等，各位可以适当发挥，主要是有寓意，简单容易记！（PS:假如能以qd这两个字母开头组成的词为佳。）,2017.04.02,2018.03.26,任务编号：488884,￥ 150,200,明尼苏达猪工作室,https://shop.epwk.com/81n41164onp6/,,,,,,,,,,,,,,,,,,,,,,,,
【公司起名】电脑公司取名,https://task.epwk.com/488866/,2977人,132人,¥100,圆满完成,单人悬赏,k2618****09,电脑公司取名，二个字的，最好带有五行属金的，要求能注册，,2017.04.02,2018.01.22,任务编号：488866,￥ 100,149,百解,https://shop.epwk.com/0jnek0089nv3/,,,,,,,,,,,,,,,,,,,,,,,,
【品牌起名】汽水品牌起名,https://task.epwk.com/488863/,5350人,178人,¥100,圆满完成,单人悬赏,mf153****4321,要求符合年轻人互联网思维创新可注册商标32类和35类.,2017.04.02,2017.06.11,任务编号：488863,￥ 100,221,xdfswyyg,https://task.epwk.com/javascript:;,,,,,,,,,,,,,,,,,,,,,,,,
【广告策划】网店广告语征集,https://task.epwk.com/488763/,5821人,131人,¥100,圆满完成,单人悬赏,mf188****7222,店名：艾米（Amy）甜心水果捞。经营品类：水果捞，水果鲜切主要客户：在校大学生要求： 简单好记，吸引人。,2017.04.01,2017.05.21,任务编号：488763,￥ 100,159,明尼苏达猪工作室,https://shop.epwk.com/81n41164onp6/,,,,,,,,,,,,,,,,,,,,,,,,
【品牌起名】国际美容机构起名征集,https://task.epwk.com/488700/,3051人,103人,¥200,圆满完成,单人悬赏,mf138****0345,国际美容机构起名，英文名JCK-beauty,2017.04.01,2017.12.25,任务编号：488700,￥ 200,112,创享新奇室,https://shop.epwk.com/9w56ee0vwdv1/,,,,,,,,,,,,,,,,,,,,,,,,
【品牌起名】文艺家居饰品店取名和广告语征集,https://task.epwk.com/488486/,4566人,109人,¥500,圆满完成,单人悬赏,o58db88a7e9868,"家居饰品店取名（中英文）+广告语一、具体要求:1、品牌调性：文艺范、日系美物、生活美学、用心生活、诗意栖居。2、经营范围：餐具、茶具、花束、花瓶、摆件、桌布、地垫、棉袜、钟表、梳、文具、发饰、银饰3、目标消费人群：年龄在18岁—40岁，追求小资、品质生活，喜欢文艺范、小清新，享受生活情趣的消费人群。4、名字最好取自于古诗词，最好为2字或3字。5､名称要有中英文搭配（英文名字不一定需要是现有的单词，也可以自己造词，只要和中文名字对应即可），同时附加广告语，取名最好要有相应的命名解释及故事延展。必须可以注册商标。二、知识产权说明：1、所设计的作品为原创，为第一次发布，未侵犯他人的著作权，如有侵犯他人著作权，由设计者承担所有法律责任;2、中标的设计作品，我方支付设计制作费，即拥有该作品的知识产权，包括著作权,使用权和发布权等,有权对设计作品进行修改,组合和应用;设计者不得再向其他任何地方使用该设计作品;",2017.03.31,2017.05.29,任务编号：488486,￥ 500,154,尚思维雅工作室,https://shop.epwk.com/z2nkzz762nqy/,,,,,,,,,,,,,,,,,,,,,,,,
【广告策划】鑫诚康健释义,https://task.epwk.com/488477/,2781人,26人,¥100,圆满完成,单人悬赏,o58de58c2480b3,公司经营健康食品和医护用品，请对鑫诚或是鑫诚康健释义（比如鑫...诚...）。要求：有内涵，容易记，符合行业行色。,2017.03.31,2017.04.17,任务编号：488477,￥ 100,32,vivid悦968,https://task.epwk.com/javascript:;,,,,,,,,,,,,,,,,,,,,,,,,
【品牌起名】连锁面店起名,https://task.epwk.com/488471/,2801人,127人,¥120,圆满完成,单人悬赏,o58de03f330603,地点在厦门，人均消费10-15元，品牌起名可以延伸一个典故之类的，有采用，loge及分支品牌继续合作,2017.03.31,2017.05.26,任务编号：488471,￥ 120,155,五艺之星,https://shop.epwk.com/78dljwoxp5lx/,,,,,,,,,,,,,,,,,,,,,,,,
【品牌起名】化妆品商标英文取名征集,https://task.epwk.com/488442/,3029人,56人,¥200,圆满完成,单人悬赏,mf137****7383,取化妆品商标英文名，已有中文商标（美容产品）1  、企业所属化妆品行业：目前主要经营美容专业线产品2、商标的中文名：黛妃妮（3类，已经注册，要求取个英文名字）3、英文名要求能注册4 所设计的作品必须为原创，未在国家商标局注册过（中国商标网查询地址http://sbcx.saic.gov.cn/trade/，不侵犯他人著作权，如有侵犯他人著作权的由设计者承担所有法律责任。,2017.03.31,2017.07.13,任务编号：488442,￥ 200,62,xdfswyyg,https://task.epwk.com/javascript:;,,,,,,,,,,,,,,,,,,,,,,,,
【品牌起名】高端童装品牌取名征集,https://task.epwk.com/488281/,2143人,89人,¥100,圆满完成,单人悬赏,o58dde3e9bfe94,高端童装品牌，以针织毛衫为主，产品以 舒适，健康，环保，时尚 四个元素为理念。  要求：                1、名称响亮，易记，能吸引醒目                2、名字：2-4个字之内，并可注册商标            3、附上创意说明,2017.03.31,2017.04.24,任务编号：488281,￥ 100,116,五艺之星,https://shop.epwk.com/78dljwoxp5lx/,,,,,,,,,,,,,,,,,,,,,,,,
【品牌起名】休闲熟食品牌取名,https://task.epwk.com/488184/,2088人,94人,¥100,圆满完成,单人悬赏,mf156****1573,产品涉及范围：休闲熟食，休闲零食，属于卤菜系列的。取名要求：简洁、易记，名称定位年轻人，时尚、具有活力；能够注册商标；附上名称的创意说明；,2017.03.31,2017.11.24,任务编号：488184,￥ 100,116,见证奇迹,https://shop.epwk.com/2j5jjm1k75pz/,,,,,,,,,,,,,,,,,,,,,,,,
【品牌起名】儿童影楼商标名字征集,https://task.epwk.com/488092/,3260人,124人,¥100,圆满完成,单人悬赏,o58dcbbd5bc1d9,1.要求朗朗上口，好记，好听2.可以接受英文名3.重点是要能商标注册的,2017.03.30,2017.06.18,任务编号：488092,￥ 100,159,远望镜界,https://shop.epwk.com/2j5jj2qrk5pz/,https://shop.epwk.com/2j5jj2qrk5pz/chushou/,个人,七品,36分,,,,,,,,,,,,,,,,,,,,
【公司起名】广告公司起名征集,https://task.epwk.com/488074/,3712人,122人,¥100,圆满完成,单人悬赏,旭日东升VIP,具体要求请见附件！谢谢,2017.03.30,2017.04.24,任务编号：488074,￥ 100,146,疯狂的小象.起名+logo+商标注册,https://shop.epwk.com/7lngq0zzrdmr/,https://shop.epwk.com/7lngq0zzrdmr/chushou/,个人,九品,37分,,,,,,,,,,,,,,,,,,,,
【公司起名】陕西办公家具企业起名征集,https://task.epwk.com/488008/,3013人,120人,¥300,圆满完成,单人悬赏,o58dc9ee50a2d1,陕西办公家具企业起名，企业专业做办公、酒店、教学、民用家具的生产和销售20多年历史，产品出口40多个国家和地区。现在企业准备再打造一个新的品牌进行推广，征集为新的品牌起名。,2017.03.30,2017.06.20,任务编号：488008,￥ 300,150,石枯沙老,https://task.epwk.com/javascript:;,,,,,,,,,,,,,,,,,,,,,,,,
【公司起名】烘焙公司名称征集,https://task.epwk.com/488013/,2352人,114人,¥200,圆满完成,单人悬赏,k8559****66,"烘焙公司名称征集，经营介绍： 主营蛋糕烘焙，后续有可能会有糖果出售。要求：1、字数最好是控制在2-3字2、最好能有带点卡通的感觉，后续要设计卡通形象logo3、附上创意说明。知识产权说明：1、所设计的作品为原创，为第一次发布，未侵犯他人的著作权，如有侵犯他人著作权，由设计者承担所有法律责任;2、中标的设计作品，我方支付设计制作费，即拥有该作品的知识产权，包括著作权,使用权和发布权等,有权对设计作品进行修改,组合和应用;设计者不得再向其他任何地方使用该设计作品;",2017.03.30,2020.05.31,任务编号：488013,￥ 200,142,o58d104c9b088f,https://task.epwk.com/javascript:;,,,,,,,,,,,,,,,,,,,,,,,,
【公司起名】租赁房屋公司起名,https://task.epwk.com/487929/,2524人,73人,¥100,圆满完成,单人悬赏,凌翌品牌设计,"主营是年轻人租赁房屋的，公寓式管理，类似房管家的概念，希望品牌名称新颖，有创意，需要注册！                    产品主要三类：                                            1、是专注为年轻商务一族打造。                            2、是快捷方便的租赁模式                            要求：                                            1、名称响亮，易记，文雅，有创意但不失稳重;(必需可以注册公司的)                                        2、最好有中、英文两种名称，并可注册商标                                        3、附上创意说明。                                        知识产权说明：                                            1、所设计的作品为原创，为第一次发布，未侵犯他人的著作权，如有侵犯他人著作权，由设计者承担所有法律责任;                                        2、中标的设计作品，我方支付设计制作费，即拥有该作品的知识产权，包括著作权,使用权和发布权等,有权对设计作品进行修改,组合和应用;设计者不得再向其他任何地方使用该设计作品;",2017.03.30,2017.04.17,任务编号：487929,￥ 100,90,xdfswyyg,https://task.epwk.com/javascript:;,,,,,,,,,,,,,,,,,,,,,,,,
【店铺/网店起名】饮品店命名,https://task.epwk.com/487828/,3870人,101人,¥150,圆满完成,单人悬赏,o5857****c1e8a,一家开在写字楼一楼大厅里的饮品店，主要饮品是果茶，同时也卖咖咖啡奶茶及甜品。主要客户群是白领阶层，女性偏多。希望以英文命名，中文作为辅助。比如：星巴克。请参考附件命名。特别是 gaga鲜语，Yomi+ .要求：1.简单易记，利于传播；2.时尚大气，有个性； 3.能通过商标注册；4.意思要积极正面； 5.截稿时间：3月30日 18:00,2017.03.29,2017.04.21,任务编号：487828,￥ 150,137,岁月成谶,https://shop.epwk.com/j7n383o125e1/,,,,,,,,,,,,,,,,,,,,,,,,
【品牌起名】服装品牌取名,https://task.epwk.com/487589/,5337人,163人,¥336,圆满完成,单人悬赏,mf185****2288,商标起名可注册一、名字在2-3字二、名字偏韩范些、可注册25类服装,2017.03.29,2017.10.22,任务编号：487589,￥ 336,221,明尼苏达猪工作室,https://shop.epwk.com/81n41164onp6/,,,,,,,,,,,,,,,,,,,,,,,,
,,,,,,,,,,,,,,,,,,,,,,,,,,,,,,,,,,,,,,,
【品牌起名】机械公司品牌起名,https://task.epwk.com/487586/,2818人,65人,¥200,圆满完成,单人悬赏,十点就睡,"机械公司品牌起名  《铝工业设备》            机械制造公司名称征集，本公司位于安徽                            经营介绍：各类雕刻机、刻字机制造商。  智能家具设备制造商                    现有两家公司                                    1、合肥卡星数控设备有限公司                                                                            ☆ ☆ ☆ ☆可以查看附件 ☆ ☆ ☆                            2、安徽金田加贝智能设备有限公司现在 金田加贝 旗下 打算开展《铝工业设备》的品牌   故此 求名                            要求：                                            1、名称响亮，易记，文雅，有创意但不失稳重;(必需可以注册公司的)                                        2、最好有中、英文两种名称，并可注册商标                                        3、有音译效果 例如MultiCam—麦迪克、PARKER—派克4、要洋气一点的。让人感觉 像 国外品牌                            知识产权说明：                                            1、所设计的作品为原创，为第一次发布，未侵犯他人的著作权，如有侵犯他人著作权，由设计者承担所有法律责任;                                        2、中标的设计作品，我方支付设计制作费，即拥有该作品的知识产权，包括著作权,使用权和发布权等,有权对设计作品进行修改,组合和应用;设计者不得再向其他任何地方使用该设计作品;",2017.03.29,2017.06.13,任务编号：487586,￥ 200,90,月雾,https://task.epwk.com/javascript:;,,,,,,,,,,,,,,,,,,,,,,,,
【公司起名】公司起名、品牌起名、网站域名,https://task.epwk.com/487368/,3351人,72人,¥400,圆满完成,单人悬赏,o58d9ea626b2df,公司主营业务：销售水果、蔬菜、干果、杂粮等农产品、肉蛋奶、以及其他的食品类，以销售为主；需求：1、公司名称、品牌名称、公司网站的域名（要求不带数字、域名选.com后缀），一共三项，请投稿时写全；            2、名称里不要体现农产品、食品等相关的字眼，方便后期的业务拓展，如：汇源、娃哈哈这样的名称；            3、品牌名称最好2个字，最多不超过3个字，最好与公司名称关联；           4、名称和域名要求没有被占用，需要提供查询截图。,2017.03.28,2017.04.19,任务编号：487368,￥ 400,95,o58d0ffd506af3,https://task.epwk.com/javascript:;,,,,,,,,,,,,,,,,,,,,,,,,
【品牌起名】服饰品牌起名,https://task.epwk.com/486603/,2857人,66人,¥100,圆满完成,单人悬赏,flytoski9394,服饰品牌名：都市时尚服装原创轻奢品牌，小资定位，20-35岁消费人群，产品线以女装为主，男装为辅要求：1、品牌名要创意、大气、顺口，中文2-4字，有英文（法文）更佳；2、做全国连锁，名字要有范，不俗气，不含生僻字；3、也可以英文入手，取一个含义不错的英文（法文）名，音译成中文；4、要求所取名字未被注册过25类（服装）商标；5、对名字意涵做简介说明；6、有logo设计，入选几率更高；,2017.03.25,2017.04.24,任务编号：486603,￥ 100,84,疯狂的小象.起名+logo+商标注册,https://shop.epwk.com/7lngq0zzrdmr/,https://shop.epwk.com/7lngq0zzrdmr/chushou/,个人,九品,37分,,,,,,,,,,,,,,,,,,,,
【店铺/网店起名】网站起名字,https://task.epwk.com/487221/,2969人,85人,¥300,圆满完成,单人悬赏,快传同城,"网站起名字，可注册，主要有微信、微博、网红、公众号、Q等新媒体类第三方平台要求：1、名字4个字之内，不能超过4个字。2、要有创意、好记。3、必须能注册商标使用。4、35类知识产权说明：1、所设计的作品为原创，为第一次发布，未侵犯他人的著作权，如有侵犯他人著作权，由设计者承担所有法律责任;2、中标的设计作品，我方支付设计制作费，即拥有该作品的知识产权，包括著作权,使用权和发布权等,有权对设计作品进行修改,组合和应用;设计者不得再向其他任何地方使用该设计作品;",2017.03.28,2017.04.09,任务编号：487221,￥ 300,117,万思新的商铺,https://shop.epwk.com/09drjxwl153w/,,,,,,,,,,,,,,,,,,,,,,,,
【店铺/网店起名】女装店商标取名,https://task.epwk.com/487297/,3182人,84人,¥100,圆满完成,单人悬赏,o58d9cd812ff38,"我是女装店，时装.英文名，越短越好，好记，容易上口，因为并不是每个人都认识英文单词，英文字母基本都认识，你像HM，别人问你在哪买的衣服，回答hm，如果搞个长的英文单词，人家也不认识，读不出口。如果能有中文直译最好，没有就算。比如：moods 中文名 魔斗士1、所设计的作品为原创，为第一次发布，未侵犯他人的著作权，如有侵犯他人著作权，由设计者承担所有法律责任;2、中标的设计作品，我方支付设计制作费，即拥有该作品的知识产权，包括著作权,使用权和发布权等,有权对设计作品进行修改,组合和应用;设计者不得再向其他任何地方使用该设计作品;",2017.03.28,2017.04.16,任务编号：487297,￥ 100,107,见证奇迹,https://shop.epwk.com/2j5jjm1k75pz/,,,,,,,,,,,,,,,,,,,,,,,,
